speaker,start_time,end_time,emotion,scores,text
MATT,02:53:50,02:53:54,sad,"{'angry': 0.0003406722389627248, 'calm': 0.3886752724647522, 'disgust': 0.0066405730322003365, 'fearful': 0.01589970290660858, 'happy': 0.0017315075965598226, 'sad': 0.5858542323112488, 'surprised': 0.000858086277730763}","""Honestly, this is even more than would be easier. I would normally just fly straight there, but--"
LAURA,02:53:54,02:53:56,disgust,"{'angry': 0.012651695869863033, 'calm': 0.0003960933245252818, 'disgust': 0.9455426931381226, 'fearful': 0.003237389028072357, 'happy': 0.02614409476518631, 'sad': 0.0032239756546914577, 'surprised': 0.00880400836467743}","Fly! That's what you do, you fly!"
MATT,02:53:56,02:53:58,calm,"{'angry': 0.004934259224683046, 'calm': 0.8535073399543762, 'disgust': 0.013072136789560318, 'fearful': 0.005805016960948706, 'happy': 0.10466404259204865, 'sad': 0.01681099273264408, 'surprised': 0.0012062012683600187}","""Yes."""
MATT,02:53:58,02:55:31,disgust,"{'angry': 0.08998557180166245, 'calm': 0.0111717963591218, 'disgust': 0.4255789518356323, 'fearful': 0.0779963955283165, 'happy': 0.374067097902298, 'sad': 0.018427366390824318, 'surprised': 0.0027727806009352207}","""But... Onward."" And with that, Viridian leads you out on the northwestern side of the village, breaking the outer treeline, into the dense jungle itself. Now, you guys push in for a short time, before you begin to realize the jungle itself beginning to grow darker, even more dense. The smells, the vegetation, and humid air shifting to an even colder, almost metallic scent. Unnatural. Like a wet iron-type smell to the air. No more than probably an hour into this journey or so, Viridian puts a hand up for a bit and points, and goes, ""Those vines there, the ones with the somewhat ruddy texture towards the bottom points,"" and you see across the multiple types of vine tangles around there, and large branches that are reaching, and jamming, intertwining with each other, you see some vines, of a thinner variety, that, as opposed to winding around, they dangle straight, almost like curtains. But they turn reddish, as they get closer and closer to the tip. She points them out, ""Avoid those, like, keep a distance. They are carnivorous."" And as you glance up, you can see, there's a lot of the moss, the thick, dark moss, that grows up in these parts of the trees, on these vines, the moss, looks less moss, and you now get to see it, as it looks like strips of decaying flesh."
LAURA,02:55:31,02:55:32,fearful,"{'angry': 0.0010205104481428862, 'calm': 0.004417060408741236, 'disgust': 0.0036908984184265137, 'fearful': 0.9258167743682861, 'happy': 0.02290790155529976, 'sad': 0.041722558438777924, 'surprised': 0.0004243108269292861}",Whoa!
MATT,02:55:32,02:55:40,disgust,"{'angry': 0.03216421604156494, 'calm': 0.0038737510330975056, 'disgust': 0.911441445350647, 'fearful': 0.006780411582440138, 'happy': 0.033584460616111755, 'sad': 0.010326615534722805, 'surprised': 0.0018291082233190536}","And occasionally, in some of these knots and tangles, you can see a bone protruding, or remnants of some sort of decaying creature's remnants."
TALIESIN,02:55:40,02:55:43,disgust,"{'angry': 0.002651833463460207, 'calm': 0.0005428220611065626, 'disgust': 0.9789190292358398, 'fearful': 0.0022159116342663765, 'happy': 0.0024218729231506586, 'sad': 0.010972317308187485, 'surprised': 0.0022761537693440914}",Wow.
MATT,02:55:43,02:55:54,happy,"{'angry': 0.017144110053777695, 'calm': 0.04420187696814537, 'disgust': 0.10235210508108139, 'fearful': 0.18925827741622925, 'happy': 0.5965245366096497, 'sad': 0.04657425358891487, 'surprised': 0.003944877069443464}",Used the same word twice in the same phrase. Improvisation! But the mist itself seems to be taking on this iron-like taste. As you continue to push forward.
MARISHA,02:55:54,02:56:03,sad,"{'angry': 0.001367816119454801, 'calm': 0.039542920887470245, 'disgust': 0.18781067430973053, 'fearful': 0.023861203342676163, 'happy': 0.003079341957345605, 'sad': 0.7431955337524414, 'surprised': 0.0011425202246755362}",Does it feel like the bloody remains are contributing to that irony taste? Or does that feel separate?
MATT,02:56:03,02:56:20,disgust,"{'angry': 0.0352327935397625, 'calm': 0.007289185654371977, 'disgust': 0.5611233115196228, 'fearful': 0.036064278334379196, 'happy': 0.3313872814178467, 'sad': 0.018279731273651123, 'surprised': 0.01062345877289772}","There's similarities in that taste, but it's not blood. You know the taste of blood very well. You've taste a lot of your own in the past. But it's different. This is a sharper, and more-- more unnatural scent."
LAURA,02:56:20,02:56:26,disgust,"{'angry': 0.03779830411076546, 'calm': 0.027453085407614708, 'disgust': 0.8145674467086792, 'fearful': 0.017059603706002235, 'happy': 0.06186194345355034, 'sad': 0.039378393441438675, 'surprised': 0.0018812386551871896}","Does the presence, the watching, does it feel stronger?"
MATT,02:56:26,02:56:27,sad,"{'angry': 0.00014899368397891521, 'calm': 0.009032965637743473, 'disgust': 0.007813965901732445, 'fearful': 0.027629347518086433, 'happy': 0.00031405992922373116, 'sad': 0.9545222520828247, 'surprised': 0.0005385097465477884}",It feels unchanged.
LAURA,02:56:27,02:56:32,sad,"{'angry': 0.004610841162502766, 'calm': 0.04832632839679718, 'disgust': 0.31750038266181946, 'fearful': 0.08055469393730164, 'happy': 0.01662849821150303, 'sad': 0.531154990196228, 'surprised': 0.001224303850904107}",Okay.
MATT,02:56:32,02:57:43,disgust,"{'angry': 0.06266488134860992, 'calm': 0.03437070548534393, 'disgust': 0.5441309213638306, 'fearful': 0.14584758877754211, 'happy': 0.11347455531358719, 'sad': 0.09761041402816772, 'surprised': 0.001900976407341659}","As you begin to continue, you can see the moisture in the surrounding mists growing thicker. The tree trunks themselves are now growing slick with the liquid in the air. You can see drops of condensed moisture, falling from branches, and overhead areas. It is not a rainy day, but occasionally, there is enough moisture falling from the boughs above, that it feels like a gentle drizzle. You can see now, as the ground begins to roll with the terrain, there are little pools beginning to form. Dark, pools of liquid. At this point, Viridian once again places a hand up into the air to keep you all at bay and goes, ""Now, some of these pools contain just liquid, but there are some creatures that reside beneath them and exude a sticky substance, to attempt to trap you. Try your best to avoid touching the pools of liquid. Understood?"""
SAM,02:57:43,02:57:44,disgust,"{'angry': 0.0047169881872832775, 'calm': 0.0008230327512137592, 'disgust': 0.8218638300895691, 'fearful': 0.011321230791509151, 'happy': 0.01395760104060173, 'sad': 0.028261667117476463, 'surprised': 0.11905563622713089}","Yes, yeah."
LAURA,02:57:44,02:57:45,fearful,"{'angry': 0.000761457544285804, 'calm': 0.001413969206623733, 'disgust': 0.010482041165232658, 'fearful': 0.6405139565467834, 'happy': 0.0020534773357212543, 'sad': 0.3435465693473816, 'surprised': 0.0012285200646147132}","Wait, what? I wasn't listening."
SAM,02:57:45,02:57:47,fearful,"{'angry': 0.0006942764157429338, 'calm': 0.029192866757512093, 'disgust': 0.013331647962331772, 'fearful': 0.5143381953239441, 'happy': 0.01225471030920744, 'sad': 0.42911896109580994, 'surprised': 0.0010693465592339635}",Don't touch the pools of liquid!
LAURA,02:57:47,02:57:48,angry,"{'angry': 0.46340975165367126, 'calm': 0.0013865521177649498, 'disgust': 0.02097068354487419, 'fearful': 0.3204715847969055, 'happy': 0.1899554580450058, 'sad': 0.0022268786560744047, 'surprised': 0.0015791235491633415}",Where?
TRAVIS,02:57:48,02:57:49,sad,"{'angry': 0.00028459634631872177, 'calm': 0.0024654222652316093, 'disgust': 0.011927291750907898, 'fearful': 0.1200992688536644, 'happy': 0.0005594843532890081, 'sad': 0.863905131816864, 'surprised': 0.0007587932050228119}",On the floor.
ASHLEY,02:57:49,02:57:51,disgust,"{'angry': 0.0015247673727571964, 'calm': 0.000750469567719847, 'disgust': 0.9454657435417175, 'fearful': 0.005069814156740904, 'happy': 0.0017821306828409433, 'sad': 0.043285924941301346, 'surprised': 0.0021211474668234587}",All about.
TRAVIS,02:57:51,02:57:52,sad,"{'angry': 0.003435971448197961, 'calm': 0.030834879726171494, 'disgust': 0.33975857496261597, 'fearful': 0.09493712335824966, 'happy': 0.01902655139565468, 'sad': 0.5106860399246216, 'surprised': 0.0013208728050813079}",Maybe listen a little better.
LAURA,02:57:52,02:57:58,sad,"{'angry': 0.000514766841661185, 'calm': 0.019658250734210014, 'disgust': 0.036550283432006836, 'fearful': 0.17491531372070312, 'happy': 0.005956745706498623, 'sad': 0.7615575790405273, 'surprised': 0.0008470438187941909}","I'm sorry, I was just really checking out my awesome charm, is all. Okay."
MATT,02:57:58,02:58:15,angry,"{'angry': 0.495746910572052, 'calm': 0.0018878242699429393, 'disgust': 0.41218796372413635, 'fearful': 0.011066077277064323, 'happy': 0.0745120495557785, 'sad': 0.0023048906587064266, 'surprised': 0.0022942337673157454}","""Understood."" You watch as Viridian's body contorts into a small spiral before there is a shift of greenish-brown energy, and suddenly wings (flapping) come out, and where once there was Viridian, there is now an owl. (gasping)"
MATT,02:58:15,02:58:21,angry,"{'angry': 0.4038829207420349, 'calm': 0.02792344056069851, 'disgust': 0.14196069538593292, 'fearful': 0.0286355372518301, 'happy': 0.3903483748435974, 'sad': 0.004957085009664297, 'surprised': 0.00229197321459651}",Goes and lands on an upper branch to watch all of you. And she's just keeping an eye.
SAM,02:58:21,02:58:22,sad,"{'angry': 0.0002436484064674005, 'calm': 0.0015081297606229782, 'disgust': 0.015352197922766209, 'fearful': 0.03716243803501129, 'happy': 0.00024003713042475283, 'sad': 0.9443623423576355, 'surprised': 0.0011312445858493447}",Oh.
TRAVIS,02:58:22,02:58:24,surprised,"{'angry': 0.005392197519540787, 'calm': 0.010986578650772572, 'disgust': 0.020318858325481415, 'fearful': 0.0895351767539978, 'happy': 0.37683922052383423, 'sad': 0.026716602966189384, 'surprised': 0.47021135687828064}","Well, that's convenient."
SAM,02:58:24,02:58:26,fearful,"{'angry': 0.002738939132541418, 'calm': 0.006888286676257849, 'disgust': 0.02523566409945488, 'fearful': 0.6161150336265564, 'happy': 0.09986944496631622, 'sad': 0.1379663199186325, 'surprised': 0.11118637025356293}",Are we supposed to keep going?
TRAVIS,02:58:26,02:58:29,surprised,"{'angry': 0.0020373675506561995, 'calm': 0.000999194453470409, 'disgust': 0.0019699311815202236, 'fearful': 0.0020179201383143663, 'happy': 0.027987554669380188, 'sad': 0.0013065420789644122, 'surprised': 0.9636815786361694}",I believe in the direction that she flew?
MATT,02:58:29,02:58:34,happy,"{'angry': 0.004401635844260454, 'calm': 0.015877049416303635, 'disgust': 0.042522773146629333, 'fearful': 0.32452988624572754, 'happy': 0.5132949948310852, 'sad': 0.06447090208530426, 'surprised': 0.03490279242396355}","You might imagine so. You guys begin-- first off, what is the marching order, if you don't mind?"
ASHLEY,02:58:34,02:58:36,surprised,"{'angry': 0.003820301266387105, 'calm': 0.004697720054537058, 'disgust': 0.003633154323324561, 'fearful': 0.007805182132869959, 'happy': 0.2677356004714966, 'sad': 0.0025741567369550467, 'surprised': 0.7097339034080505}",Oh boy.
SAM,02:58:36,02:58:39,sad,"{'angry': 0.00015149026876315475, 'calm': 0.008288337849080563, 'disgust': 0.005622371565550566, 'fearful': 0.07561913877725601, 'happy': 0.0006443985039368272, 'sad': 0.9089820384979248, 'surprised': 0.0006921213935129344}",Who's good in the out of doors?
TRAVIS,02:58:39,02:58:40,happy,"{'angry': 0.0019833052065223455, 'calm': 0.014768105931580067, 'disgust': 0.006784934550523758, 'fearful': 0.047086022794246674, 'happy': 0.9212360978126526, 'sad': 0.004849875811487436, 'surprised': 0.0032916483469307423}",The outer door!
MARISHA,02:58:40,02:58:42,sad,"{'angry': 0.00013267651956994087, 'calm': 0.0034474723506718874, 'disgust': 0.0074013518169522285, 'fearful': 0.01429628673940897, 'happy': 0.00013305146421771497, 'sad': 0.9737382531166077, 'surprised': 0.0008510361658409238}",I'm always good to go up front somewhere.
TALIESIN,02:58:42,02:58:45,sad,"{'angry': 0.0019611804746091366, 'calm': 0.012652866542339325, 'disgust': 0.32151272892951965, 'fearful': 0.06447921693325043, 'happy': 0.005980732385069132, 'sad': 0.5922540426254272, 'surprised': 0.0011591656366363168}",I'll go right behind. Keep the perception high.
MATT,02:58:45,02:58:48,surprised,"{'angry': 0.0033043751027435064, 'calm': 0.001917568501085043, 'disgust': 0.0032503409311175346, 'fearful': 0.005108639132231474, 'happy': 0.11731097847223282, 'sad': 0.0018344647251069546, 'surprised': 0.8672735691070557}",Caduceus and Beauregard up front. Who's behind them?
TRAVIS,02:58:48,02:58:49,disgust,"{'angry': 0.006176421418786049, 'calm': 0.0009566671797074378, 'disgust': 0.9729059338569641, 'fearful': 0.003062114119529724, 'happy': 0.00641931127756834, 'sad': 0.009149473160505295, 'surprised': 0.001330017577856779}",I'll go behind Beau.
LAURA,02:58:49,02:58:50,sad,"{'angry': 0.0001280726573895663, 'calm': 0.013118918053805828, 'disgust': 0.0026003390084952116, 'fearful': 0.03409896418452263, 'happy': 0.0002930357586592436, 'sad': 0.9486579895019531, 'surprised': 0.0011026585707440972}",I'll go behind Fjord.
ASHLEY,02:58:50,02:58:52,happy,"{'angry': 0.0038117822259664536, 'calm': 0.002870554104447365, 'disgust': 0.0031865432392805815, 'fearful': 0.009081115014851093, 'happy': 0.5194629430770874, 'sad': 0.0015109421219676733, 'surprised': 0.46007612347602844}",I'll take the caboose.
MATT,02:58:52,02:58:54,happy,"{'angry': 0.002570630516856909, 'calm': 0.005163564346730709, 'disgust': 0.003966163378208876, 'fearful': 0.016108255833387375, 'happy': 0.6559309959411621, 'sad': 0.0028530259151011705, 'surprised': 0.31340742111206055}",Yasha caboose.
SAM,02:58:54,02:58:55,happy,"{'angry': 0.0046077631413936615, 'calm': 0.003459132742136717, 'disgust': 0.01379381027072668, 'fearful': 0.012513707391917706, 'happy': 0.9468357563018799, 'sad': 0.0015769327292218804, 'surprised': 0.01721297763288021}",Just stick me there anywhere.
MATT,02:58:55,02:58:57,sad,"{'angry': 0.0011022642720490694, 'calm': 0.0013467783574014902, 'disgust': 0.06390035152435303, 'fearful': 0.269397497177124, 'happy': 0.00166748883202672, 'sad': 0.6611750721931458, 'surprised': 0.0014105289010331035}",All right.
LIAM,02:58:57,02:58:59,sad,"{'angry': 0.0049935197457671165, 'calm': 0.3034910261631012, 'disgust': 0.1847308874130249, 'fearful': 0.054839521646499634, 'happy': 0.04557257518172264, 'sad': 0.4044656455516815, 'surprised': 0.0019068405963480473}",Danger zone.
MATT,02:58:59,02:59:02,calm,"{'angry': 0.0019323203014209867, 'calm': 0.7939542531967163, 'disgust': 0.013400246389210224, 'fearful': 0.030447324737906456, 'happy': 0.0749703198671341, 'sad': 0.08411195874214172, 'surprised': 0.00118357059545815}","So we'll have Caleb and Veth right in front of Yasha, further back?"
LIAM,02:59:02,02:59:04,surprised,"{'angry': 0.002402357989922166, 'calm': 0.004154783673584461, 'disgust': 0.0027119216974824667, 'fearful': 0.009906317107379436, 'happy': 0.27778780460357666, 'sad': 0.0028548019472509623, 'surprised': 0.7001820206642151}",Sure.
MATT,02:59:04,02:59:48,happy,"{'angry': 0.3965212106704712, 'calm': 0.011822961270809174, 'disgust': 0.15340806543827057, 'fearful': 0.03404872491955757, 'happy': 0.3983578681945801, 'sad': 0.0038657602854073048, 'surprised': 0.0019753873348236084}","Okay, it's doesn't have to be single file. So I'm doing this two, two, two, one. Now you guys all begin to carefully, nimbly as you can, follow the path of the roots and the base of trees, to avoid any of the slushy, earthy ground, or the water pits themselves. And there's quite a bit of this, and you can watch, as you continue, these pools get larger, and eventually begin to completely envelop and fill the spaces between the trees, these troughs where the roots create the outer crown, or the rim, before the pool forms. And it is black, brackish, and in some cases, like a slick, oily surface. I need everyone to make a dexterity saving throw."
TALIESIN,02:59:48,02:59:54,calm,"{'angry': 0.004597087856382132, 'calm': 0.6198223829269409, 'disgust': 0.076339490711689, 'fearful': 0.025093358010053635, 'happy': 0.023265572264790535, 'sad': 0.2495727241039276, 'surprised': 0.0013093793531879783}","Before we enter into this, I would love to cast a spell."
TALIESIN,02:59:54,03:00:01,happy,"{'angry': 0.017833353951573372, 'calm': 0.023029431700706482, 'disgust': 0.08033104985952377, 'fearful': 0.01956219971179962, 'happy': 0.848603367805481, 'sad': 0.006204504519701004, 'surprised': 0.004436098504811525}","Before we all enter. I'm going to cast, if that's all right-- where are we?"
ASHLEY,03:00:01,03:00:06,sad,"{'angry': 0.00013591372407972813, 'calm': 0.004227996803820133, 'disgust': 0.004432904068380594, 'fearful': 0.04719368368387222, 'happy': 0.0002832080062944442, 'sad': 0.9428468346595764, 'surprised': 0.0008794459863565862}","(pulls something, making a high-pitched zipper sound) I saw you around here somewhere."
MARISHA,03:00:06,03:00:07,sad,"{'angry': 0.00020050753664691, 'calm': 0.0029466336127370596, 'disgust': 0.018094174563884735, 'fearful': 0.009251859970390797, 'happy': 0.00013605332060251385, 'sad': 0.9682236909866333, 'surprised': 0.0011471100151538849}",I don't know!
SAM,03:00:07,03:00:09,fearful,"{'angry': 0.0009601421770639718, 'calm': 0.0011679354356601834, 'disgust': 0.010725138708949089, 'fearful': 0.8152927756309509, 'happy': 0.0036897582467645407, 'sad': 0.16734187304973602, 'surprised': 0.0008223801269195974}",What a cool sound!
TRAVIS,03:00:09,03:00:10,sad,"{'angry': 0.0010923679219558835, 'calm': 0.0013921130448579788, 'disgust': 0.03900539502501488, 'fearful': 0.3818291127681732, 'happy': 0.001934716128744185, 'sad': 0.5734988451004028, 'surprised': 0.0012473954120650887}",(ascending glissando)
SAM,03:00:10,03:00:11,sad,"{'angry': 0.0012230388820171356, 'calm': 0.0019070011330768466, 'disgust': 0.15096211433410645, 'fearful': 0.2421988546848297, 'happy': 0.003613522509112954, 'sad': 0.5984852313995361, 'surprised': 0.0016102365916594863}",What was it?
TALIESIN,03:00:11,03:00:13,happy,"{'angry': 0.0029811901040375233, 'calm': 0.02320779860019684, 'disgust': 0.006732444744557142, 'fearful': 0.08788765966892242, 'happy': 0.8531179428100586, 'sad': 0.010354096069931984, 'surprised': 0.015718868002295494}","I don't know what it was, but it was really cool."
"SAM, MARISHA",03:00:13,03:00:14,disgust,"{'angry': 0.004048694856464863, 'calm': 0.0005865978309884667, 'disgust': 0.5403145551681519, 'fearful': 0.008333099074661732, 'happy': 0.009011173620820045, 'sad': 0.023762471973896027, 'surprised': 0.41394346952438354}",Was it you?
ASHLEY,03:00:14,03:00:15,disgust,"{'angry': 0.0031764167360961437, 'calm': 0.0006283741677179933, 'disgust': 0.97255939245224, 'fearful': 0.0037560388445854187, 'happy': 0.006138167344033718, 'sad': 0.01160562876611948, 'surprised': 0.0021359252277761698}","Yeah, it's me. (laughter)"
ASHLEY,03:00:15,03:00:17,disgust,"{'angry': 0.0019563138484954834, 'calm': 0.0005970452912151814, 'disgust': 0.9362399578094482, 'fearful': 0.010579894296824932, 'happy': 0.005814155098050833, 'sad': 0.03708944469690323, 'surprised': 0.007723063230514526}",I'm just playing with--
MARISHA,03:00:17,03:00:18,surprised,"{'angry': 0.0037339935079216957, 'calm': 0.001764460583217442, 'disgust': 0.003488975577056408, 'fearful': 0.012094817124307156, 'happy': 0.4076510965824127, 'sad': 0.0016189701855182648, 'surprised': 0.5696476697921753}","Can you do that with your mouth? Oh. Ah, cool."
ASHLEY,03:00:18,03:00:21,disgust,"{'angry': 0.0024487695191055536, 'calm': 0.0026269934605807066, 'disgust': 0.6619407534599304, 'fearful': 0.052647825330495834, 'happy': 0.005084697622805834, 'sad': 0.2736213207244873, 'surprised': 0.0016296198591589928}","Yeah, it was me. (laughter)"
TRAVIS,03:00:21,03:00:23,disgust,"{'angry': 0.0026407616678625345, 'calm': 0.0005062447162345052, 'disgust': 0.9663269519805908, 'fearful': 0.005362743511795998, 'happy': 0.0026910300366580486, 'sad': 0.02070191502571106, 'surprised': 0.0017703283810988069}",(long scratching sound)
MATT,03:00:23,03:00:24,disgust,"{'angry': 0.0016879304312169552, 'calm': 0.0005234782584011555, 'disgust': 0.9509381055831909, 'fearful': 0.005770297255367041, 'happy': 0.0017345254309475422, 'sad': 0.036848634481430054, 'surprised': 0.0024969393853098154}",What are you casting?
TALIESIN,03:00:24,03:00:27,happy,"{'angry': 0.003468193579465151, 'calm': 0.006989773362874985, 'disgust': 0.0014030667953193188, 'fearful': 0.0035579863470047712, 'happy': 0.9819564819335938, 'sad': 0.0002559138520155102, 'surprised': 0.002368503948673606}","Apparently I got rid of it; I didn't think I did. But, nope."
TALIESIN,03:00:27,03:00:29,happy,"{'angry': 0.0012075996492058039, 'calm': 0.0015161116607487202, 'disgust': 0.001393648562952876, 'fearful': 0.008697057142853737, 'happy': 0.9781478643417358, 'sad': 0.0003613396256696433, 'surprised': 0.00867637898772955}",Never mind.
TRAVIS,03:00:29,03:00:30,happy,"{'angry': 0.002661145990714431, 'calm': 0.004945913329720497, 'disgust': 0.007800082676112652, 'fearful': 0.04150737449526787, 'happy': 0.9275238513946533, 'sad': 0.003187294350937009, 'surprised': 0.01237428653985262}",Dexterity saving throws?
MATT,03:00:30,03:00:36,happy,"{'angry': 0.021907974034547806, 'calm': 0.08977995067834854, 'disgust': 0.09320730715990067, 'fearful': 0.024206535890698433, 'happy': 0.7523255944252014, 'sad': 0.014068766497075558, 'surprised': 0.0045039234682917595}","Yes, everybody. As you're all just, independently traversing the space."
MATT,03:00:36,03:00:38,calm,"{'angry': 0.001051645609550178, 'calm': 0.7050729393959045, 'disgust': 0.017911385744810104, 'fearful': 0.009231452830135822, 'happy': 0.004532757215201855, 'sad': 0.26124852895736694, 'surprised': 0.0009512422257103026}",19.
MATT,03:00:38,03:00:42,happy,"{'angry': 0.0013662896817550063, 'calm': 0.024124400690197945, 'disgust': 0.0018681857036426663, 'fearful': 0.009721722453832626, 'happy': 0.946470320224762, 'sad': 0.0018348380690440536, 'surprised': 0.014614256098866463}",17. Jester?
MATT,03:00:42,03:00:44,calm,"{'angry': 0.0009709580335766077, 'calm': 0.9895379543304443, 'disgust': 0.0006322110421024263, 'fearful': 0.0004729044740088284, 'happy': 0.0020455848425626755, 'sad': 0.005932939704507589, 'surprised': 0.0004074584285262972}",Veth?
MATT,03:00:44,03:00:45,sad,"{'angry': 0.0015248780837282538, 'calm': 0.04160969331860542, 'disgust': 0.06929408758878708, 'fearful': 0.21912126243114471, 'happy': 0.012859169393777847, 'sad': 0.6548110842704773, 'surprised': 0.0007798498263582587}",Yasha?
MATT,03:00:45,03:00:47,sad,"{'angry': 0.006222008261829615, 'calm': 0.14146411418914795, 'disgust': 0.17650796473026276, 'fearful': 0.14838039875030518, 'happy': 0.22486990690231323, 'sad': 0.2928163409233093, 'surprised': 0.009739250876009464}","All right, Caduceus?"
TRAVIS,03:00:47,03:00:48,calm,"{'angry': 0.0019443267956376076, 'calm': 0.8624661564826965, 'disgust': 0.018314696848392487, 'fearful': 0.005405419040471315, 'happy': 0.006699197925627232, 'sad': 0.10435979813337326, 'surprised': 0.0008103579748421907}",Is he sleeping?
MARISHA,03:00:48,03:00:55,disgust,"{'angry': 0.02406594343483448, 'calm': 0.0012510413071140647, 'disgust': 0.8586797118186951, 'fearful': 0.038152534514665604, 'happy': 0.05428272858262062, 'sad': 0.018373213708400726, 'surprised': 0.0051948437467217445}","(chokes) 21. Sorry! Inhaled. A little bit in the wrong-- it's my spit, sorry."
MATT,03:00:55,03:01:15,angry,"{'angry': 0.4773921072483063, 'calm': 0.0020104784052819014, 'disgust': 0.08153016120195389, 'fearful': 0.019607705995440483, 'happy': 0.41304337978363037, 'sad': 0.0010337193962186575, 'surprised': 0.005382446572184563}","All right. All of you managed to, for the most part, keep it pretty solid going through. Caduceus, at one point you do step up onto one ridge of a root, and it's a bit slicker than you expect for the momentum that you're pushing forward on. And as you do, you catch yourself, but your foot can't help but (splash) beneath the surface. Roll a d6 for me."
TRAVIS,03:01:15,03:01:17,sad,"{'angry': 0.00023575504019390792, 'calm': 0.0020826461259275675, 'disgust': 0.027763890102505684, 'fearful': 0.013354458846151829, 'happy': 0.00017867640417534858, 'sad': 0.9551964998245239, 'surprised': 0.001188097521662712}",Shit.
MATT,03:01:17,03:01:22,happy,"{'angry': 0.013720665127038956, 'calm': 0.24071326851844788, 'disgust': 0.0233727116137743, 'fearful': 0.01998073048889637, 'happy': 0.6916371583938599, 'sad': 0.0089824004098773, 'surprised': 0.0015929872170090675}",Six. Your foot breaks the surface (sloshing).
TALIESIN,03:01:22,03:01:23,fearful,"{'angry': 0.0028894797433167696, 'calm': 0.001186145469546318, 'disgust': 0.014880605973303318, 'fearful': 0.922275960445404, 'happy': 0.01569145731627941, 'sad': 0.04247194528579712, 'surprised': 0.000604404543992132}","Oh, for fuck's sake."
MATT,03:01:23,03:01:27,sad,"{'angry': 0.0029106903821229935, 'calm': 0.14235365390777588, 'disgust': 0.08097254484891891, 'fearful': 0.23667123913764954, 'happy': 0.05445141717791557, 'sad': 0.4814305603504181, 'surprised': 0.0012098482111468911}",(sloshing) And will not withdraw.
ASHLEY,03:01:27,03:01:30,sad,"{'angry': 0.0016672218916937709, 'calm': 0.0012269335566088557, 'disgust': 0.3943748474121094, 'fearful': 0.07445376366376877, 'happy': 0.001568036270327866, 'sad': 0.5245238542556763, 'surprised': 0.0021853637881577015}","Can I try to, wait, where are you? No, you're in the front."
