speaker,start_time,end_time,text
MATT,00:00:00,00:00:24,"Hello everyone. My name is Matthew Mercer, voice actor and Dungeon Master for Critical Role on Geek & Sundry, where I take a bunch of other voice actors and run them through a fantastical fantasy adventure through the world of Dungeons & Dragons. We play every Thursday at 7:00pm Pacific Standard Time on Geek & Sundry's Twitch stream. Please come watch us live if you have the opportunity. Back episodes and future episodes will be uploaded on the Geek & Sundry website. You can also check them out there. In the meantime, enjoy!"
MATT,00:00:24,00:01:09,"Welcome to first episode of Critical Role, and what this basically is is a continuation of our weekly D&D game. Me and a bunch of other likely nerdy and enjoyable voice actors gathering around, rolling some dice, killing some creatures, having some adventure. Now we have the pleasure of bringing it on the stream for you to watch, enjoy, and occasionally interact with. Before we get to that, to give you a little backstory on the characters you'll be seeing this evening, we're going to play some videos for you in a second. Do note for all you hardcore gamers out there, a lot of this is house-ruled, loosey-goosey having a good time. So all you number crunchers, stop paying attention there, just have fun with it. Nevertheless, we have some background story on many of the characters you'll be seeing this evening to help you jump into the story. Let's go ahead and enjoy those in a minute, then we'll introduce the players. So have fun!"
TRAVIS,00:01:09,00:01:30,"Right, listen up! If you have ale, then you have a friend in Grog Strongjaw! A goliath of towering height and size, this barbarian has an appetite for the two great loves in his life: combat, women, and ale! [record scratch]"
TRAVIS,00:01:30,00:02:57,"Wait. Easily the brains of the group, Grog is often consulted for his vast knowledge of shapes, colors, and shiny things! Also ale. In his early years, armed with his two-handed greataxe, Grog often enjoyed proving his might amongst the ranks of his family's wandering herd. But after coming upon an unsuspecting elderly gnome in the woods, he objected to the killing of such an innocent life. A creature of impulse, Grog felt only pity for this-- well, this terrified little thing. And his disobedience cost him dearly. Beaten bloody, and banished by the herd leader, his Uncle Kevdak, Grog was abandoned and left to die. Exiled from his herd, it was then that the relative of the very gnome he fought to save, saved him. It was the kindness of a gnome cleric named Pike that healed Grog, bringing him back from death's edge. And they have remained close friends ever since. Most nights, Grog can be found challenging entire taverns to wrestling matches! Or accompanying Scanlan to the nearest house where you pay for lady favors. Also ale!"
MARISHA,00:02:57,00:03:14,"A first impression of Keyleth would leave you with little information on the half-elven druid. You might even think that her social awkwardness due to her sheltered upbringing is kind of sweet. Of course, it would be unwise underestimate her based on first impressions. [thunder crack]"
MARISHA,00:03:14,00:05:01,"Under that un-intimidating petite frame is a vicious beast waiting to be unleashed, whose natural powers have made even the fiercest of champions pee their pants, literally! Born to the Air Tribe of the Ashari people, Keyleth was raised with a deep love of nature and the elemental magics. It is her people's inherent duty to protect the delicate areas in Tal'Dorei where the four elemental planes begin to bleed with this realm. Since she was a little girl, she had quite a knack for air manipulation and beast shaping abilities. Well, if you consider kittens and flying squirrels to be little beasts. Which, I do. Anyways, it wasn't long before the headmaster of the tribe, her father, Korren, realized her true prodigious abilities and she was inveterated to succeed him as the next headmaster. Just like that, her jovial childhood was stripped and replaced with endless spell memorization, teachings from ancient traditions, and exceedingly high expectations. Every druid leader-to-be must embark on a journey to seek out the sister tribes in order to introduce and establish respect amongst the fellow headmasters. They call this the Aramente, or Noble Odyssey. When her father felt she was ready, he set her on the path to truly discovering herself, not knowing when, or if, she will ever return. As she hiked down the mountain towards Stilben, she meditated on the task ahead. Part of the Aramente is proving yourself a strong warrior, a valiant protector, and a wise and compassionate leader. With this knowledge, one thought plays in repeat in her mind: Is she even worthy?"
TALIESIN,00:05:01,00:06:15,"Percy was the third child of seven children, born to a noble family who lived far to the north in the ancient castle of Whitestone. With so many siblings to share the burdens of lordship, Percy turned his attention to the sciences, engineering, and naturalism. One day, a mysterious couple, named Lord and Lady Briarwood, came to court. During a feast held in their honor, the Briarwoods violently took control of the castle, killing or imprisoning everyone who would stand in their way. Percy awoke chained in the dungeon, only to be freed by his younger sister. Together they fled, chased by the Briarwoods' men. As they ran, Percy's sister took several arrows to the chest and fell. Percy kept running, eventually jumping into a freezing river and floating unconscious to freedom. He did not remember waking up on a fishing boat. He barely remembered the next two years, as he slowly made his way as far south as possible. Then one night, Percy had a dream. A roaring cloud of smoke offered him vengeance against those who destroyed his family. When he awoke, Percy began to design his first gun."
SAM,00:06:15,00:07:37,"Oh, you haven't heard of Scanlan Shorthalt? Well, gird your loins, ladies, because he has his eye on you. A talented musician, master of disguise, and dashingly handsome in his own mind, Scanlan sings songs almost as much as he sings his own praises. Born a poor gnome, Scanlan used his endless charm and soaring tenor voice to croon for coin and support his single mother. One day, he was discovered by a half-orc promoter, and joined Dr. Dranzel's Spectacular Traveling Troupe where he learned the ways of the world, and honed his skills as a bard extraordinaire. A loner much of his life, Scanlan has never quite come to terms with the violent death of his mother at the hands of a goblin invasion. While his years on the road provided many, shall we say, educational experiences with the opposite sex, deep down Scanlan yearns for the one thing he's never known: the true love of a fellow gnome. Still, Scanlan considers himself a lover first, performer second, and fighter distant third. On the battlefield, he'll support his allies, but rarely draws blood, unless it's to protect fellow gnome, Pike. Count on Scanlan for a hearty laugh, a rollicking song, and a twinkle in his eye that melts hearts and makes the females swoon."
ORION,00:07:37,00:09:34,"Greetings and salutations, I am Tiberius Stormwind. I hail from a town called Ty'rex, located in the heart of Draconia, born from a politically respected family. At the age of 15, I succeeded in passing the Sorcerer's Rite, showing prodigy-like control of my magic. The judges and the Draconian high council were amazed at how powerful my spells were for how long I had been training. At 20 years old, I was the youngest appointed member of the magic guild in Draconian history. For the next few years, I almost went mad from the malaise of being a guild member, as it's rather boring. However, one day I happened upon a chamber, unused for quite some time. In the room were stacks of books and maps of the surrounding cities and areas around the known world. For months, I would frequent the chamber, and learned of artifacts from legend. After a long period of research, I made a list of artifacts that caught my eye. I brought these findings to the high council and was told that all of the information in the chamber I had stumbled upon was either believed to be fiction, or unsolvable mysteries, and hence were lost forever. I found those answers to be unacceptable. A year later, I devised a ruse and managed to convince the city council to lend support in me leaving Draconia on a mission of peace and diplomacy for the surrounding kingdoms. Going from town to town and making friends and allies in and for the name of Draconia. Being a red dragonborn, I had quite the task on my hands in that respect, but it was exactly what I needed so I could explore the world and find these artifacts, as I felt the truth was out there. Some may describe me as buffoonish, but I say poppycock to all that. I am much sharper than most give me credit for. I just don't pay attention to things sometimes. I've also been known to be rather cunning, loyal, happy-go-lucky, and well, dangerous. I can't help but show my true scales every now and then. But overall, I think I'm quite friendly for a dragonborn."
LIAM,00:09:34,00:11:03,"Never entirely welcome in the company of elves or men, Vax'ildan learned at a young age to skip past formality, preferring instead to invite himself in your door. Along with twin sister Vex'ahlia, Vax was born by a chance encounter between elven royalty and human peasantry. Raised by their mother in their early years, the twins were eventually sent off to their father in the elven capital of Syngorn. But their cool reception among the elves there never warmed, and their time in the capital didn't last. The siblings stole away one autumn night and set out on the open road. After a few years of wandering, they eventually decided to return to their mother, and journeyed back to the lands of their youth. But instead of finding their childhood home, they returned to a pile of rubble. Their mother was gone, their home burned to ash. Pressing the townspeople for answers, they learned of the day the dragon came. With their ties all severed, Vax'ildan and his sister set out to find their fortune together in Tal'Dorei. An outsider since birth, Vax quickly learned to solve life's challenges in his own particular way, often by sidestepping them entirely. And when his knack for circumventing adversity isn't enough, the way of blades the elves schooled him in more than makes up the difference."
LAURA,00:11:03,00:12:30,"Like so many half-elves, Vex'ahlia has spent most of her life suffering the cool reception of a people who don't fully accept her. Born of a human mother, and an elven father who only later in life took an interest in their existence, Vex'ahlia and her twin brother, Vax'ildan, quickly realized the only people they could truly rely on in this world were each other. It was at the age of ten when the two were taken from their mother, and brought to live in Syngorn, the isolated elven city for which their father was an ambassador. He quietly took them in, but always kept an icy distance, and after too many years of disdainful looks, the pair decided to leave his indifference behind, and set out on their own. Vax took to the cities, stealing small trinkets and learning the ways of the thief, while Vex kept to the woods. She preferred the isolation. Always the keen observer, she learned to hunt and to track, to spy and to shoot. Through a series of fateful events, earned herself a companion in the form of a bear-- her own stolen Trinket-- to fight alongside her and protect her fiercely. Also, he is adorable, and gives expert massages. Like so many half-elves--"
MATT,00:12:30,00:12:58,"Hey guys, welcome back. To give you a little heads up, we are playing the 5th edition of Dungeons & Dragons. We recently converted over from Pathfinder, for those who play Pathfinder. One of our players was a gunslinger, for which there are no rules for in 5th edition. So I had to create and customize those for the game, so bear with us on that. That will be an interesting ride, regardless. We do have an eight-player game we've been playing for two years, which is a little crazy, which is why we go a little loose with the rules. It's a great group, it's a lot of fun. Not everyone can make every game, so we have enough players to definitely pull a party each time."
ZAC,00:12:58,00:13:04,"Just so you know, we're having an audio bottleneck. It'll take about 30 seconds to work itself out."
MATT,00:13:04,00:13:05,"Okay, audio bottleneck."
ZAC,00:13:05,00:13:07,Tech problems that make me want to murder someone.
MATT,00:13:07,00:13:20,That's okay. Just a second. You let us know when it's okay to talk.
TRAVIS,00:13:20,00:13:22,"I don't know what that means, a bottleneck."
MATT,00:13:22,00:13:38,Are we all right? And how are we? Exterminate. Exterminate.
SAM,00:13:38,00:13:45,"Nice. Audio isn't working they're going to watch something else. Thanks, douche. (laughter)"
MATT,00:13:45,00:13:47,Is the mic adjusted? Is it any better?
ZAC,00:13:47,00:13:49,Better now. We're good.
MATT,00:13:49,00:14:28,"Well, great. Thank you guys. A couple of things transitioned from Pathfinder to 5th edition may be a little strange and fun. We have a lot of players, but they're great folks and most of that just means I have to work really hard to make sure the game keeps going, so that's on me. Ashley Johnson, unfortunately, cannot join us. She's our gnome cleric, Pike. She'll be here next week. Unfortunately, she's in London accepting a BAFTA, so I think we're okay. For the Last of Us. That's harsh. Also no donations this week, but going forward we will have donations available for those that will help partially run the show from our wonderful cameraman and crew. Also, half of our donations will go to the 826 charity. Marisha, if you want to talk a little about that."
MARISHA,00:14:28,00:15:03,"Yes! 826LA is a charity that focuses on tutoring children in an after-school program and helping specifically with creativity, storytelling, art and general things that relate to Dungeons & Dragons. You should definitely check out the Time Travel Mart. There is one in Echo Park and one in Mar Vista. They have this amazing storefront where you can buy these awesome tchotchkes and things that go immediately to support the charity and the stream. It's awesome. It's 826LA, you should look it up. There's a few all over the country."
MATT,00:15:03,00:15:33,"Yes. Also, as a heads up because I saw some of you guys ask me in the chatroom: These videos will be available on the Geek & Sundry YouTube Channel soon enough, as well as a more extensive backstory of the party. We'll have all that content ready for you so you don't have to memorize it. Maybe a bio page, I don't know. We'll figure something out. It'll be fine. Anyway, let's open that up. You know who I am. Matthew Mercer, voice actor and I've been running this game for two years. I'm a hardcore nerd. Let's go around the table and introduce our players so you can attach the faces to the intros you just saw. Let's start on this side with Travis."
TRAVIS,00:15:33,00:15:48,"Oh! Hi. I'm Travis Willingham, voice actor, gamer. I play Grog the goliath barbarian."
LAURA,00:15:48,00:15:54,"Hi. I'm Laura Bailey. I'm also, you know, a voice actor like everyone here."
TRAVIS,00:15:54,00:15:56,Yeah. I think we all are.
LAURA,00:15:56,00:15:59,I'm playing Vex'ahlia. The coolest chick ever.
MATT,00:15:59,00:16:02,The ranger with the bear.
LAURA,00:16:02,00:16:06,"The ranger with the bear named Trinket, in case you didn't catch that. His name is Trinket and he's amazing."
LIAM,00:16:06,00:16:27,"Hi, I'm Liam O'Brien. I'm playing Vax'ildan. This one's twin. We're half-elven twins. I started playing D&D when I was 13 and I can't believe this is happening. So cheers. Cheers to this."
TALIESIN,00:16:27,00:16:50,"My name is Taliesin Jaffe. I'm a voice actor, director, and I've been playing some form of Dungeons & Dragons, and if you can't tell by my black clothing, a lot of Vampire the Masquerade when I was a teenager. There was a problem. I'm playing Percy, the Gunslinger. I'm the reason all the rules are all messed up."
MARISHA,00:16:50,00:16:59,"I am Keyleth, the druid from the tribe of the Air Ashari. I am a half-elven person."
MATT,00:16:59,00:17:00,"No, you're elven."
MARISHA,00:17:00,00:17:00,"No, half-elf."
MATT,00:17:00,00:17:01,Half-elf. Okay.
MARISHA,00:17:01,00:17:14,"Yeah, Come on, man. I've been half-elf since day one. Half-elven. Yes! You can see me shooting lightning and turning into awesome animals."
MATT,00:17:14,00:17:15,Orion.
"ORION, MATT",00:17:15,00:17:16,Hi.
ORION,00:17:16,00:17:24,"Hey, everybody. I'm Orion Acaba and I'm also a voice actor. I do things."
MARISHA,00:17:24,00:17:25,"Oh, I'm Marisha Ray, by the way."
ORION,00:17:25,00:17:26,Yeah!
MARISHA,00:17:26,00:17:27,Did I say that?
ORION,00:17:27,00:17:28,Keyleth is Marisha Ray.
MATT,00:17:28,00:17:30,Let Orion have his moment. Don't try and break--
ORION,00:17:30,00:17:32,"No, it's our moment."
MATT,00:17:32,00:17:33,There you go. All right.
ORION,00:17:33,00:17:35,I'm Tiberius the awesome sorcerer.
MATT,00:17:35,00:17:36,Dragonborn sorcerer.
ORION,00:17:36,00:17:38,"Dragonborn, yeah! That's right."
SAM,00:17:38,00:17:50,"I'm Sam Riegel: a voice actor, and stuff. My character is Scanlan Shorthalt. The gnome bard who sings a lot. Let's start playing, yeah? (cheering)"
MATT,00:17:50,00:19:37,"All right! Let's jump on in. Thank you. Last we left off, to give you a little backstory. The party had completed a large venture in saving the nearby city of Emon. One of the central capitals of this human civilization of Tal'Dorei. They managed to halt a demonic insurrection within the throne and as such were greeted to a hero's celebration and had a keep built in their honor. Over the six month period of the keep being constructed, they went their own ways and then returned to see its final creation. However, they did not have a chance to really enjoy it immediately as one of their good friends and allies, Arcanist Allura Vysoren of the Tal'Dorei council came to them requesting their aid saying that a long time friend of hers, Lady Kima of Vord, who is a very well known and very well respected halfling paladin of Bahamut, the Platinum Dragon, had been gone on a pilgrimage for a while, essentially a vision quest that is part of her own development as a paladin. As part of this, she let the information go to Allura that a dark vision had come to her saying that some sort of evil root is beginning to breed beneath Kraghammer and the mountains within Kraghammer, which is the nearby dwarven civilization that you guys have previously not been allowed entry to because the dwarves weren't fans of nobody without any political means of entry. However, she managed to acquire the necessary documentation and offered you a very substantial reward should you find the whereabouts of Lady Kima of Vord and hopefully bring her back safely. You left on the pathway to the dwarven citadel of Kraghammer. You were ambushed by a group of roaming barbarian goliaths. Part way through the battle, Grog managed to recognize one of them as a previous ally and no longer an ally at this time."
TRAVIS,00:19:37,00:19:38,Son of a bitch.
MATT,00:19:38,00:19:49,"Yep, the barbarian for his first and only time so far managed to avert battle through a social encounter and rolled pretty damn well on a persuasion check. So you got one. You get one. You got your one. Never again."
TRAVIS,00:19:49,00:19:50,Next time he dies.
MATT,00:19:50,00:20:02,"Yeah. Essentially. Which managed to not turn it into complete bloodshed. You continued on your way to Kraghammer, presented your paperwork, were given entry into the city and that is where we begin this adventure."
LAURA,00:20:02,00:20:02,Oh no.
SAM,00:20:02,00:20:03,In the city of Kraghammer?
MATT,00:20:03,00:20:04,In the city of Kraghammer.
SAM,00:20:04,00:20:05,Wow! This is fantastic.
TRAVIS,00:20:05,00:20:07,"We're in, right?"
MARISHA,00:20:07,00:20:10,Yes. We were at the door. We were talking to someone right?
MATT,00:20:10,00:20:54,"Yeah, you were talking to the front guards at the gate of Kraghammer. They have begrudgingly let you inside. Giving you a couple of pointers little prods and sent you into the city proper. You made your way through the darkened alleyways and stone carved tunnel that leads into the main, central portion of the city proper. An enormous underground metropolis sprawls out before you. The dark earth and shadows creating beautiful stone work, marble columns, archways, and labyrinthine bridges climbing across the vertical cityscape. All warmed with the red glow of some strange, crimson rock peppered throughout the town as a light source. A large metal forge envelops the center of this cylindrical city. The entire is a three-tiered cylindrical city that is built into the ground of the mountain itself. Welcome to Kraghammer!"
LIAM,00:20:54,00:20:58,"Remind us. Did we bullshit our way in here, or did--"
LAURA,00:20:58,00:20:59,"No, we had a way in."
MATT,00:20:59,00:21:03,"No, Allura got your paperwork so you were actually able to get in this time."
LAURA,00:21:03,00:21:05,"But, Ashley speaks Dwarvish. Pike speaks--"
MATT,00:21:05,00:21:08,Pike speaks Dwarvish and she's not here.
ORION,00:21:08,00:21:10,I speak Dwarvish as well!
LAURA,00:21:10,00:21:10,Oh good!
ORION,00:21:10,00:21:11,I do.
SAM,00:21:11,00:21:12,That's fantastic.
MATT,00:21:12,00:21:38,"The only other bit of information you have about the whereabouts of her is that she came here to go into the mine Apparently, a mithral mine where this evil is supposedly brewing. You heard that the one person who owns the biggest part of the mithral market here cornering, his name was the dwarven Lord Nostoc Greyspine. That was the only name you had in regards to this deep earth quarry."
SAM,00:21:38,00:21:40,Greyspine?
MATT,00:21:40,00:21:41,"Greyspine, correct."
SAM,00:21:41,00:21:46,"We have to go find him, don't we?"
TALIESIN,00:21:46,00:21:49,I think before we do anything we should find a place to sleep.
ORION,00:21:49,00:21:50,That's true!
TRAVIS,00:21:50,00:21:52,"Oh! We're all jacked up from before, right?"
TALIESIN,00:21:52,00:21:54,Wouldn't it be nice to put everything down for a little while.
SAM,00:21:54,00:21:58,Of course. I've got a lot of booty that I need to stow.
ORION,00:21:58,00:22:07,"Good way to phrase that, Scanlan. Also, I would like to check out any places where they might have enchanted libraries or what not."
SAM,00:22:07,00:22:11,Can you stick with us? You're the only one that speaks Dwarvish.
LIAM,00:22:11,00:22:13,"Yes, you're getting ahead of yourself."
ORION,00:22:13,00:22:14,I'm just saying put it on the list.
LIAM,00:22:14,00:22:18,Let's look around. Are there any dwarves in the vicinity?
MATT,00:22:18,00:22:40,"Oh, there are many! As you finish this conversation you look about there are two guards posted nearby wearing dark crimson and brass chest plates that have a uniform scar carved across the front. It's actually built into the armor itself as a design. They're both staring awkwardly at all of you arguing in the middle of this entry thoroughfare of Kraghammer."
LIAM,00:22:40,00:22:42,"Tiberius, make with the dwarf-talk, please."
ORION,00:22:42,00:22:51,"Hello, friends. My associates and I were looking for a place of lodging for the night and a place of reputable reputation."
MATT,00:22:51,00:23:06,"One dwarf shouts over to another one, ""You hear that, Jepson?! They're looking for a place to stay."" ""Aye, I heard that right. It's about time we had some new folk in town. Well, if you're looking for a place to stay I'd say your best bet would be the Pig Pits."""
SAM,00:23:06,00:23:08,Is that the name of a place?
MATT,00:23:08,00:23:10,"""Yes! Certainly! The Pig Pits."""
SAM,00:23:10,00:23:11,All right.
MATT,00:23:11,00:23:12,"""Ask for the Pig Pits--"""
LAURA,00:23:12,00:23:14,"Those are actually pig pits, isn't it?"
MARISHA,00:23:14,00:23:18,I feel like we're being hazed.
MATT,00:23:18,00:23:21,"""What?! No! Not at all."""
TRAVIS,00:23:21,00:23:22,That sounds fine with me.
LIAM,00:23:22,00:23:23,This is Common?
MATT,00:23:23,00:23:24,"This is all in Common, yeah."
SAM,00:23:24,00:23:28,"Which way to the Pig Pits, sir?"
MATT,00:23:28,00:23:47,"""Pig Pits are that way."" He points over the edge and you see down past the central forge structure in the city to the very bottom nearby a large temple that envelops the bottom floor of Kraghammer proper there is indeed a distant slop of mud where internal livestock are being kept."
LAURA,00:23:47,00:23:56,"I bring out a piece of gold. Please, sir, we're looking for a place to stay that isn't covered in mud."
MATT,00:23:56,00:24:15,"""It's good to see that at least one of you speaks Dwarvish."" Takes the coin, kinks it in his teeth and goes, ""All right, now if you're looking for a proper place to stay you're going to look for the Iron Hearth Tavern. That is to your left up that way no more than a half mile. Keep an eye out. Listen for the laughter and the people who are very drunk. That's your best bet."""
LAURA,00:24:15,00:24:16,"Thank you, sir."
MATT,00:24:16,00:24:17,"""No worries."""
LAURA,00:24:17,00:24:18,I like your armor by the way.
MATT,00:24:18,00:24:20,"""Well, thank you kindly."""
TRAVIS,00:24:20,00:24:21,Was that a wink?
LAURA,00:24:21,00:24:24,It was.
LIAM,00:24:24,00:24:25,That's all she does.
LAURA,00:24:25,00:24:27,That's all I do is wink at people.
LIAM,00:24:27,00:24:28,"It's a nervous tic, really."
