speaker,start_time,end_time,text
LAURA,00:44:23,00:44:26,We've heard that no fighter can match your skill.
MATT,00:44:26,00:44:28,"""You've heard correct."""
LAURA,00:44:28,00:44:32,We've heard that you know more about this town than anyone else.
MATT,00:44:32,00:44:35,"""I've been around a bit, yeah."""
LAURA,00:44:35,00:44:42,Yeah. I bet nobody knows more about the Greyspines than you do and they've been around a long time.
MATT,00:44:42,00:44:45,"""Political ass minds is what they are."""
SAM,00:44:45,00:44:46,Assmanes?
MATT,00:44:46,00:44:48,"""Not keen to them-- ass minds."""
MARISHA,00:44:48,00:44:49,Ass mines?
MATT,00:44:49,00:44:50,"""They've got minds of an ass."""
MARISHA,00:44:50,00:44:59,"Oh, I thought you meant like, mines that ex-- Sorry. Go ahead. No, ass minds. Yes, they have ass minds."
MATT,00:44:59,00:45:01,"""The Greyspines are no friend of mine. """
LAURA,00:45:01,00:45:04,"No, I've heard they're terrible. What do you do, Balgus?"
MATT,00:45:04,00:45:07,"""What do I do? I own the brewery in town!"""
LAURA,00:45:07,00:45:08,(gasp) You do?
MATT,00:45:08,00:45:09,"""The only one."""
LAURA,00:45:09,00:45:10,The best brewery?
MATT,00:45:10,00:45:16,"""The only! Of course it's the best!"" I've put everyone out of business. We export to most of Tal'Dorei."""
LAURA,00:45:16,00:45:18,"This ale is amazing, that I'm drinking right now."
MATT,00:45:18,00:45:26,"""Damn right it is!"" You set it down and he takes it from your hand a little bit and takes a sip himself and sets it down again. (inhales deeply) (spits)"
MARISHA,00:45:26,00:45:36,It seems that you aren't challenged often in business and in fighting.
ORION,00:45:36,00:45:42,I saunter over. Hello! My name is Tiberius Stormwind!
TRAVIS,00:45:42,00:45:43,We're all going to die.
MATT,00:45:43,00:45:48,"He glances over and says, ""Dragonborn. I haven't fought one of your kind in a long time."""
ORION,00:45:48,00:45:52,Oh! Who's the last dragonborn you fought? Do you remember his name?
MATT,00:45:52,00:45:56,"""I recall his name was 'Broken and Bloody.'"""
SAM,00:45:56,00:45:58,I think that's a friend of yours.
ORION,00:45:58,00:46:09,"No, I know him! I know the Bloody family, they're terrible people. Anyway, my associates and I were wondering if you might come-- Is that what we're doing? Trying to get him to come with us?"
LAURA,00:46:09,00:46:11,Anyway!
SAM,00:46:11,00:46:16,We're trying to find out more about Greyspine. Where he might be or who his associates might be.
MARISHA,00:46:16,00:46:19,"Gee, I'm so glad you came over."
ORION,00:46:19,00:46:26,Would you like to accompany us on this journey that we're taking? We're trying to find the Greyspines and you seem like you would want to come in on this.
TALIESIN,00:46:26,00:46:29,We think there might be something rotten in the mines.
MATT,00:46:29,00:46:31,Make a persuasion roll. You can assist if you like.
TALIESIN,00:46:31,00:46:33,"I'm assisting in this persuasion roll, good god."
MATT,00:46:33,00:46:35,That just means he has advantage.
ORION,00:46:35,00:46:37,"Oh, I get advantage?"
TALIESIN,00:46:37,00:46:38,21.
MATT,00:46:38,00:46:40,"Yeah, so you get advantage on this roll."
SAM,00:46:40,00:46:41,So you roll twice.
MARISHA,00:46:41,00:46:42,What was the first thing you rolled?
ORION,00:46:42,00:46:44,Three. I'll take the 18.
MARISHA,00:46:44,00:46:46,Definitely take that 18.
ORION,00:46:46,00:46:48,Oh and plus my--
MARISHA,00:46:48,00:46:49,Persuasion.
MATT,00:46:49,00:46:50,"He looks at you keenly, which--"
ORION,00:46:50,00:46:52,Which is a nine.
LAURA,00:46:52,00:46:54,"Whoa, you have a nine persuasion?!"
ORION,00:46:54,00:46:55,That's why I talk.
MARISHA,00:46:55,00:46:57,He's pretty charismatic.
MATT,00:46:57,00:47:10,"He goes, ""Well no, I don't really want to go anywhere with you. But if you're looking to go ahead and talk to the Greyspines, you don't want to go empty-handed. It's customary to come with a gift of some kind."""
LAURA,00:47:10,00:47:11,Oh really?
SAM,00:47:11,00:47:12,What might they like?
MATT,00:47:12,00:47:16,"""Well, let's just say, I have the finest brewery in the city."""
LAURA,00:47:16,00:47:16,Oh!
MATT,00:47:16,00:47:24,"""I have some fine, very rare, very exotic drinks that I could, perchance, sell to you."""
LIAM,00:47:24,00:47:25,Pay the dwarf.
LAURA,00:47:25,00:47:28,How much for this exotic ale?
MATT,00:47:28,00:47:30,"""How exotic you wanting?"""
LAURA,00:47:30,00:47:35,We want to get in the door. We want him to like us.
MATT,00:47:35,00:48:01,"""I can give you the finest of thistle branch, dark blood wine. This was crafted by myself, from a rare bloodthistle branch that I had brought over from the far-off city of Kamordah. This, I personally oversaw. It took me four years to fill this barrel full. It'll cost you 500 gold pieces. But it is a king's red wine!"""
MARISHA,00:48:01,00:48:05,Can I do a persuasion check-- a perception check to see if he's lying?
MATT,00:48:05,00:48:07,This would be insight. Go ahead and roll insight.
TALIESIN,00:48:07,00:48:09,I'm going to go walk over to Grog really quickly.
MARISHA,00:48:09,00:48:12,27.
MATT,00:48:12,00:48:14,He seems too drunk to lie.
SAM,00:48:14,00:48:16,Let's just do it.
LAURA,00:48:16,00:48:27,"Tell you what, Balgus. We have some very rare items with us that I think you might be interested in."
MATT,00:48:27,00:48:29,"""Make it quick! You've got one minute."""
LAURA,00:48:29,00:48:31,"We've got one minute? Well, we've got--"
MATT,00:48:31,00:48:36,"""My time is far worth the 500 gold you've already been talking about."""
LAURA,00:48:36,00:48:40,We've got this with us right now.
TRAVIS,00:48:40,00:48:41,We've got a bunch of dragon pieces.
ORION,00:48:41,00:48:43,Do you like dragon pieces?
TRAVIS,00:48:43,00:48:48,"We've got 37 dragon teeth, one dragon eye, four cups of dragon blood--"
LAURA,00:48:48,00:48:58,We've got this cup of dragon blood! Which I know can be added to ale or wine and makes it quite sensational.
MATT,00:48:58,00:49:13,He takes the sealed cup and sloshes it around in his hand. The actual liquid is coagulated to such a point that it's less of a blood and more of a gelatin. (sloshing sounds)
TRAVIS,00:49:13,00:49:14,It gets better with age.
LAURA,00:49:14,00:49:15,"Exactly, a spoon of it!"
MATT,00:49:15,00:49:19,"He peeks it open and (sniffs). ""Yes!"""
LAURA,00:49:19,00:49:21,"I think that's really expensive, actually."
MATT,00:49:21,00:49:26,"""I can have this appraised, but if you want to do a straight trade for the barrel for this, I'll take you up on that."""
LAURA,00:49:26,00:49:27,"Shit, no."
SAM,00:49:27,00:49:29,Just go for it.
LAURA,00:49:29,00:49:30,"All right, fine! One cup of it."
MATT,00:49:30,00:50:18,"""All right."" He takes the cup, puts it in a small satchel on his side. ""Adra!"" ""Aye, what do you want, you drunken bastard?"" ""They've bought me thistle blood wine. Take it out back. Here's the key."" He tosses her the key. She grabs it and goes, ""Really? Ooh, just walked in, they're buying fancy."" She comes back with two of her barmaiders who are begrudgingly carrying it with her. It's a nice barrel. It has a gold trim. The actual bands that hold the wood together is gold. The branding on the side is gold leafed into the wood. It's fine, exquisite, we're talking top shelf BevMo-style, awesome dwarven wine."
MARISHA,00:50:18,00:50:20,Top shelf at BevMo!
MATT,00:50:20,00:50:27,"He pats it and he goes, ""All yours. If this doesn't get you in the door, I'll eat my shoe."""
TRAVIS,00:50:27,00:50:28,Have you ever done that?
MATT,00:50:28,00:50:32,"""Maybe, I forget a lot of nights."""
SAM,00:50:32,00:50:34,Where might that door be?
MATT,00:50:34,00:50:42,"""Minute's up, you'll have to ask around, but it was great doing business with you."" He walks away from the table."
TRAVIS,00:50:42,00:50:44,I put it in the bag of holding.
MATT,00:50:44,00:50:45,It does not fit in the bag of holding.
"LAURA, TRAVIS",00:50:45,00:50:46,What?!
MATT,00:50:46,00:50:56,"The barrel is too big, you barely got Dork the ox in there. Which, for the record, they did fit a small ox in the bag of holding and then realized later on that there was no airflow."
TRAVIS,00:50:56,00:50:57,He came out!
TALIESIN,00:50:57,00:51:00,I feel like we weren't going to discuss that. I felt that that was in the past.
MATT,00:51:00,00:51:02,I felt that was a necessary story.
SAM,00:51:02,00:51:04,Maybe if we drank some of it it would fit.
LAURA,00:51:04,00:51:09,The troll dick. Is that still in there or no?
TRAVIS,00:51:09,00:51:10,"No, we actually got rid of the troll dick."
LAURA,00:51:10,00:51:11,"Oh, okay."
TALIESIN,00:51:11,00:51:15,Did we trade the troll dick for something?
MARISHA,00:51:15,00:51:17,I thought we like used it as a weapon.
TRAVIS,00:51:17,00:51:20,"I offered it up, but by that time it had turned into a slimy--"
LAURA,00:51:20,00:51:21,Ew.
MARISHA,00:51:21,00:51:24,I thought we threw it at somebody.
LAURA,00:51:24,00:51:31,"Can I stop Adra then and ask her where Greyspine Manor is? Keep, manor, whatever."
MATT,00:51:31,00:52:43,"""Ah, well I can have him do it."" She pokes one of the barmaiders who turns around. This one's younger, he looks like he's frazzled and maybe new here or at least trying to make his way. He goes, ""Okay, I can show you around, just follow me outside, come follow me."" He walks out. He's got a little apron on. He leads you guys outside. He brings you to the edge of the outer walkway of the central ring you're on. He points across the way and what you can see is a series of marble pillars that outline a residential district that opens and consumes the other side of the central ring of Kraghammer. He says, ""If you go past far in that way, you'll look for the house of Greyspine. It's the one that has dark black marble with gold tinting inside the spiralling vein of the marble, it's gold. The gate outside is wrought iron, black iron, that's topped with a series of pikes and--"" Pike awkwardly looks sickened, not understanding. ""The real key point is, if you look on the front yard, you'll see a dwarven statue of the current ironkeeper himself. That's where you'll want to go."""
SAM,00:52:43,00:52:45,"Yes, very helpful, young man."
LAURA,00:52:45,00:52:45,Thank you so much.
MATT,00:52:45,00:52:50,"""Of course. If you get the chance, you could fill out a little form saying how helpful I've been--"""
SAM,00:52:50,00:52:52,Are there suggestion cards here?
MARISHA,00:52:52,00:52:54,"Oh, absolutely."
MATT,00:52:54,00:52:58,"""Here."" He pulls out a small parchment and hands it to you. It's handwritten with a couple of checkboxes."
ORION,00:52:58,00:53:00,You should give us all a copy so you will have multiple.
MATT,00:53:00,00:53:01,"""I only have one."""
ORION,00:53:01,00:53:02,"Oh, okay, that's fine."
MATT,00:53:02,00:53:03,"""Sorry!"""
SAM,00:53:03,00:53:04,Confidence needs improvement.
LAURA,00:53:04,00:53:07,"Oh, it's okay, we have a wonderful writer."
TALIESIN,00:53:07,00:53:11,"I'll rustle up a few. That's fine, why not. It's what I do, apparently."
MATT,00:53:11,00:53:12,He runs back into the tavern.
SAM,00:53:12,00:53:15,"All right, shall we go to the manor?"
LAURA,00:53:15,00:53:18,Do we want to do the manor right now? What time is it?
SAM,00:53:18,00:53:19,5:00 or 6:00.
TRAVIS,00:53:19,00:53:21,We got to sleep.
LAURA,00:53:21,00:53:25,"We might not want to bug him when he's, you know, having dinner."
TRAVIS,00:53:25,00:53:29,"Let's be honest, that gate's going to jack us up. It's going to be full of trouble."
SAM,00:53:29,00:53:31,"All right, yes, let's go sleep."
TRAVIS,00:53:31,00:53:32,Let's sleep.
LAURA,00:53:32,00:53:33,"Well, it's only 6:00."
SAM,00:53:33,00:53:36,"Well, then we have time to do other things."
ORION,00:53:36,00:53:37,How long is a short rest?
MATT,00:53:37,00:53:39,Short rest is around ten minutes or so.
ORION,00:53:39,00:53:40,I want to take short rest.
MATT,00:53:40,00:53:52,"You've technically been short resting in the tavern. It's more of like a post battle-- like, take a breather, bandage your wounds, settle yourself after a harrowing experience. That's what a short rest is."
ORION,00:53:52,00:53:55,"What was the arcane magic, the manor?"
MATT,00:53:55,00:53:57,"Oh, what you're looking for is the House Thunderbrand."
ORION,00:53:57,00:53:59,I want to head in that direction.
MATT,00:53:59,00:54:02,"Okay, so you're dividing from the party? Okay."
ORION,00:54:02,00:54:05,"Oh, I'm going to House Thunderbrand, if anybody wants to come with me."
LAURA,00:54:05,00:54:06,What are you doing? I can't understand you with that popcorn in your mouth.
ORION,00:54:06,00:54:15,Sorry! I'm going to House Thunderbrand before turning in this evening. I've had a nice little short rest and I would like to ask them a few questions.
LAURA,00:54:15,00:54:16,All right.
TRAVIS,00:54:16,00:54:17,"Yeah, go ahead, okay."
SAM,00:54:17,00:54:21,Is there any recon that's going to happen tonight?
LAURA,00:54:21,00:54:22,I think that you and I are going to go to Greyspine?
LIAM,00:54:22,00:54:24,We'll check out the house.
SAM,00:54:24,00:54:24,Do you need any help?
LIAM,00:54:24,00:54:26,"Sure, you can come with us."
SAM,00:54:26,00:54:28,"No, I don't want you to say yes."
LAURA,00:54:28,00:54:32,"Then no, we'll stealth our way."
LIAM,00:54:32,00:54:39,"Just a moment. Pike, you seem very distant. It's very strange, are you all right?"
LAURA,00:54:39,00:54:42,"Pike's not listening, she's looking at the chat room."
SAM,00:54:42,00:54:44,She's feeling ill. Does she need to lie down?
MATT,00:54:44,00:54:50,"Pike is feeling, and for those of you who are curious in the chat room, once again, elements of this are house ruled, so don't complain."
LAURA,00:54:50,00:54:53,"Oh, players."
MATT,00:54:53,00:55:10,"We keep short rest to ten minutes because it makes it move faster. Pike is going along, she seems to be a little distracted, she can't quite understand. She says, ""I don't know, I feel like I've been here before. It's hard to explain."""
TRAVIS,00:55:10,00:55:11,What?
MATT,00:55:11,00:55:18,"""Anyway, I'm probably going to go rest for the evening."" She heads back to the tavern."
TRAVIS,00:55:18,00:55:19,The fuck does that mean?
SAM,00:55:19,00:55:20,We'll find out next week.
TRAVIS,00:55:20,00:55:23,"But first, whores in the bedroom!"
LAURA,00:55:23,00:55:26,Lovely.
SAM,00:55:26,00:55:33,"Grog and I go in search of a, shall we say politely, whorehouse."
MATT,00:55:33,00:55:35,The polite term.
LIAM,00:55:35,00:55:39,"Well, the cleric's away, the bard shall play."
TRAVIS,00:55:39,00:55:43,We need a massage. On my crotch.
LAURA,00:55:43,00:55:44,You and I stealth.
MATT,00:55:44,00:55:48,"You guys make your way to the Greyspine Manor, you guys head for that, you head to Thunderbrand."
SAM,00:55:48,00:55:52,Is Grog going to find someone his size?
MARISHA,00:55:52,00:55:57,Percy and I spend some time making some really nice comment cards for--
TALIESIN,00:55:57,00:56:01,We're going to make some beautiful comment cards.
MARISHA,00:56:01,00:56:02,For what's his name?
MATT,00:56:02,00:56:03,His name is Balan.
ALL,00:56:03,00:56:05,Balan.
MARISHA,00:56:05,00:56:07,We're going to make some wonderful comment cards for Balan.
LIAM,00:56:07,00:56:09,"Oh, Percy is wonderful with calligraphy; you've shown me."
TALIESIN,00:56:09,00:56:10,"Yes, thank you."
MATT,00:56:10,00:56:16,"Okay, so you'll get to that. You guys do manage to find what's called The Stone's Pillow."
TRAVIS,00:56:16,00:56:17,The Stone's Pillow?
MATT,00:56:17,00:56:19,The Stone's Pillow.
TRAVIS,00:56:19,00:56:21,I love it.
MATT,00:56:21,00:56:28,"It's an establishment of comfort and ease, and will run you both for the evening, as you are not Kraghammer locals, 30 gold for the night each."
TRAVIS,00:56:28,00:56:29,A bargain.
SAM,00:56:29,00:56:31,We'll take it.
LAURA,00:56:31,00:56:32,30 gold?!
SAM,00:56:32,00:56:39,What sort of ladies will we find there?
LAURA,00:56:39,00:56:40,Bearded ladies.
SAM,00:56:40,00:56:42,What species?
MATT,00:56:42,00:57:09,"The madam of the house introduces you to a spectrum of ladies, mostly dwarven, and very attractive, you know. This is a nice establishment. There is one gnome. One female gnome. There are a number of male dwarves as well, that are standing at the ready. There is one elf, looks a little shy and embarrassed that a goliath walked in."
SAM,00:57:09,00:57:10,And that's our choice.
MATT,00:57:10,00:57:12,Those are your choices.
TRAVIS,00:57:12,00:57:13,I'll take the tallest one.
SAM,00:57:13,00:57:14,I'll take a dwarf.
MATT,00:57:14,00:57:35,"Okay. You choose your lady, you take the tallest one which would probably be the elf. As you walk in, the shy elf turns around entirely. She is aggressive and throws you around. You got your money's worth. You get manhandled in a way that you haven't-- You're going to be sore in the morning."
TRAVIS,00:57:35,00:57:37,Thank you!
MATT,00:57:37,00:57:39,"Welcome to Kraghammer, gentlemen."
TRAVIS,00:57:39,00:57:42,I like it already.
MATT,00:57:42,00:57:44,"All right, you guys."
LAURA,00:57:44,00:57:45,Yes.
MATT,00:57:45,00:57:47,Are you just walking up to the manor?
LAURA,00:57:47,00:57:54,"No, we're going to try to check out what it looks like. See what the guards are like."
LIAM,00:57:54,00:57:55,"Yeah, we'll pretend to take a stroll."
LAURA,00:57:55,00:57:55,Yes.
LIAM,00:57:55,00:57:57,Pose as a married couple.
LAURA,00:57:57,00:57:57,"Ew, no."
LIAM,00:57:57,00:58:00,Just for the purposes of sneaking around the house.
LAURA,00:58:00,00:58:01,(retching)
LIAM,00:58:01,00:58:03,I want to see what the area's like.
LAURA,00:58:03,00:58:10,"How about we pose as brother and sister, creepy? (laughter)"
LIAM,00:58:10,00:58:19,"You come on to every human, orc, and half-elf in the entire kingdom, but pretending to be my wife for 30 minutes is too much."
LAURA,00:58:19,00:58:20,"Yes. It's disgusting, so no."
LIAM,00:58:20,00:58:22,You're probably right.
MATT,00:58:22,00:58:23,She's got standards.
LIAM,00:58:23,00:58:28,"Okay. So we'll take a stroll. Shop, see what the area's like."
MATT,00:58:28,00:59:04,"You enter the residential district. It is dark and you see the red stone that permeates the area for a low gentle glow of the entire city is now clustered into these street lamps that are throughout the entire location. You begin to press into the residential district proper. There's some nice homes that are carved into the side of the rock, there's some stand-alone homes that are built out of fine stone. You eventually make your way towards the nicer part of it, where you start seeing some of the more marble buildings, some of the more exotic stonework being used in the construction of the homes. You also notice three of the guards that are part of the city establishment there are following you from behind, curiously. The Carvers."
LAURA,00:59:04,00:59:08,"Oh shit, the Carvers. Shit."
MATT,00:59:08,00:59:11,"No weapons drawn, but definitely hands at the ready."
"LAURA, LIAM",00:59:11,00:59:12,Okay.
LIAM,00:59:12,00:59:14,"Well, we could just keep walking."
LAURA,00:59:14,00:59:16,"We could, but that could be bad."
LIAM,00:59:16,00:59:19,"Yes. No, we just want to look at the house."
SAM,00:59:19,00:59:21,Louder!
LIAM,00:59:21,00:59:25,I mean we're not going to go sneaking in in the day.
LAURA,00:59:25,00:59:29,"Let's say which ones are very obvious about being pretty, so we look like we're just sightseeing."
LIAM,00:59:29,00:59:30,Yes.
MATT,00:59:30,00:59:35,"(chuckles darkly) As you continue to walk, eventually some of the dwarves approach."
LAURA,00:59:35,00:59:38,"I point and say: Oh! Look at that one, with the carving, it's amazing!"
LIAM,00:59:38,00:59:40,The architecture is divine.
LAURA,00:59:40,00:59:41,Divine!
SAM,00:59:41,00:59:45,(snorts) They're posing as the Howells?
LIAM,00:59:45,00:59:49,"Lovey, would you look at this dwarven home?"
MATT,00:59:49,01:00:00,"(snobby voice) The marble texture on this is gorgeous. You get about 20 more feet before you get, ""Hail! Hail!"""
LAURA,01:00:00,01:00:03,Oh my! Yes? (giggles)
MATT,01:00:03,01:00:07,"""You foreigners are wandering too far in districts you don't belong to. What's your business?"""
LAURA,01:00:07,01:00:15,"Oh I'm so sorry, I was just so amazed by the architecture here. I wanted to see the beautiful sculpture."
LIAM,01:00:15,01:00:26,"We definitely are visitors here, sir, no one has explained the rules to your city. We were just taking in the fantastic architecture and history of Kraghammer."
LAURA,01:00:26,01:00:31,We were told there was a beautiful sculpture down the street of the ruler of Kraghammer?
MATT,01:00:31,01:00:33,Make a persuasion roll.
SAM,01:00:33,01:00:34,Oh jesus.
TRAVIS,01:00:34,01:00:35,Oh god.
MATT,01:00:35,01:00:36,"Either of you, whichever you prefer."
SAM,01:00:36,01:00:38,If only I was there.
LAURA,01:00:38,01:00:39,21.
MATT,01:00:39,01:00:40,All right.
TRAVIS,01:00:40,01:00:43,"Wow! Pretty decent, good for you."
MATT,01:00:43,01:01:15,"The guards look at each other. The one that was talking to you, you can see now, as he comes a little closer into the light, a frazzled black beard that's pulled into a very tight braid that goes down to his bellybutton. All wearing the same basic chest plate; long, black velvet cloak behind; each carrying some sort of heavy warhammer around the side of their belt. Steps up and says, ""Well, just to tell you the rules here, if you're going to wander at night in a very expensive district, you don't want to do it by yourself because you either have chances of being mugged or arrested. We might have arrested you."""
LAURA,01:01:15,01:01:21,"Oh no! I'm so sorry! Well, do we need protection?"
MATT,01:01:21,01:01:26,One of them looks over and sees the bear that is off in the shadows nearby.
LAURA,01:01:26,01:01:31,"I thought Trinket stayed behind. Cool, cool!"
MATT,01:01:31,01:01:37,Trinket's quietly trying to keep up with his wonderful master.
LIAM,01:01:37,01:01:39,"Come along Trinket, there there's nothing to be scared of."
MATT,01:01:39,01:01:42,"""What's a bear doing in Kraghammer?!"" They all grab out their warhammers."
LAURA,01:01:42,01:01:50,"Oh no, please, he's quite harmless. In fact, he's very scared of most people."
LIAM,01:01:50,01:01:53,He's completely trained. He does tricks. Doesn't he do tricks?
LAURA,01:01:53,01:01:56,He does. Trinket show them your wonderful shake trick.
MATT,01:01:56,01:02:06,"At which point Trinket, (subdued growling) just shakes his whole body. He looks at you, confused."
LAURA,01:02:06,01:02:07,That's good.
MATT,01:02:07,01:02:11,"Then raises a paw up, and-- (bear noises)"
LAURA,01:02:11,01:02:15,"If you put your hand out, he'll shake your hand."
MATT,01:02:15,01:02:16,(growling)
LAURA,01:02:16,01:02:17,"Yeah, see!"
MATT,01:02:17,01:02:23,"The dwarves take a step back as the claw goes through the, ""That's all right. I would say if that's your animal--"""
LAURA,01:02:23,01:02:24,Yes?
MATT,01:02:24,01:02:25,"""--don't bring it here."""
LAURA,01:02:25,01:02:35,"Oh, good to know. Trinket, head back to that tavern, would you? People are getting nervous."
MATT,01:02:35,01:02:37,(growling)
LAURA,01:02:37,01:02:37,I love you.
MATT,01:02:37,01:02:49,Trinket begins to walk back. A couple of other dwarves that are wandering carrying some packages to the side make a very wide berth around this armored bear that's slowly moping its way through the streets of Kraghammer. What could possibly go wrong?
LAURA,01:02:49,01:02:50,He's so cute.
LIAM,01:02:50,01:02:52,"He's a sweetheart, he's fine."
MATT,01:02:52,01:03:00,"(growls) You hear in the distance. The one goes like, ""Look, I'll show you to the statue and that's it, then you got to go."""
LAURA,01:03:00,01:03:01,All right. Thank you.
MATT,01:03:01,01:03:22,"""I don't see many half-elves here and honestly I'm excited to meet you, so let's do this quickly. Come with me."" He leads you further into the cityscape. Down the road, you end up going through a few buildings. You find one large wrought iron fence with a series of carved spikes towards the top, and you see the beautiful dark marble building with the gold trim."
LAURA,01:03:22,01:03:23,"Oh, this one's amazing."
MATT,01:03:23,01:03:29,"""This is what you were talking about, Greyspine Manor. Lot of rich sons of bitches."""
LAURA,01:03:29,01:03:35,"Wow, so you said the Greyspines own this one?"
MATT,01:03:35,01:03:36,"""Aye."""
LIAM,01:03:36,01:03:42,It's stunning. We only heard about the building itself; what can you tell us about the people who live here?
MATT,01:03:42,01:03:44,"""Bunch of rich sons of bitches."""
LAURA,01:03:44,01:03:46,"Well, we can tell that can't we?"
MATT,01:03:46,01:03:51,"""Actually, Ironkeeper's all right, he's been doing a great job. The rest of the family can suck off."""
LAURA,01:03:51,01:03:51,"Oh, really?"
LIAM,01:03:51,01:03:53,"Not liked by the rest of the city, then?"
MATT,01:03:53,01:04:01,"""Oh, they have friends everywhere, but I personally don't like them. They run business pretty dark. They work most of their employees to the ground. To the bone."""
LAURA,01:04:01,01:04:02,Oh no!
MATT,01:04:02,01:04:05,"""I don't think that's how you run a business. Well, that's how you run a business for profit, but not for--"""
LAURA,01:04:05,01:04:11,Wow. It sounds like they would run the mithral mine which we've heard is so hard on its employees.
MATT,01:04:11,01:04:12,"""Aye, that's the one."""
LAURA,01:04:12,01:04:13,"Oh, really?"
MATT,01:04:13,01:04:16,"""Yeah. I don't know, I don't go that far south, doesn't interest me."
LIAM,01:04:16,01:04:18,Nor us.
MATT,01:04:18,01:04:19,"""Smells like brimstone."""
LAURA,01:04:19,01:04:20,I don't blame you.
