speaker,start_time,end_time,text
LAURA,02:09:06,02:09:11,"Oh, good. I thought that was a one, but it's not. It was a 13."
MATT,02:09:11,02:09:32,"13? Okay. Strangely enough, they are fairly distracted and after a rather long, uneventful morning, most of them are used to being in armor and waiting for business to go down. There are a few along the edges that look a little more alert, and one of them is looking occasionally down into the quarry. Just keeping an eye on the established area."
LAURA,02:09:32,02:09:35,Which one looks like the newest?
MATT,02:09:35,02:09:55,"The newest of the bunch would be the one that's on the far left that is looking down into the quarry as well. He has a shaved head, has a small brownish beard that looks like he's starting to grow out into a nice, long tuft. Either it got shaved in some, I don't know, terrible college dwarf accident. You know part of his entry into some fraternity."
TRAVIS,02:09:55,02:09:58,Dwarf Sigma Sigma.
MATT,02:09:58,02:10:15,It's a fairly thick tuft of unkempt brown beard that goes about that far out. It's starting to be pulled in like tiny little scruffy braids. It's not quite there and he probably gets a lot of shit for it from the other dwarves. He seems to generally be looking at you guys.
LIAM,02:10:15,02:10:16,"Okay, work your magic."
TRAVIS,02:10:16,02:10:18,"Yeah, do your thing-- fuck these dwarves up."
SAM,02:10:18,02:10:20,What are we trying to do?
LAURA,02:10:20,02:10:27,"We brought this gift. Hello! We address all of them, maybe, right now, yes?"
TALIESIN,02:10:27,02:10:30,She is better at this. I'm going to let her do this.
"LAURA, SAM",02:10:30,02:10:32,"Hello, hi!"
ORION,02:10:32,02:10:34,Greetings and salutations!
MATT,02:10:34,02:10:38,The other guards reach back and grab their weapons. One of them looking to you.
ORION,02:10:38,02:10:40,"Oh, you don't need that."
LAURA,02:10:40,02:10:44,I look over at the shaved-head one and I hold his gaze for a little bit.
LIAM,02:10:44,02:10:47,I give Vex a little push forward.
LAURA,02:10:47,02:10:49,Pardon me. Not yet!
MATT,02:10:49,02:10:52,"""All right, what's your business?"""
LAURA,02:10:52,02:11:00,"Oh, yes, well-- we are here to speak with Nostoc. We brought a gift for him that's quite remarkable, actually."
MATT,02:11:00,02:11:09,"They curl up around the apparent barrel that Grog's holding. They look wary of Grog, but once they make note of the barrel they all, ""Ooh!"""
TRAVIS,02:11:09,02:11:13,Right? It's the shit.
MATT,02:11:13,02:11:19,"""I've heard of that, but I've not seen anyone actually drink it. There were long standing rumors that this even existed."""
LAURA,02:11:19,02:11:20,It exists.
SAM,02:11:20,02:11:22,And it's for Nostoc.
MATT,02:11:22,02:11:23,"""This is a Balgus original?"""
LAURA,02:11:23,02:11:46,"Yes. MATT ""Signed by himself I see on the burned, emblazoned wood. I'll go talk to him!"" He heads inside of the building, the doors close behind him. The other guards encroach, keeping a very keen eye, each one having a bead on the rest of your group. About two minutes pass before he comes back, opens the door and the dwarf goes, ""Nostoc will see you briefly, but you best bring the gift. I think that's what's holding his interest."""
ORION,02:11:46,02:11:48,Wonderful!
MATT,02:11:48,02:13:13,"""Inside, please."" Him and one other guard flank you guys as you enter, making sure that you are not left without that appearance. You are led into the center of this portion of the mine's main structure, a series of long hallways. There's this general smell of soot and ash and broken stone dust in the air. A hint of brimstone-ish smell. It's not very pleasant, it's very well worn and pungent for those of you who spend most of their time on the surface. As you enter, there is a general dust in the air, a little light seems to peek through from the torches that are placed up along the wall. You can see this general haze amongst the interior here. It's definitely a work environment at the base of an underground dwarven establishment used to mine. You are led further down the hallway. It curves to the left and you're brought into a large dwarven study. There are books on the walls, a series of ledgers and paper stacks on a large desk and at the center there sits a dwarf with fiery red hair cut very short, almost like a buzz-cut on the top, with a long beard that is not braided, but kept very smooth and very-- not curly, not bunched, it's a very straight beard. He's very clean cut, he already has this intimidating dark glare. As you walk into the room he goes, ""Okay, you brought me a drink. You have my attention. What brings you to the mines?"""
SAM,02:13:13,02:13:16,We should have talked this through before.
TALIESIN,02:13:16,02:13:23,"Well, several things actually. Several things bring us to the mine. My name, of course, is Percival Fredrickstein von Musel Klossowski de Rolo III."
ALL,02:13:23,02:13:25,You can call him Percy!
MATT,02:13:25,02:13:30,"He raises his finger and goes, ""You have not paid for your pleasantries yet."""
LAURA,02:13:30,02:13:32,"Oh, of course. Grog, if you would."
LIAM,02:13:32,02:13:41,Tap that motherfucker!
TRAVIS,02:13:41,02:13:46,I am assuming he had a goblet on the table.
MATT,02:13:46,02:13:58,"As you pull it up he pulls under his desk and pulls up a goblet. As you fill it, ""Top it off! Thank you! Now put on the side of the desk!"""
SAM,02:13:58,02:14:04,"Wait! Mister Greyspine. Oh, okay, all right."
MATT,02:14:04,02:14:08,Puts it down. (satisfied sigh)
LAURA,02:14:08,02:14:12,Is it as amazing as we've heard?
MATT,02:14:12,02:14:37,"""It's pretty fucking good."" He takes another long drag, while making sure you all watch him do this. This goes on probably a little longer, the pageantry of him drinking this in front of you is definitely a power play, and he's establishing some sort of unspoken dominance in the room. Eventually he finishes his tankard, sets it down under the desk again. ""Right, so where were we?"""
TALIESIN,02:14:37,02:14:45,We were here to call upon your expertise. We imagine that we are not the first strangers to Kraghammer to come through--
LAURA,02:14:45,02:14:47,-- in the last few weeks.
TALIESIN,02:14:47,02:14:59,"In the last few weeks. We believe one of our compatriots had some dealings with you, perhaps not as pleasant as the dealings we are hoping to have."
SAM,02:14:59,02:15:01,"A lady, in fact."
LAURA,02:15:01,02:15:03,A halfling.
MATT,02:15:03,02:15:09,"At which point, as you say that, he gets this grin to his face and goes, ""Aye, I know of the one you speak."""
LAURA,02:15:09,02:15:10,Yes.
MATT,02:15:10,02:15:12,"""She is a strong-headed one, that one."""
TALIESIN,02:15:12,02:15:13,Yes.
MATT,02:15:13,02:15:17,"""She stepped on a few toes around this place."""
ORION,02:15:17,02:15:20,"Oh, was she clumsy?"
MATT,02:15:20,02:15:27,"""One could say that, aye. You say you are compatriots of hers?"""
TALIESIN,02:15:27,02:15:32,"We're here to mend any broken bridges, so to speak."
MARISHA,02:15:32,02:15:34,"Or broken toes, if you will."
MATT,02:15:34,02:16:00,"""She certainly left a mess in her wake. There's this strange vision quest she kept talking about. It brought her into atmospheres-- portions of this city, portions of my business that she has no right trespassing on. She went against Carver rules, she broke away from partial arrest and she went screaming down into the caverns of our mines without my permission, blade drawn on some crazed suicide mission."""
LAURA,02:16:00,02:16:07,You know what? We'll go after her. We'll bring her out. We'll get her out of your mines.
MATT,02:16:07,02:16:09,"""Great. I'd like that actually."""
LAURA,02:16:09,02:16:10,Good!
TALIESIN,02:16:10,02:16:15,"We'd be happy to clear out anything unpleasant that we happen to find in there in the meantime."""
ORION,02:16:15,02:16:17,How did she look?
TRAVIS,02:16:17,02:16:19,What?
MATT,02:16:19,02:16:27,"""She looked small and angry. She seemed to have some weight to her. She was a strong lass."""
ORION,02:16:27,02:16:29,So not a looker is what you are saying.
MATT,02:16:29,02:16:36,"He gives you this strange look and goes, ""I will not discuss the physical aesthetics of a halfling."""
SAM,02:16:36,02:16:37,The dwarf is a feminist.
LAURA,02:16:37,02:16:47,How much would this task be worth to you? Obviously we are doing you quite a favor and we brought you quite a gift!
SAM,02:16:47,02:16:51,This cost us a thousand gold.
MATT,02:16:51,02:16:54,"""Obviously this lass means a lot to you, doesn't she?"""
LAURA,02:16:54,02:16:59,"No, but I know she is probably wreaking havoc on your mines."
LIAM,02:16:59,02:17:04,We've come to correct the wrongs that she's done and come to bring her home.
MARISHA,02:17:04,02:17:10,It also sounds like there are some other terrible things wreaking havoc on your mines.
MATT,02:17:10,02:17:22,"""There is nothing going on, we're fine. We have everything under control, we don't need your help for that. If you want to find your friend, go find her! If she is still alive. If not, take her corpse back and leave."""
TALIESIN,02:17:22,02:17:39,"It's not help, sir. We are simply respecting you as a businessman. As a businessman I'm sure that you would disagree with unceremonious charity whether it would be to give it or receive it. We are making sure that our dealings with you are fair and balanced."
MATT,02:17:39,02:18:10,"""I appreciate your offering. You have bought your time. Now, if you are here to go find your friend, I'll let you pass. You may pass into the mine, but if at any moment you cross over to any sort of thieving bullshite--"" Looks over at you. ""I recommend--"" (laughter) ""I recommend-- that you fall down the same path your friend likely did and get killed real quick. I don't take kindly to those who cross on my business."""
TALIESIN,02:18:10,02:18:14,I doubt that we could find anything of more value that what we have already brought you.
LIAM,02:18:14,02:18:21,"We are here to right wrongs and I promise you, our business is finding her and returning home."""
MATT,02:18:21,02:18:22,"""Then go."""
LAURA,02:18:22,02:18:24,Is that our business?
TRAVIS,02:18:24,02:18:26,"Yeah, we are here to right wrongs and right lefts."
TALIESIN,02:18:26,02:18:29,And write comment cards.
MARISHA,02:18:29,02:18:38,"Wait, before we dive into this mountain-- we know that there's ghouls and god knows what else down there. Shouldn't we find out?"
ORION,02:18:38,02:18:41,"Yes, we should. Maybe some arcane house could tell us how to deal with these things."
LAURA,02:18:41,02:18:48,Yes. Do we have permission to enter within the next few days? Obviously we might need to be prepared.
ORION,02:18:48,02:18:56,"Yes, do we have badges that we wear over so that they know--?"
MATT,02:18:56,02:19:08,"""I'll speak with the men. They'll let you down. If you come back, good on you. I think our business here is done."""
TALIESIN,02:19:08,02:19:09,Yes.
MATT,02:19:09,02:19:25,"At which point, you hear muffled in the distance a loud ringing of a very loud bell. (dinging) At which point, he perks up a bit. ""Our business here is done. Please, shove off."""
SAM,02:19:25,02:19:27,Which way do we go?
MATT,02:19:27,02:19:34,"He looks over to the two other guards who are up front. The two Carvers say, ""This way."""
LIAM,02:19:34,02:19:45,While he is talking I take a flask out of my cloak and approach the barrel and surreptitiously pour a little bit of it into the flask.
MATT,02:19:45,02:19:46,Sleight of hand check.
SAM,02:19:46,02:19:47,You're stealing beer?!
ORION,02:19:47,02:19:50,"No, because we have to give it to those guards."
SAM,02:19:50,02:19:52,"Fuck those guards, I can kill them all."
LAURA,02:19:52,02:19:55,Can I talk to good old Nostoc while he's doing that?
MATT,02:19:55,02:20:00,"He currently does not seem like the talkative type at the moment, you can certainly try."
TALIESIN,02:20:00,02:20:05,I am going to make a fumble. I am going to attempt to assist a sleight of hand with a bit of a fumble.
MATT,02:20:05,02:20:06,He has already rolled it.
LAURA,02:20:06,02:20:09,Damn it. I am going to fall down. In front of Nostoc.
SAM,02:20:09,02:20:11,Oh!
LIAM,02:20:11,02:20:12,13.
LAURA,02:20:12,02:20:14,I am going to fall down in front of Nostoc.
MARISHA,02:20:14,02:20:16,Come on!
TALIESIN,02:20:16,02:20:20,He is distracted by a bell.
MATT,02:20:20,02:20:22,As you fill your flask--
TRAVIS,02:20:22,02:20:27,Shit. Balls. Ass.
MATT,02:20:27,02:20:32,You hear this loud-- (clears throat).
LAURA,02:20:32,02:20:38,"Ow, oh my ankle! It hurts so very much."
MATT,02:20:38,02:20:53,"This is the first time you have witnessed the pristine, delicate yet well trained palm of a dwarven hand go straight to its forehead."
LIAM,02:20:53,02:21:11,"I carry the flask up to his cup and refill it and say: In my kingdom when a deal is set we drink together. I would like, not much, but to pour us all a drink and agree, surely this cask is weeks' worth of drink--"
MATT,02:21:11,02:21:16,"""Get out of my office."""
MARISHA,02:21:16,02:21:19,"Take the flask, take the flask."
LIAM,02:21:19,02:21:22,"I can see it is a cultural difference, my apologies."
ORION,02:21:22,02:21:25,Stop it. Just go! What are you doing?
LIAM,02:21:25,02:21:27,You're one to talk!
ORION,02:21:27,02:21:29,I'm on the earring.
MATT,02:21:29,02:21:42,"A second and a third bell starts going off and the guards that are waiting for you guys. They're like-- They start leading you outside and as you make your way outside the main building, you can now hear voices shouting, down in the quarry below."
LAURA,02:21:42,02:21:47,I lean down to one of the guards and say: What is that bell for?
MATT,02:21:47,02:21:49,"""Something is flushing out of the quarry."""
LAURA,02:21:49,02:21:51,"Flushing, what does that mean?"
MATT,02:21:51,02:22:01,"""We don't know."" Some of the guards are motioning each other to follow and some of them start going down to one of the tracks that leads down to one of the nearest quarry below."
TALIESIN,02:22:01,02:22:10,"Just try and like practically usher our guards in that direction, since they seem to want to go in that direction. Let's see if we can push them in that direction."
MATT,02:22:10,02:22:18,"Okay, you guys follow down towards the quarry, you ask the guard that question and he goes, ""I don't know, we've had quite a few interesting things come through."""
LAURA,02:22:18,02:22:20,"Like what? Oh, like what?"
MATT,02:22:20,02:22:24,"He swallows and says, ""Things I can't describe."""
TALIESIN,02:22:24,02:22:26,"Well, we can certainly help, lead on."
MARISHA,02:22:26,02:22:28,Is there anybody running out?
MATT,02:22:28,02:22:38,"Not yet. As you head halfway down the quarry walkway, you begin seeing dwarves start running out of one of the large quarry tunnels."
MARISHA,02:22:38,02:22:40,I grab one of them.
MATT,02:22:40,02:22:47,"Well, they're quite a distance from you. You're still walking down the side. They're a good 100 feet from you. They start running at you, you see blood streaking down one of their faces."
TRAVIS,02:22:47,02:22:49,Yes!
MATT,02:22:49,02:23:00,"They're charging out, one of them has a weapon and is limping, and you start seeing small green scampering things rushing through. One, two, three, four, six, ten goblins come rushing out of the tunnel."
SAM,02:23:00,02:23:02,"Ah, I don't like these guys."
LAURA,02:23:02,02:23:03,We should attack them! I string my bow.
MARISHA,02:23:03,02:23:06,Don't you have family history with them?
MATT,02:23:06,02:23:12,"The three dwarves that are running out, one of them gets hacked down by one of the goblins and jumps on them and is tearing his neck."
TALIESIN,02:23:12,02:23:13,I take a shot. Right now.
LAURA,02:23:13,02:23:15,I take a shot. I shoot it!
MATT,02:23:15,02:23:16,"Okay, both you guys roll--"
LIAM,02:23:16,02:23:17,I throw a dagger.
MATT,02:23:17,02:23:21,"You throw a dagger? Three of you, roll for attack."
TALIESIN,02:23:21,02:23:23,19.
LAURA,02:23:23,02:23:25,15.
ORION,02:23:25,02:23:28,Is there a clear area where there's a bunch of goblins running?
MATT,02:23:28,02:23:30,There is an open funnel towards the tunnel.
ORION,02:23:30,02:23:34,"I'm going to throw a little Fireball, right there where those guys are."
MATT,02:23:34,02:24:01,"Okay, you guys you all hit from this distance because goblins are puny little things. They're still a little small to see, but you're all pretty well trained and pretty honed with your aim. You fire simultaneously, gunshot echo through the hallway, arrows, flying dagger, you see three goblins fall off a nearby dwarf who goes, ""Thank--"" At which point a large fireball explodes, killing off about ten or so of the goblins and probably two of the dwarves."
ORION,02:24:01,02:24:03,Sorry about that!
MATT,02:24:03,02:24:04,The guards stopped.
SAM,02:24:04,02:24:05,Did you do that?
ORION,02:24:05,02:24:06,Yeah.
SAM,02:24:06,02:24:07,Fuck.
MATT,02:24:07,02:24:16,"They they start looking around and they see you pull out your weapons and they all take a step back and realize they don't want to die either. ""Well go, if you're going to help, go!"""
TALIESIN,02:24:16,02:24:18,We run straight in.
MATT,02:24:18,02:24:23,"With you guys charging in, you can now see a handful more goblins are rushing out. They are like running really fast, sprinting."
MARISHA,02:24:23,02:24:30,"I throw Entangle up, in the distance wherever they're coming from."
MATT,02:24:30,02:24:32,"Okay, what's the radius on that?"
MARISHA,02:24:32,02:24:33,Like a hundred feet.
MATT,02:24:33,02:24:35,That's the range. What is the radius?
MARISHA,02:24:35,02:24:37,"Oh, 20-foot radius."
MATT,02:24:37,02:24:59,"Okay. You find a portion of the central point where the things exit from the tunnel and these strange reddish vines begin to protrude and to begin to grab nearby goblins and pull them up in this massive, weird vine creature. You hear (stomping) and you now see two larger ogre-like creatures come storming out."
MARISHA,02:24:59,02:25:01,"Oh, shit!"
ORION,02:25:01,02:25:02,Wonderful!
MATT,02:25:02,02:25:12,Everyone roll initiative. (cheering)
MARISHA,02:25:12,02:25:14,"Oh, fuck. Goddamn it."
TALIESIN,02:25:14,02:25:15,Oh yeah!
TRAVIS,02:25:15,02:25:18,Take it!
MATT,02:25:18,02:25:22,"All right, do we have initiatives 25 to 20?"
TALIESIN,02:25:22,02:25:23,27.
ORION,02:25:23,02:25:24,21.
LAURA,02:25:24,02:25:26,Wait! I didn't roll yet.
MARISHA,02:25:26,02:25:27,You rolled a 20?
TALIESIN,02:25:27,02:25:29,I rolled a 20 plus seven.
MATT,02:25:29,02:25:30,"21, you said?"
ORION,02:25:30,02:25:31,I have 21.
MATT,02:25:31,02:25:34,21 for Tiberius. What did you get? One? Aw.
MARISHA,02:25:34,02:25:37,"Oh, I rolled a two."
LIAM,02:25:37,02:25:38,It's six with the plus.
SAM,02:25:38,02:25:41,Fellows. I don't like goblins.
LAURA,02:25:41,02:25:43,18.
MATT,02:25:43,02:25:46,"You now see Scanlan, who's usually a jovial individual, his eyes begin to tense with fury."
SAM,02:25:46,02:25:48,I don't like goblins.
MARISHA,02:25:48,02:25:50,Is there anything that you know?
SAM,02:25:50,02:25:56,"No, they will all die. Don't spare any of them."
TRAVIS,02:25:56,02:25:57,Copy that.
LAURA,02:25:57,02:25:58,18.
MATT,02:25:58,02:26:00,"All right, so we have--"
TRAVIS,02:26:00,02:26:03,"18, too."
TALIESIN,02:26:03,02:26:05,27!
LAURA,02:26:05,02:26:06,What?!
TRAVIS,02:26:06,02:26:07,"Yeah, buddy."
TALIESIN,02:26:07,02:26:09,I have 27 initiative.
MATT,02:26:09,02:26:14,15 to ten? Ten to five? Six.
TALIESIN,02:26:14,02:26:17,"Wow, oh my god."
SAM,02:26:17,02:26:18,I got a three.
MATT,02:26:18,02:26:20,Okay. All right.
MARISHA,02:26:20,02:26:24,Four.
LIAM,02:26:24,02:26:26,"It was a sudden attack, man."
SAM,02:26:26,02:26:27,We weren't ready.
MATT,02:26:27,02:26:29,You got a three.
MARISHA,02:26:29,02:26:33,To be fair I just cast Entangle. It works. I'm distracted holding Entangle.
MATT,02:26:33,02:26:43,"Yeah, it's fine. Then we have Scanlan. I'll get you guys in placement here, as your bear is currently back at the inn."
LAURA,02:26:43,02:26:44,He is still?
MATT,02:26:44,02:26:46,Unless you wanted to bring him along.
LAURA,02:26:46,02:26:48,"Well, I thought I brought him. I should have mentioned that."
MATT,02:26:48,02:26:51,"All right, we'll say you brought him along. That's fine."
LAURA,02:26:51,02:26:54,"I'm sorry, I should have emphasized that more."
MATT,02:26:54,02:27:03,"That's all right. Those of you going first, we're going to keep you on the field here."
LAURA,02:27:03,02:27:06,Oh god.
MATT,02:27:06,02:27:12,A number of goblins that are currently held over here.
LAURA,02:27:12,02:27:15,They're easy. Goblins are easy. Orcs are not.
TRAVIS,02:27:15,02:27:18,"Yeah, those are mine."
LAURA,02:27:18,02:27:20,Ogres?!
MATT,02:27:20,02:27:22,"Top of the round, Percy you're up."
TALIESIN,02:27:22,02:27:25,I'm sitting down and I'm busting out Bad News.
MARISHA,02:27:25,02:27:27,Bust out Bad News!
MATT,02:27:27,02:27:48,"Percy stops just as he gets to the quarry, a little bit elevated, and he pulls out from a small sack on his back this large elongated contraption, this weird construction that looks similar to the pepperbox he usually carries, but much larger and cumbersome. He sets it up on the ground with a small stand at the front and preps itself with a visual point."
TALIESIN,02:27:48,02:27:49,Ogre.
MATT,02:27:49,02:27:50,Ogre back here?
TALIESIN,02:27:50,02:27:51,Yep.
MATT,02:27:51,02:27:53,"All right, roll for your attack with Bad News."
MARISHA,02:27:53,02:27:55,Have you used it before?
TALIESIN,02:27:55,02:27:56,"Nope, first time."
MATT,02:27:56,02:28:00,"His own tinkered construction, Bad News."
TALIESIN,02:28:00,02:28:03,That's a 30 attack.
MATT,02:28:03,02:28:06,"Yep, that'll do it. Go ahead and roll damage."
MARISHA,02:28:06,02:28:08,Does that critical for you?
TALIESIN,02:28:08,02:28:10,19 actually might.
MATT,02:28:10,02:28:11,Natural 19?
TALIESIN,02:28:11,02:28:12,Natural 19.
MATT,02:28:12,02:28:14,"Yeah, that should critical for you."
TALIESIN,02:28:14,02:28:17,That does critical for me. I've never criticaled with this either. What does that mean?
MATT,02:28:17,02:28:23,"That means the damage dice you double. Roll for damage, double that, and add your modifier after that."
MARISHA,02:28:23,02:28:28,"Come on! Big money, no whammies. Yeah! Hell yeah!"
TALIESIN,02:28:28,02:28:32,(counting) 27 points of damage.
TRAVIS,02:28:32,02:28:33,"Get after it, big man!"
MARISHA,02:28:33,02:28:35,Is that doubled?
TALIESIN,02:28:35,02:28:37,That's doubled.
MATT,02:28:37,02:29:08,"You guys hear this cacophonous, large blasting sound, a flash of blue energy and sparks shoot out the back of the weapon. It actually lifts Percy off the ground for a second and he shifts himself from the sheer blast. This streaking, heated bullet, reddish, white hot, goes cascading through the air, plunges into the side of the ogre's shoulder with a smattering of blood splattering against the cave behind it. It's actually moved back a step and has to catch itself. Slams its club into the ground. That ends your turn?"
TALIESIN,02:29:08,02:29:11,I can't do anything after that. That's just reload.
MATT,02:29:11,02:29:12,"Tiberius, you're up."
ORION,02:29:12,02:29:14,I move within 60 feet of those big fellows.
TALIESIN,02:29:14,02:29:16,Bad news travels far and fast.
MARISHA,02:29:16,02:29:19,Nothing travels faster.
MATT,02:29:19,02:29:21,"This is the entanglement, by the way."
LAURA,02:29:21,02:29:22,"Oh, okay."
ORION,02:29:22,02:29:24,Right before there.
MATT,02:29:24,02:29:29,Everything there is fighting from the entanglement. Most of these goblins are currently inside of it.
ORION,02:29:29,02:29:31,I'm going to shoot a Scorching Ray at the big guy.
MATT,02:29:31,02:29:33,Both of them?
SAM,02:29:33,02:29:35,He said he moved within 60 feet of them.
MATT,02:29:35,02:29:37,You moved up to here? All righty.
MARISHA,02:29:37,02:29:39,"They're all entangled, yeah?"
ORION,02:29:39,02:29:40,That's good right there.
MARISHA,02:29:40,02:29:42,Still have Entagle up.
MATT,02:29:42,02:29:46,These guys here are entangled. These front goblins are not. Scorching Ray you said at which ones?
ORION,02:29:46,02:29:57,"Actually, oh there's a bunch of those dudes, aren't there? I'm going to do a Fireball instead, right in the center of the juiciness where I can get a couple little guys and both the big guys."
MATT,02:29:57,02:30:00,"All right, so I'd probably about there would be where you'd want it."
ORION,02:30:00,02:30:07,"I'm going to do that, and I'm going to spend two sorcerer points immediately to do quickening spell and do another spell right after that."
MATT,02:30:07,02:30:20,"Okay. As you rush up, you pull back your hand and you see the arcane red energy begin to flow in your palm. You then throw the beam out, and it arcs, slams into the center, and explodes hitting each of these five goblins and the two ogres. What's your DC on your spell?"
ORION,02:30:20,02:30:24,My DC on my spell is--
MATT,02:30:24,02:30:26,Top of your spell page on the right.
ORION,02:30:26,02:30:28,"Oh! Wait. Oh! 17, sorry."
MATT,02:30:28,02:30:31,"17, okay. Wow! The two ogres actually make their saving throws."
LAURA,02:30:31,02:30:32,Ugh!
MARISHA,02:30:32,02:30:34,Boo!
MATT,02:30:34,02:30:35,They got 18 and a 19.
TRAVIS,02:30:35,02:30:37,"Roll crappier, ogres!"
MATT,02:30:37,02:30:40,"The goblins, however, all disintegrate."
LAURA,02:30:40,02:30:41,All of them?
MATT,02:30:41,02:30:57,"There's no way they're going to survive the damage you-- they (poofing). You see this hint of a red ash mist go, (squeaking) where they once were, and they are all turned to black nothingness. However, roll damage for the ogres. They get half damage because they made their reflex save. So 8d6 damage."
SAM,02:30:57,02:31:06,8d6.
SAM,02:31:06,02:31:10,(counting) 27!
