speaker,start_time,end_time,text
MARISHA,01:24:39,01:24:40,Yeah.
MATT,01:24:40,01:25:13,"This array of strange puffy fireworks in the fog; you doing this little rotation. You actually manage to do a bear cartwheel, and slam into the ring, but it looks pretty cool. You get back up. You're on your hind legs, you dance on one foot for a second. Balgus is like, (raucous laughter). He starts laughing, doubles over, clutching his stomach, laughing his ass off. Other dwarves start laughing too. The music gets louder and the band in the back of the tavern begins playing again. There's now this general jovial air restored to the tavern."
LAURA,01:25:13,01:25:19,"I grab an empty cup off of the table and say: Tips for the bear, right here!"
SAM,01:25:19,01:25:21,We're going to get money for this?
TRAVIS,01:25:21,01:25:22,Of course.
LIAM,01:25:22,01:25:30,"I beeline to the bar and say: A large mug of ale, please. As soon as it's ready, bring it right over to Balgus."
MATT,01:25:30,01:25:48,"You guys are pulling through a crowd, covered in mist still. You're having a hard time finding your way through the bar. The people are at least now cheering, in the mood. There's still some people trying to find their way to the front to see what's going because they hear the music and they hear the cheering. ""Well, what's going on over there?"" They're pushing their way through. You make your way to the bar. You see Adra's really nervous, like, (panicked sounds)"
LIAM,01:25:48,01:25:49,I can fix this!
MATT,01:25:49,01:25:51,"""How? Do! Go!"""
LIAM,01:25:51,01:25:51,Quickly?
MATT,01:25:51,01:25:53,"""Here, go!"" She hands you one, doesn't even charge you for it."
MARISHA,01:25:53,01:25:55,I'm still dancing!
LIAM,01:25:55,01:25:57,Looking for Balgus in the crowd.
MATT,01:25:57,01:26:07,"He's still in the center of the ring. No one's still getting near Balgus. They're cheering off to the side. Balgus is laughing. ""Ooh, growl for me! Do a happy growl!"""
MARISHA,01:26:07,01:26:11,(growls)
MATT,01:26:11,01:26:23,"""Yeah, there's a happy growl! Oh, it's been so long since I've been outside!"" A little tear on the edge of his face. As you approach up his side--"
LIAM,01:26:23,01:26:24,Arm around his shoulder.
MATT,01:26:24,01:26:28,"Immediately, instinctively, he slaps it off his arm and turns around."
LIAM,01:26:28,01:26:42,"Take this! You are an impressive specimen, my good man. I have never had a fight that amazing in at least a week. That was something to see. Here, take this, and after this one there's three more."
MATT,01:26:42,01:26:48,"He's drunk, you're offering him ale, and he's been laughing at a bear for two minutes. Make a persuasion roll with advantage."
LIAM,01:26:48,01:26:51,"Yeah! Persuasion, you say? 15."
MATT,01:26:51,01:26:54,"Two rolls, yeah, you have advantage."
LIAM,01:26:54,01:26:56,Oh! 15.
MATT,01:26:56,01:27:26,"15! He looks at you with this big grin, and you can now see his gnarled, yellow dwarven teeth, this railroad of terror that his mouth is. This big smile. He reaches out, his beard poofing over the side, grabs it and goes, ""See, now this is dwarven hospitality!"" He lifts his drink up and it spills a little bit on his arm. He's like, ""Hey!"" Everyone lifts up and cheers again. (cheering)"
MATT,01:27:26,01:27:41,"Everyone still keeps drinking through the fog. It's like a bad sauna in here right now. Everyone's fighting their way through. At which point now, Balgus slaps you on the shoulder, takes a drink, and wanders out of the fight ring, goes and finds a table to sit down and begin chugging what you gave him."
SAM,01:27:41,01:27:45,Why don't we adjourn for the evening? Retire to our rooms?
TRAVIS,01:27:45,01:27:47,Why don't you go change out of bear form?
MARISHA,01:27:47,01:27:49,"Yeah, and I guess I can let Trinket change out of mouse form."
SAM,01:27:49,01:27:51,Why don't you wait until we're upstairs?
LAURA,01:27:51,01:27:53,Can I take the mouse? Can I take Trinket?
SAM,01:27:53,01:27:54,"Here, rat-mouse-thing."
LAURA,01:27:54,01:27:59,"Okay, hi, Trinket! Oh, is his armor teeny tiny too?"
MARISHA,01:27:59,01:28:02,"Oh, does he have a tiny armor mouse? Mouse armor!"
MATT,01:28:02,01:28:13,"If you choose, while polymorphing him, you could make it as a visual aesthetic. Because it was a quick impact, I would say it looks like a normal mouse right now. Sorry. Next time!"
LAURA,01:28:13,01:28:19,Well you're still adorable little-- don't poke him.
MATT,01:28:19,01:28:21,(squeaks)
LAURA,01:28:21,01:28:22,I stick him in my little pocket.
LIAM,01:28:22,01:28:33,"I grab a half a mug of ale off the table and say, ""Dwarven compatriots, we could not have expected a better welcome here in Kraghammer! We'll see you tomorrow night for round two. Thank you, one and all."""
ALL,01:28:33,01:28:35,Huzzah!
MATT,01:28:35,01:28:41,"(cheering) Balgus goes, ""Three more! You said three more!"" You see his empty cup on the table."
TRAVIS,01:28:41,01:28:43,We did say three more.
LAURA,01:28:43,01:28:47,"I laugh and hustle her over and say: One, two, three, put them in a row for this gentleman right here."
MATT,01:28:47,01:28:58,"""Aye! (whispers) Thanks."" She gives you like a really earnest like, ""Thank you."" You now have a very good idea of how a good third of the tables in this tavern are repaired."
TRAVIS,01:28:58,01:29:00,He's tough.
MATT,01:29:00,01:29:02,You guys head back up to the rooms.
TRAVIS,01:29:02,01:29:03,You put some stank on him.
MATT,01:29:03,01:29:06,"Yeah, that was like a (vibrating) when you got the impact on him."
LAURA,01:29:06,01:29:07,"Don't fight him, you guys."
SAM,01:29:07,01:29:09,"Oh, Grog's going to fight him at some point."
MATT,01:29:09,01:29:11,I get the feeling that's probably going to go down at some point.
TRAVIS,01:29:11,01:29:13,He's going to be playmates with me.
LIAM,01:29:13,01:29:16,It's just a misunderstanding. I'm sure he's a lovely gentleman.
MATT,01:29:16,01:29:25,"You guys are heading back up to the room. Which, it's not a hallway built for a bear. Your shoulders are squeezing through."
LAURA,01:29:25,01:29:27,How big is the room?
MATT,01:29:27,01:29:32,"Well, each one of your rooms comfortably fits two people, maybe. Like, one and a half?"
LAURA,01:29:32,01:29:33,Oh no. What will I do with Trinket?
MATT,01:29:33,01:29:57,"If you help push Trinket through the door. Thankfully, dwarves are fairly wide folk, so the doors are built for stouter folk, they're just not very tall. You, actually, have to bend through, Grog, to get into your room. On the bed that you lie on, your legs dangle a good two feet off the bottom, at maximum. You can push Trinket through with a one, two, three! Or you can carry her through as a mouse, and then have her stuck in there."
MARISHA,01:29:57,01:29:58,Yeah.
LIAM,01:29:58,01:30:00,That's all right. Neither of us need a blanket now.
LAURA,01:30:00,01:30:01,Well.
MARISHA,01:30:01,01:30:04,How long can I keep her a mouse?
LAURA,01:30:04,01:30:06,"Him! Trinket's a boy, all of you, please."
MARISHA,01:30:06,01:30:08,Up to an hour?
MATT,01:30:08,01:30:09,"I believe it is, yeah, concentration."
TRAVIS,01:30:09,01:30:12,"I mean, are there like stables?"
LAURA,01:30:12,01:30:17,"You know, yeah. Can I go downstairs and ask about stables? Maybe he can stay in the stables."
MATT,01:30:17,01:30:24,"You have to talk to Adra. She's like, ""There's no stables in this establishment, but we do have a downstairs storage area your bear can probably stay in."""
TRAVIS,01:30:24,01:30:27,"Yeah, he's a bear, he's fine."
LAURA,01:30:27,01:30:28,"Trinket, is that okay?"
TRAVIS,01:30:28,01:30:30,"(as Trinket) Yeah, I'm fine."
LAURA,01:30:30,01:30:40,"All right, yeah, he's seems to think it's all right. Let's go with the storage room. If there's anything that looks edible, you can eat it. It's fine."
MATT,01:30:40,01:30:41,"""That's not true."""
LAURA,01:30:41,01:30:43,Just kidding!
MATT,01:30:43,01:30:46,"""I'll charge you later."""
MATT,01:30:46,01:30:50,You bring Trinket back down. Do you release your polymorph?
MARISHA,01:30:50,01:30:52,Yeah.
MATT,01:30:52,01:30:56,Trinket becomes a bear again. I'd say the room's probably a good 40 feet by 30 feet.
LAURA,01:30:56,01:30:57,"Oh, so he's fine."
MATT,01:30:57,01:31:12,"Half of it's filled with barrels and crates, and storage of dried foods. Trinket comes in and (sniffing) and starts rummaging into one of the half open sacks of dried meat. That's going to be put on your bill."
LAURA,01:31:12,01:31:12,Shit.
MATT,01:31:12,01:31:15,You head back to your rooms for the evening to rest.
MARISHA,01:31:15,01:31:16,Take a nap.
MATT,01:31:16,01:31:17,Anything you guys want to do in preparation for the next day?
SAM,01:31:17,01:31:20,"No, let's get it on."
MARISHA,01:31:20,01:31:23,"Oh, we should give our comment cards to Balgus."
TALIESIN,01:31:23,01:31:25,I think we should all turn in our comment cards.
LAURA,01:31:25,01:31:28,"Oh, our comments cards, that's right."
MATT,01:31:28,01:31:30,You turn in your comment cards for Balan.
MARISHA,01:31:30,01:31:31,Balan.
TALIESIN,01:31:31,01:31:33,I can't stress how important this is.
LIAM,01:31:33,01:31:36,"Maybe we should-- go ahead, I'm sorry."
TALIESIN,01:31:36,01:31:39,"No, no, really, no it's fine, speak over me, I don't care."
MARISHA,01:31:39,01:31:40,"Here, take him the extras."
TALIESIN,01:31:40,01:31:43,We're going to give him a few extras so he can have more comments.
MARISHA,01:31:43,01:31:44,Yes.
SAM,01:31:44,01:31:46,You guys are so kind with these comment cards.
LIAM,01:31:46,01:31:54,"Perhaps we should all go to bed, and the humans back in North Hollywood should take a pee break. At some point."
SAM,01:31:54,01:31:55,The humans?
LIAM,01:31:55,01:31:58,"You. You, and you and you and you and me."
MATT,01:31:58,01:32:01,"Yes, indeed. Do you want to take a quick restroom break for the folks here?"
SAM,01:32:01,01:32:02,You okay?
MATT,01:32:02,01:32:04,Zac?
ZAC,01:32:04,01:32:06,What's that?
MATT,01:32:06,01:32:08,Folks here might want to use the restroom real fast.
ZAC,01:32:08,01:32:10,You want me to play the intro videos again?
MATT,01:32:10,01:32:20,"You know what, go ahead and play some of the intro videos and we'll come back here in a minute to continue the game, while everyone rests, and empties their bladders. We'll be right back guys. Hang tight."
SAM,01:32:20,01:32:22,Commercial break.
TRAVIS,01:32:22,01:32:43,"Right, listen up! If you have ale, then you have a friend in Grog Strongjaw! A goliath of towering height and size, this barbarian has an appetite for the two great loves in his life: combat, women, and ale! [record scratch]"
TRAVIS,01:32:43,01:34:09,"Wait. Easily the brains of the group, Grog is often consulted for his vast knowledge of shapes, colors, and shiny things! Also ale. In his early years, armed with his two-handed greataxe, Grog often enjoyed proving his might amongst the ranks of his family's wandering herd. But after coming upon an unsuspecting elderly gnome in the woods, he objected to the killing such an innocent life. A creature of impulse, Grog felt only pity for this-- well, this terrified little thing. And his disobedience cost him dearly. Beaten bloody, and banished by the herd leader, his Uncle Kevdak, Grog was abandoned and left to die. Exiled from his herd, it was then that the relative of the very gnome he fought to save, saved him. It was the kindness of a gnome cleric named Pike that healed Grog, bringing him back from death's edge. And they have remained close friends ever since. Most nights, Grog can be found challenging entire taverns to wrestling matches! Or accompanying Scanlan to the nearest house where you pay for lady favors. Also ale!"
MARISHA,01:34:09,01:34:28,"A first impression of Keyleth would leave you with little information on the half-elven druid. You might even think that her social awkwardness due to her sheltered upbringing is kind of sweet. Of course, it would be unwise underestimate her based on first impressions. [thunder crack]"
MARISHA,01:34:28,01:36:11,"Under that un-intimidating petite frame is a vicious beast waiting to be unleashed, whose natural powers have made even the fiercest of champions pee their pants, literally! Born to the Air Tribe of the Ashari people, Keyleth was raised with a deep love of nature and the elemental magics. It is her people's inherent duty to protect the delicate areas in Tal'Dorei where the four elemental planes begin to bleed with this realm. Since she was a little girl, she had quite a knack for air manipulation and beast shaping abilities. Well, if you consider kittens and flying squirrels to be little beasts. Which, I do. Anyways, it wasn't long before the headmaster of the tribe, her father, Korren, realized her true prodigious abilities and she was inveterated to succeed him as the next headmaster. Just like that, her jovial childhood was stripped and replaced with endless spell memorization, teachings from ancient traditions, and exceedingly high expectations. Every druid leader-to-be must embark on journey to seek out the sister tribes in order to introduce and establish respect amongst the fellow headmasters. They call this the Aramente, or Noble Odyssey. When her father felt she was ready, he set her on the path to truly discovering herself, not knowing when, or if, she will ever return. As she hiked down the mountain towards Stilben, she meditated on the task ahead. Part of the Aramente is proving yourself a strong warrior, a valiant protector, and a wise and compassionate leader. With this knowledge, one thought plays in repeat in her mind: Is she even worthy?"
TALIESIN,01:36:11,01:37:24,"Percy was the third child of seven children, born to a noble family who lived far to the north in the ancient castle of Whitestone. With so many siblings to share the burdens of lordship, Percy turned his attention to the sciences, engineering, and naturalism. One day, a mysterious couple, named Lord and Lady Briarwood, came to court. During a feast held in their honor, the Briarwoods violently took control of the castle, killing or imprisoning everyone who would stand in their way. Percy awoke chained in the dungeon, only to be freed by his younger sister. Together they fled, chased by the Briarwoods' men. As they ran, Percy's sister took several arrows to the chest and fell. Percy kept running, eventually jumping into a freezing river and floating unconscious to freedom. He did not remember waking up on a fishing boat. He barely remembered the next two years, as he slowly made his way as far south as possible. Then one night, Percy had a dream. A roaring cloud of smoke offered him vengeance against those who destroyed his family. When he awoke, Percy began to design his first gun."
SAM,01:37:24,01:38:48,"Oh, you haven't heard of Scanlan Shorthalt? Well, gird your loins, ladies, because he has his eye on you. A talented musician, master of disguise, and dashingly handsome in his own mind, Scanlan sings songs almost as much as he sings his own praises. Born a poor gnome, Scanlan used his endless charm and soaring tenor voice to croon for coin and support his single mother. One day, he was discovered by a half-orc promoter, and joined Dr. Dranzel's Spectacular Traveling Troupe where he learned the ways of the world, and honed his skills as a bard extraordinaire. A loner much of his life, Scanlan has never quite come to terms with the violent death of his mother at the hands of a goblin invasion. While his years on the road provided many, shall we say, educational experiences with the opposite sex, deep down Scanlan yearns for the one thing he's never known: the true love of a fellow gnome. Still, Scanlan considers himself a lover first, performer second, and fighter distant third. On the battlefield, he'll support his allies, but rarely draws blood, unless it's to protect fellow gnome, Pike. Count on Scanlan for a hearty laugh, a rollicking song, and a twinkle in his eye that melts hearts and makes the females swoon."
ORION,01:38:48,01:40:46,"Greetings and salutations, I am Tiberius Stormwind. I hail from a town called Ty'rex, located in the heart of Draconia, born from a politically respected family. At the age of 15, I succeeded in passing the Sorcerer's Rite, showing prodigy-like control of my magic. The judges and the Draconian high council were amazed at how powerful my spells were for how long I had been training. At 20 years old, I was the youngest appointed member of the magic guild in Draconian history. For the next few years, I almost went mad from the malaise of being a guild member, as it's rather boring. However, one day I happened upon a chamber, unused for quite some time. In the room were stacks of books and maps of the surrounding cities and areas around the known world. For months, I would frequent the chamber, and learned of artifacts from legend. After a long period of research, I made a list of artifacts that caught my eye. I brought these findings to the high council and was told that all of the information in the chamber I had stumbled upon was either believed to be fiction, or unsolvable mysteries, and hence were lost forever. I found those answers to be unacceptable. A year later, I devised a ruse and managed to convince the city council to lend support in me leaving Draconia on a mission of peace and diplomacy for the surrounding kingdoms. Going from town to town and making friends and allies in and for the name of Draconia. Being a red dragonborn, I had quite the task on my hands in that respect, but it was exactly what I needed so I could explore the world and find these artifacts, as I felt the truth was out there. Some may describe me as buffoonish, but I say poppycock to all that. I am much sharper than most give me credit for. I just don't pay attention to things sometimes. I've also been known to be rather cunning, loyal, happy-go-lucky, and well, dangerous. I can't help but show my true scales every now and then. But overall, I think I'm quite friendly for a dragonborn."
LIAM,01:40:46,01:42:16,"Never entirely welcome in the company of elves or men, Vax'ildan learned at a young age to skip past formality, preferring instead to invite himself in your door. Along with twin sister Vex'ahlia, Vax was born by a chance encounter between elven royalty and human peasantry. Raised by their mother in their early years, the twins were eventually sent off to their father in the elven capital of Syngorn. But their cool reception among the elves there never warmed, and their time in the capital didn't last. The siblings stole away one autumn night and set out on the open road. After a few years of wandering, they eventually decided to return to their mother, and journeyed back to the lands of their youth. But instead of finding their childhood home, they returned to a pile of rubble. Their mother was gone, their home burned to ash. Pressing the townspeople for answers, they learned of the day the dragon came. With their ties all severed, Vax'ildan and his sister set out to find their fortune together in Tal'Dorei. An outsider since birth, Vax quickly learned to solve life's challenges in his own particular way, often by sidestepping them entirely. And when his knack for circumventing adversity isn't enough, the way of blades the elves schooled him in more than makes up the difference."
LAURA,01:42:16,01:43:40,"Like so many half-elves, Vex'ahlia has spent most of her life suffering the cool reception of a people who don't fully accept her. Born of a human mother, and an elven father who only later in life took an interest in their existence, Vex'ahlia and her twin brother, Vax'ildan, quickly realized the only people they could truly rely on in this world were each other. It was at the age of ten when the two were taken from their mother, and brought to live in Syngorn, the isolated elven city for which their father was an ambassador. He quietly took them in, but always kept an icy distance, and after too many years of disdainful looks, the pair decided to leave his indifference behind, and set out on their own. Vax took to the cities, stealing small trinkets and learning the ways of the thief, while Vex kept to the woods. She preferred the isolation. Always the keen observer, she learned to hunt and to track, to spy and to shoot. Through a series of fateful events, earned herself a companion in the form of a bear-- her own stolen Trinket-- to fight alongside her and protect her fiercely. Also, he is adorable, and gives expert massages."
MATT,01:43:40,01:44:06,"Hello, everyone. Welcome back. We've had our pee breaks. We've had our refills of our drinks. We've got Fireball, so I think we're good for the next venture. Anyway, the party has taken their rest for the evening. Once again, this is one of those weird experiences where you wake up, not because of the sun rising, because you can't see it in the dwarven city of Kraghammer, but eventually you all come to consciousness naturally. What is your plan of action?"
SAM,01:44:06,01:44:09,"Oh, Jesus, we should have all talked about this while we were all peeing."
TRAVIS,01:44:09,01:44:11,"We're going to beat up everybody, right?"
SAM,01:44:11,01:44:12,Are we going to the manor?
TALIESIN,01:44:12,01:44:14,"I say we have brunch, and we go to the manor--"
"LAURA, TRAVIS",01:44:14,01:44:16,Brunch?
SAM,01:44:16,01:44:18,Eggs benedict.
TALIESIN,01:44:18,01:44:19,I want dwarven brunch.
LIAM,01:44:19,01:44:21,I want a traditional dwarven breakfast.
MARISHA,01:44:21,01:44:24,Dwarven eggs are very good.
TALIESIN,01:44:24,01:44:27,They're small.
MATT,01:44:27,01:44:32,"Okay, so Tiberius fills you all in about his experience, trying to get into the House Thunderbrand."
TRAVIS,01:44:32,01:44:34,How you almost got killed?
ORION,01:44:34,01:44:37,"I didn't, certainly not. I just couldn't get in the door. Rather rude!"
MARISHA,01:44:37,01:44:44,Why did you think that after the magic hand failed that the big thunder ice wave would work?
ORION,01:44:44,01:44:49,What I thought is that I could cover the rune with ice and merely step over it. I didn't think it would dissolve my ice.
TRAVIS,01:44:49,01:44:51,Did you sleep?
ORION,01:44:51,01:44:53,Yes.
TRAVIS,01:44:53,01:44:57,"Oh. I had to make sure, you know."
ORION,01:44:57,01:45:05,"A good sorcerer always all his tricks before turning around, which is what I did. I think we should go back there because I feel that it's significant that I couldn't get in so easily."
TALIESIN,01:45:05,01:45:12,We will go back there. I don't think it's the next order of business but I think that we're not leaving the city without dealing with that.
LAURA,01:45:12,01:45:12,Definitely.
TRAVIS,01:45:12,01:45:15,Do we need to do something with the comment cards?
LAURA,01:45:15,01:45:15,Oh.
TALIESIN,01:45:15,01:45:17,Did you not fill out your comment card?
TRAVIS,01:45:17,01:45:23,"No, I did! I know, like, three letters, so like A, F, and A."
MARISHA,01:45:23,01:45:24,That's okay.
TALIESIN,01:45:24,01:45:26,That sounds very positive.
MARISHA,01:45:26,01:45:29,"It's the thought that counts, Grog. It's the thought that counts."
LAURA,01:45:29,01:45:32,Did you put a smiley face next to the A-F-A?
TRAVIS,01:45:32,01:45:33,I covered my hand in ink.
LAURA,01:45:33,01:45:34,That works.
TALIESIN,01:45:34,01:45:37,Very good. I think that went well.
SAM,01:45:37,01:45:41,"Shall we try to make our way to the manor, then?"
LAURA,01:45:41,01:45:45,"The Greyspine Manor, with our cask of fancy ale/wine."
TRAVIS,01:45:45,01:45:47,Does the light ever change being underground?
MATT,01:45:47,01:45:57,"No, it is a perpetual low red glow from all the stones that are embedded around the streets. LAURA:I feel really sleepy and also very awake at the same time."
MARISHA,01:45:57,01:45:58,"Yeah, I know."
MATT,01:45:58,01:45:59,"Oh, dwarves."
LAURA,01:45:59,01:46:01,So what do you think?
TALIESIN,01:46:01,01:46:03,Now I'm curious if there's dwarven coffee.
MATT,01:46:03,01:46:06,"You guys make your way after your brunch, your delicious dwarven brunch--"
TALIESIN,01:46:06,01:46:07,Thank you!
MATT,01:46:07,01:46:09,-- which is very alcoholic.
TRAVIS,01:46:09,01:46:10,Yes!
TALIESIN,01:46:10,01:46:16,"It's like being in New Orleans for the weekend, every meal is going to come with something alcoholic."
LAURA,01:46:16,01:46:17,You're turning yourself into a dwarf?
SAM,01:46:17,01:46:19,Did you catch that? He just turned himself into a dwarf.
TRAVIS,01:46:19,01:46:19,You did?
MATT,01:46:19,01:46:21,Tiberius went (whoosh) into a dwarven form.
LAURA,01:46:21,01:46:23,What kind of dwarf? What do you look like?
SAM,01:46:23,01:46:25,He's very handsome for a dwarf.
LAURA,01:46:25,01:46:26,Are you a girl dwarf?
MARISHA,01:46:26,01:46:28,Yes! You should be a lady dwarf.
SAM,01:46:28,01:46:30,"Oh yeah, what kind of dwarf? A lady dwarf?"
ORION,01:46:30,01:46:31,I would not do that again.
TRAVIS,01:46:31,01:46:34,"Oh, you did do that, you did take it as a troll."
ORION,01:46:34,01:46:38,Almost! She shot off the penis.
LIAM,01:46:38,01:46:40,What is going on?
TRAVIS,01:46:40,01:46:41,That's where the troll dick came from.
ORION,01:46:41,01:46:44,"Don't you remember, Vax? I was almost raped by trolls."
MATT,01:46:44,01:46:57,"There was a cavern interaction with two male trolls that they had stealthed up behind as a party. I love explaining this to the audience. Tiberius then polymorphed into a female troll to try and Bugs Bunny them, not realizing that dwarves who are underground and--"
LAURA,01:46:57,01:46:58,Trolls.
MATT,01:46:58,01:47:14,"--trolls don't encounter female trolls often enough to have a one track mind. He nearly got himself in a very bad situation. That was remedied by the party attacking and Vex over here shooting off the troll's dick. Which then went in the bag of holding, which is disgusting."
