speaker,start_time,end_time,text
LAURA,00:48:33,00:48:38,Marius? Please. He would lose his memory in two seconds and be stuck here forever.
MARISHA,00:48:38,00:48:39,"Yeah, he does suck."
SAM,00:48:39,00:48:41,"Well, as long as he brought the stuff."
LIAM,00:48:41,00:48:44,"I can make you another banner, as well."
LAURA,00:48:44,00:48:44,Oh.
LIAM,00:48:44,00:48:47,Yeah.
TRAVIS,00:48:47,00:48:50,"Marius still hasn't killed anyone, has he?"
MARISHA,00:48:50,00:48:52,"No, he sucks, that's what I said!"
LAURA,00:48:52,00:48:53,"No, he's fine, he's good."
TALIESIN,00:48:53,00:48:55,Plenty of reasonable people I know haven't killed anybody.
MARISHA,00:48:55,00:48:55,(scoffs)
TRAVIS,00:48:55,00:48:59,Name one.
TALIESIN,00:48:59,00:49:04,"Okay, that's a fair point. (laughter)"
LAURA,00:49:04,00:49:05,That's really sad.
TRAVIS,00:49:05,00:49:05,"I know, yes."
ASHLEY,00:49:05,00:49:06,It is sad.
TRAVIS,00:49:06,00:49:07,We need to be better people.
TALIESIN,00:49:07,00:49:12,I'm seriously worrying about a lot of decisions I made in my life. (laughter)
TRAVIS,00:49:12,00:49:14,"Yes, but they were all bad."
TALIESIN,00:49:14,00:49:17,"I mean, it's rough out there."
LAURA,00:49:17,00:49:25,"What if we turn into giant birds, and we just grab everyone, and we fly, and that way we don't have to walk across the island? And we can get there super fast!"
SAM,00:49:25,00:49:27,"Grab everyone, you mean us, grab us?"
LAURA,00:49:27,00:49:27,Yeah!
SAM,00:49:27,00:49:30,"Yeah, that sounds good."
TALIESIN,00:49:30,00:49:33,"Are we going to Wonder Twins this, is that the plan?"
TRAVIS,00:49:33,00:49:40,"Or you could just go and come back before dinner, unless you wanted to also scope out the Shaded Tangle entrance?"
TALIESIN,00:49:40,00:49:44,I'll also say: I'm a little worried about eating the food.
LAURA,00:49:44,00:49:45,"I know, I am, too."
MARISHA,00:49:45,00:49:48,"Well, we volunteered to help cook, so we'll get a closer--"
TALIESIN,00:49:48,00:49:50,That's why I did.
SAM,00:49:50,00:49:52,Is it because of gluten?
TALIESIN,00:49:52,00:49:56,"I mean, that's a concern, but I'm pretty sure I'm fine. No."
MARISHA,00:49:56,00:49:57,"The avocado thing, makes sense."
TRAVIS,00:49:57,00:50:00,International food can be quite rewarding. You should really give it a try.
TALIESIN,00:50:00,00:50:05,Considering that the only person who's eaten anything on this island so far is--
ASHLEY,00:50:05,00:50:13,"Yeah, it was a little tough to eat, but I think I'm very excited to try the food of the land."
LAURA,00:50:13,00:50:15,Do you feel like it's going to give you the shits?
ASHLEY,00:50:15,00:50:16,Say again?
TRAVIS,00:50:16,00:50:17,"It was spicy, wasn't it?"
ASHLEY,00:50:17,00:50:27,"It was spicy, but I don't think it's going to go bad the further down it goes, you know? I think it's okay. I think the food's going to be very good."
TALIESIN,00:50:27,00:50:29,I worry that the food might be part of the problem.
TRAVIS,00:50:29,00:50:31,(upset stomach noises)
TALIESIN,00:50:31,00:50:34,I don't have the tools right now to really know.
MARISHA,00:50:34,00:50:42,"There was a lot of nodding and smiling, in all the villagers, you notice that? Like everyone, you were like, ""Hey, are you happy? Do you like it here?"" and they were just like--"
LIAM,00:50:42,00:50:42,"No, they are not right in the head."
SAM,00:50:42,00:50:45,They're nice people!
MARISHA,00:50:45,00:50:50,"And then they were like, ""We don't want to move into your house. We can totally camp outside."" And they were like (vocalizing)"
SAM,00:50:50,00:50:54,"They're nice. That's what nice people look like, Beau!"
MARISHA,00:50:54,00:50:58,Name one nice person. We just talked about how we only know people-- that's not real!
SAM,00:50:58,00:50:59,We've killed all the nice people.
LIAM,00:50:59,00:51:07,"It's unsettling. They don't know why they've come here, they don't remember where they came from, they have nothing on them except for rags."
TALIESIN,00:51:07,00:51:10,"Yeah, I love nice, but you got to have boundaries."
LIAM,00:51:10,00:51:14,Yeah.
TRAVIS,00:51:14,00:51:23,"Okay, so what are we doing before dinner? Flying back and coming back? Or only a few going, and the rest of us stay?"
LAURA,00:51:23,00:51:24,"Going what, to the boat?"
TRAVIS,00:51:24,00:51:26,I thought you said you were going to get supplies or some shit!
SAM,00:51:26,00:51:27,I think she was talking about flying us across the island to go to the Ruins.
LAURA,00:51:27,00:51:30,"Yes, that's what I said."
TRAVIS,00:51:30,00:51:30,"Oh great, so we're just hanging out until dinner, then?"
ASHLEY,00:51:30,00:51:32,I'm very curious about these Ruins.
SAM,00:51:32,00:51:32,I think so.
LAURA,00:51:32,00:51:33,I think so.
LIAM,00:51:33,00:51:38,"Well, I don't-- are we just going to scope it out further? We're not going to go exploring?"
TRAVIS,00:51:38,00:51:39,"I guess we could walk around the village, yeah."
MARISHA,00:51:39,00:51:41,"Yeah, let's do that."
LAURA,00:51:41,00:51:41,"Yeah, let's walk around."
MARISHA,00:51:41,00:51:43,Yeah.
TRAVIS,00:51:43,00:51:48,"We grab our hotel room keys, and we head out to explore the resort. (laughter)"
MATT,00:51:48,00:51:53,All right. We'll say for the purposes of--
MARISHA,00:51:53,00:51:53,Four Seasons Tree Trunk!
MATT,00:51:53,00:51:59,"-- the circumstance, you guys have spent a little bit time in the house, just getting your bearings, like a short rest, while you're in there."
LAURA,00:51:59,00:51:59,Yeah.
TALIESIN,00:51:59,00:52:01,I need a short rest.
MATT,00:52:01,00:52:21,"If you needed it. You do sense, and still in this house, it hasn't really left you, and you guys haven't talked about it openly, but you all still feel that creeping sense that you're being watched."
TALIESIN,00:52:21,00:52:21,You know--
TRAVIS,00:52:21,00:52:23,"You keep fucking saying that, DM!"
MARISHA,00:52:23,00:52:25,Is that something we should talk about? (laughter)
MATT,00:52:25,00:52:29,"You don't have to if you don't want to, but I will say--"
SAM,00:52:29,00:52:32,"Fjord, do you want to do your See Invisibility thing, maybe?"
LAURA,00:52:32,00:52:34,"That would be so smart! Ooh, ooh!"
TRAVIS,00:52:34,00:52:34,My what?
LAURA,00:52:34,00:52:36,Is that okay to drink?
TRAVIS,00:52:36,00:52:42,"It's been here for, you know, a couple weeks. (laughter) I can see invisibility?"
SAM,00:52:42,00:52:44,"Yes, you can see invisibility!"
TRAVIS,00:52:44,00:52:47,Sure! (explosion) I'll summon the sword.
MATT,00:52:47,00:52:48,All right. (laughter)
TRAVIS,00:52:48,00:52:54,And I will (explosion) cast See Invisibility. (laughter)
ASHLEY,00:52:54,00:52:55,Cool!
MATT,00:52:55,00:53:14,"You do, and as your vision shimmers, that faint veil of silver gossamer that permeates the vicinity, that would itself adhere to and bring prominently forth, anything that is invisible, reveals nothing out of the ordinary."
TRAVIS,00:53:14,00:53:17,They're ... everywhere!
LAURA,00:53:17,00:53:17,What?
MARISHA,00:53:17,00:53:18,"What, what is?"
TRAVIS,00:53:18,00:53:24,"Beasts of incalculable size-- no, I can't fucking-- there's nothing, we're fine. (laughter)"
SAM,00:53:24,00:53:31,"When we walk around the village, should I go invisible, just in case you want me to, like, go scope something out that's behind the curtain or something?"
MARISHA,00:53:31,00:53:31,Yeah! That sounds great!
SAM,00:53:31,00:53:33,Yeah?
LAURA,00:53:33,00:53:34,We'll just say you're sleeping.
MARISHA,00:53:34,00:53:34,Yeah.
SAM,00:53:34,00:53:35,"Yeah, yeah, yeah."
MARISHA,00:53:35,00:53:37,"Yeah, you got indigestion."
SAM,00:53:37,00:53:39,"Yeah, I ate some of the flower things."
ASHLEY,00:53:39,00:53:40,You ate some of the flowers.
TALIESIN,00:53:40,00:53:44,"Just for fun, I'm going to burn a Divine Intervention."
MATT,00:53:44,00:53:45,"Okay, go for it."
TALIESIN,00:53:45,00:53:54,"What's watching us? Nope. (laughter) It-- never going to happen, but it's always worth trying."
MATT,00:53:54,00:53:57,"Sure. If you got a Commune spell later, you could always try that."
TALIESIN,00:53:57,00:53:58,Not 'til tomorrow.
TRAVIS,00:53:58,00:54:04,Do we see Doron as we're leaving? The dwarf whose family normally resides here?
MATT,00:54:04,00:54:14,"No, the family is no longer waiting outside of the abode. You guys have been left on your own, and there's nobody waiting for you when you exit. Everyone's returned to their general routine."
MARISHA,00:54:14,00:54:14,Are there dwarves-- sorry.
MATT,00:54:14,00:54:25,"I do, however, if I could get everyone, if you don't mind to just make an investigation check for me?"
TALIESIN,00:54:25,00:54:26,I hate investigation checks.
MARISHA,00:54:26,00:54:30,I love it!
TRAVIS,00:54:30,00:54:30,"Woo, yeah!"
MARISHA,00:54:30,00:54:33,What? Ooh hoo hoo.
TRAVIS,00:54:33,00:54:33,25.
ASHLEY,00:54:33,00:54:35,Damn!
LAURA,00:54:35,00:54:35,18.
LIAM,00:54:35,00:54:37,21.
SAM,00:54:37,00:54:41,Natural 20 plus 11. (exclaiming)
ASHLEY,00:54:41,00:54:41,17.
MATT,00:54:41,00:54:42,All right.
TALIESIN,00:54:42,00:54:42,15.
MATT,00:54:42,00:54:44,Okay.
MARISHA,00:54:44,00:54:44,23.
LAURA,00:54:44,00:54:45,Wow!
MATT,00:54:45,00:54:45,Not too bad.
ASHLEY,00:54:45,00:54:47,"Okay, okay."
MATT,00:54:47,00:54:50,"All right, cool. So you continue on."
MARISHA,00:54:50,00:54:52,"Well wait, wait, wait, wait!"
SAM,00:54:52,00:54:53,We didn't get to see.
MARISHA,00:54:53,00:54:56,Are the drawers-- are there cabinets in this house? Is there a safe?
TRAVIS,00:54:56,00:54:56,What?
MARISHA,00:54:56,00:54:59,What did they leave behind?
MATT,00:54:59,00:55:04,It's basic furniture. There's no cabinets. There isn't a massive need for cabinetry here.
MARISHA,00:55:04,00:55:07,"Well, bedside-- hotels. Is there, you know--?"
MATT,00:55:07,00:55:08,(laughs) There is no Gideon's Bible.
TRAVIS,00:55:08,00:55:10,"Gideon Bible, yeah! (laughter)"
MATT,00:55:10,00:55:21,"But like I said, there's a handful of really simple bed platforms, and there is a table, and some stools, and that's primarily it."
MARISHA,00:55:21,00:55:21,No other belongings?
ASHLEY,00:55:21,00:55:22,No decorations?
MARISHA,00:55:22,00:55:24,"Yeah, decorations?"
MATT,00:55:24,00:55:24,No decorations.
SAM,00:55:24,00:55:27,Do it with two hands!
MARISHA,00:55:27,00:55:37,No other sign that it feels like someone's home? Does it just look like a crash pad?
MATT,00:55:37,00:55:39,Kind of. Things may have been taken out.
TALIESIN,00:55:39,00:55:50,"Is there a sense maybe, just in the discoloration of the walls or otherwise that there was once furniture or things in here? You know how sometimes you just get a little impression from things of being against a wall for too long, and then you..."
MATT,00:55:50,00:55:53,Um...
TALIESIN,00:55:53,00:55:59,Just if there's anything that hints that this was once a more lavish home?
MATT,00:55:59,00:56:03,Go ahead... Go ahead and make an investigation check.
TALIESIN,00:56:03,00:56:03,All right.
MARISHA,00:56:03,00:56:05,"Come on, Cad!"
TALIESIN,00:56:05,00:56:07,I'm going to boost this one because this is something--
TRAVIS,00:56:07,00:56:09,How do you boost it?
TALIESIN,00:56:09,00:56:09,I'm using Guidance.
LAURA,00:56:09,00:56:11,Guidance!
TRAVIS,00:56:11,00:56:13,"Didn't know if you were, like, (choir vocalizing)."
ASHLEY,00:56:13,00:56:14,(choir vocalizing)
TALIESIN,00:56:14,00:56:20,"Oh! All right, that's 22!"
MATT,00:56:20,00:56:22,Nice!
TALIESIN,00:56:22,00:56:24,No. (laughter)
MATT,00:56:24,00:56:43,"Best that you can tell, the only things that have been taken have been simple weapons or tools. Things that might-- you can see a little bit of dust residue around the shapes of some things that were taken, but no art pieces, no pieces of furniture were removed."
MARISHA,00:56:43,00:56:52,"No like, you know, pencil marks carved into door frames to signify their kids growing. Nothing like that?"
MATT,00:56:52,00:56:54,"Not in this particular abode, no."
MARISHA,00:56:54,00:56:56,Don't trust it.
TALIESIN,00:56:56,00:56:57,No-- yeah.
TRAVIS,00:56:57,00:57:00,We're all in that video game where they can't leave the first level.
MARISHA,00:57:00,00:57:02,Yeah! (laughter)
TALIESIN,00:57:02,00:57:05,"No plaster patches from nails in the wall for, like, a Pink Floyd poster?"
MATT,00:57:05,00:57:06,"Right. No, nothing like that."
ASHLEY,00:57:06,00:57:09,It's a tree? We're at the base of the tree?
MATT,00:57:09,00:57:15,"Yeah, you guys are inside the hollowed out tree, getting ready to exit, from what you were saying, so."
ASHLEY,00:57:15,00:57:18,The ceiling is just of the top of the...?
MATT,00:57:18,00:57:32,"If you look up into the hollow, there-- it just goes straight up, and you can see where it breaks off the top, and there are a couple of small, looks like shelf platforms above. About 20 or so feet up."
TALIESIN,00:57:32,00:57:33,I'd like to take a look at that.
MARISHA,00:57:33,00:57:34,Oh hell yeah!
LIAM,00:57:34,00:57:35,I send Frumpkin up.
TALIESIN,00:57:35,00:57:35,"Oh that'll do, too."
MATT,00:57:35,00:58:01,"Okay. Frumpkin heads up. In the shelf units there, you can see there is a small wooden chest that is tucked into one of the little platforms there, with a folded blanket. And on the other platform a little further up, you see some jeweler's tools. Like a small kit for jewel making. Jewelry making."
TRAVIS,00:58:01,00:58:02,You totally found the hidden shit.
MARISHA,00:58:02,00:58:06,"It's a platformer, yeah! (laughter)"
ASHLEY,00:58:06,00:58:07,How did it get up--?
LIAM,00:58:07,00:58:12,"Beauregard, there's some things up above. Would you like to do your monk thing you do?"
MARISHA,00:58:12,00:58:17,"Yep. Dope monk shit, coming up. Bing, bing, bing, bing, bing, wall climb."
MATT,00:58:17,00:58:19,And what's your-- your movement is?
MARISHA,00:58:19,00:58:20,50.
MATT,00:58:20,00:58:31,"Yeah, that's enough to get there. (scoffs) Monks. So yeah, you run up one side, and leap off the other one, just ricocheting, parkouring, until eventually you grab (grunting) one of the platforms, and pull yourself up."
LAURA,00:58:31,00:58:38,"(clapping) There's just enough space, to, like, barely stand on it, with your arms on the wall."
MARISHA,00:58:38,00:58:42,"Can I do that cool, like, wedge myself thing? Is it close enough?"
MATT,00:58:42,00:58:43,The other wall's not close enough to wedge yourself between.
MARISHA,00:58:43,00:58:44,Oh.
MATT,00:58:44,00:58:53,"At this point, you're having to jump off, and then catch the edge to get up there, but the actual platform itself is thin, based on the chest that's there, so you're having to straddle a little bit, and push yourself against the wall."
MARISHA,00:58:53,00:58:53,How big is the chest?
LIAM,00:58:53,00:58:56,"Frumpkin lands on your head, Dagon-style."
MATT,00:58:56,00:58:57,There you go.
MARISHA,00:58:57,00:58:59,Get! Get! Is it-- can I push the chest off?
MATT,00:58:59,00:59:03,That is one hit point.
MARISHA,00:59:03,00:59:07,Is it heavy enough that I can push the chest off?
MATT,00:59:07,00:59:08,It's pretty light.
MARISHA,00:59:08,00:59:10,"Okay. Fjord, catch!"
TRAVIS,00:59:10,00:59:10,What?
MARISHA,00:59:10,00:59:12,(grunts)
TRAVIS,00:59:12,00:59:17,"No, no, no, no, no, no, no, no, no! (laughter) How big is this fucking chest you just threw at me?"
MARISHA,00:59:17,00:59:18,He said it was light-ish!
MATT,00:59:18,00:59:20,It's light. It's not full.
TRAVIS,00:59:20,00:59:21,50 fucking feet in the air!
MATT,00:59:21,00:59:21,Yeah!
TRAVIS,00:59:21,00:59:22,Piece of shit!
MARISHA,00:59:22,00:59:23,Incoming!
MATT,00:59:23,00:59:25,Go ahead and make a strength check for me.
TRAVIS,00:59:25,00:59:26,I'm not catching that!
MATT,00:59:26,00:59:26,Okay.
TRAVIS,00:59:26,00:59:27,I'm getting outta the way!
MATT,00:59:27,00:59:30,"Okay. Yeah, it shatters on the ground."
ASHLEY,00:59:30,00:59:32,"I, oh, okay. (laughter)"
MATT,00:59:32,00:59:37,"You throw it, you say, ""Fjord,"" Fjord goes, ""No no no no no!"" and then just refuses to grab it!"
TRAVIS,00:59:37,00:59:38,Yep!
LAURA,00:59:38,00:59:38,Yeah!
ASHLEY,00:59:38,00:59:40,Can I try to grab it?
MATT,00:59:40,00:59:42,Roll a dexterity saving throw for me.
ASHLEY,00:59:42,00:59:43,Okay.
TRAVIS,00:59:43,00:59:44,"What are you, nuts?"
MATT,00:59:44,00:59:47,To see if you have just enough reflex timing.
TRAVIS,00:59:47,00:59:50,"Stick your head out of a four-story window and be like, ""Here!"""
ASHLEY,00:59:50,00:59:50,"Okay, so."
TRAVIS,00:59:50,00:59:51,Catch this air conditioner!
MARISHA,00:59:51,00:59:53,You want a TV? (laughter)
MATT,00:59:53,00:59:55,"This isn't a trap, so you don't have advantage on. This isn't, like, a hazard."
ASHLEY,00:59:55,01:00:03,"Oh, okay, so that was an 18 plus... 3. 21."
MATT,01:00:03,01:00:12,"Okay, as you pull back your hands, diving between your legs, and catching it right before it hits the ground, your knuckles crack into the ground. (exclaiming)"
ASHLEY,01:00:12,01:00:14,That was heavy!
MATT,01:00:14,01:00:16,But only just from the-
ASHLEY,01:00:16,01:00:17,The weight of the fall.
MATT,01:00:17,01:00:20,"Yeah, the moment of it hitting your hands, but you do prevent it from shattering."
MARISHA,01:00:20,01:00:25,"Sorry, I think the gravity added to the weight."
ASHLEY,01:00:25,01:00:26,"It's fine, I just didn't want to ruin--"
TRAVIS,01:00:26,01:00:29,Would you get down here? What are you thinking?
MARISHA,01:00:29,01:00:30,"Wait, there's another. Hang on."
TRAVIS,01:00:30,01:00:32,"No, no, don't throw anymore shit!"
MARISHA,01:00:32,01:00:33,Other platform.
MATT,01:00:33,01:00:50,"You move to the other platform, yeah, and there is a little, looks like a collection on a stool. Some of the stools down below, and it has a little leather, partially unrolled, tool kit in there, that has all sorts of small jeweler's tools. It's a jeweler's kit."
MARISHA,01:00:50,01:00:51,Very similar to the one that I keep?
MATT,01:00:51,01:00:52,Yeah.
MARISHA,01:00:52,01:00:55,Any other jewels or anything else up here?
MATT,01:00:55,01:00:56,Just that.
LAURA,01:00:56,01:00:57,Does it look like it's been used?
TRAVIS,01:00:57,01:01:00,Is anybody watching us do this?
MATT,01:01:00,01:01:00,Make a perception check.
LIAM,01:01:00,01:01:01,Something is.
TALIESIN,01:01:01,01:01:05,"Well you still have, see invisible things as well."
TRAVIS,01:01:05,01:01:06,"That's true, 16."
MATT,01:01:06,01:01:10,16. You don't notice anyone paying attention to you in the vicinity.
MARISHA,01:01:10,01:01:11,"Yeah, are they coated in dust? Does it look like they've been used recently?"
MATT,01:01:11,01:01:34,"No, but they're fairly rusted. They look old. But they've been used. You can see where-- the areas where they would mostly be used, the rust has been rubbed off of it. The ocean air, as it often does, with iron and other metals like that, has done some exterior damage to the areas that aren't put to most use, but it's a functional jeweler's kit."
MARISHA,01:01:34,01:01:43,"How did they get up here? When coming up the wall, did I notice any type of, like, handholds or grooves, something that they've could've used?"
MATT,01:01:43,01:01:56,"There are. It's not smooth. Like it's a rough, hollowed out interior of the trees. There are-- and it's what you use to jump off, and get yourself up there, was just the somewhat uneven interior of the tree bark."
MARISHA,01:01:56,01:02:00,"Doron's got moves, I think. I think he's got to be ripped under there, man!"
TALIESIN,01:02:00,01:02:00,But what do you see?
LAURA,01:02:00,01:02:04,"Well, maybe it's not his."
MARISHA,01:02:04,01:02:05,That's true.
LAURA,01:02:05,01:02:12,"I mean, I have a feeling, like, the families maybe they are not allowed to have any materialistic things, right? They're not allowed to own anything."
MARISHA,01:02:12,01:02:14,"Yeah, who knows how long?"
LAURA,01:02:14,01:02:16,"They don't have assigned houses, you know?"
SAM,01:02:16,01:02:23,"They just go around to each house, as they, like, providing sexual favors for each other?"
LAURA,01:02:23,01:02:25,"Maybe, maybe. Oh! Maybe that's the thing here?"
SAM,01:02:25,01:02:28,Is that a thing?
ASHLEY,01:02:28,01:02:30,That's a thing!
TRAVIS,01:02:30,01:02:34,"I bring you jewels, you cut them up, and then we bone. Is that how it goes?"
SAM,01:02:34,01:02:35,"Yeah, I've heard of-"
TALIESIN,01:02:35,01:02:40,They were surprisingly excited by your dick statues.
MARISHA,01:02:40,01:02:42,Is there anything else up here? (laughter)
MATT,01:02:42,01:02:43,Nope. (clears throat)
MARISHA,01:02:43,01:02:47,"Okay, now does it go up any higher? Can I touch the--?"
MATT,01:02:47,01:02:52,"You're towards the top of where the tree itself is broken, and it opens up into the sky."
TRAVIS,01:02:52,01:02:55,Get up there. See if it's still misty and shit!
MARISHA,01:02:55,01:02:57,Can I shimmy my way up and put--
MATT,01:02:57,01:03:50,"I'd say you be able to, yeah, it's rough enough. And you're very well practiced at this sort of thing, so you eventually leap up, grab, part of it starts to crack and pull back, and so you quickly leap, and not put your full weight on that one side, and then eventually pull yourself up over, where you can look beyond the peak of the broken part of the tree itself. As you look down, you can see the village from a higher height. There are still trees that are taller around you, so you can't see above the canopy. This is not the tallest tree, and it's partially broken down, but you have a nice view of the village from a slightly higher perspective and it's kinda cool, as simple as it is. Like it's beautiful, people are working together. It's simple, but functional. You can see now that there is-- on the northern side of the village, there are bonfires being set up. There is one large, central one, and there are two smaller ones to each side of it. It looks like chairs and tables are being set up now, probably for the feast tonight."
MARISHA,01:03:50,01:03:52,Just doing a quick scan of the people.
MATT,01:03:52,01:03:53,Yes.
MARISHA,01:03:53,01:03:57,"Do I notice anyone who looks shifty, or being weird? They all look shifty."
MATT,01:03:57,01:03:58,Make a perception check.
MARISHA,01:03:58,01:03:59,Okay.
TRAVIS,01:03:59,01:04:02,I love that you are judging people by their looks.
MARISHA,01:04:02,01:04:03,I am totally-- (laughter)
TALIESIN,01:04:03,01:04:04,"Shifty, happy people everywhere."
MARISHA,01:04:04,01:04:06,-- totally profiling.
MATT,01:04:06,01:04:08,"Not holding hands, though."
MARISHA,01:04:08,01:04:11,"What was it, perception? 14."
MATT,01:04:11,01:04:13,14. I mean.
MARISHA,01:04:13,01:04:13,(laughs)
MATT,01:04:13,01:04:25,"There isn't anybody in the corner with a long trench coat going like, ""Ooh, they'll never see me!"" Everyone seems to be, you know, they're from all over the map, as far as backgrounds look."
SAM,01:04:25,01:04:26,That's my next character.
MATT,01:04:26,01:04:38,You have some people where their attire resembles aspects of a Marquesian background. There are some folks that have some Dwendalian attire. There's a handful of folk look like they might--
MARISHA,01:04:38,01:04:41,I guess I mean more in their demeanor than their appearance.
MATT,01:04:41,01:04:48,"Right. Best that you can tell, most everyone is going about a daily routine. A lot of them are helping set up the meal for the evening."
MARISHA,01:04:48,01:04:50,Okay.
MATT,01:04:50,01:05:00,"But nobody is hiding in the shadows, or having clandestine conversations in the unseen corners of the village."
MARISHA,01:05:00,01:05:03,I'm going to scoop up the jeweler's kit on the way back down and head on down.
MATT,01:05:03,01:05:07,Okay.
LIAM,01:05:07,01:05:10,"Veth, do you want to safely take a look at this chest?"
SAM,01:05:10,01:05:12,"Oh yes, of course!"
TALIESIN,01:05:12,01:05:14,"Do we think it might be magical, or?"
SAM,01:05:14,01:05:16,I'll check it for traps!
MATT,01:05:16,01:05:19,Go for it.
SAM,01:05:19,01:05:20,26!
MATT,01:05:20,01:05:21,"26, it is not trapped."
SAM,01:05:21,01:05:23,I will unlock it!
MATT,01:05:23,01:05:31,"You go to it, and the lock is rusted and broken, you can just (pop) and it pulls off the wood. The wood just splinters."
LAURA,01:05:31,01:05:31,Was it dusty at all--
SAM,01:05:31,01:05:32,I've done it!
LAURA,01:05:32,01:05:34,-- or did it look like it's been opened recently?
TRAVIS,01:05:34,01:05:34,Vokodo doesn't allow locks.
MATT,01:05:34,01:05:35,It looks fairly dusty.
LAURA,01:05:35,01:05:37,Okay.
SAM,01:05:37,01:05:38,(creaking)
MATT,01:05:38,01:05:38,"Okay, you look inside--"
TRAVIS,01:05:38,01:05:40,(explosion)
MATT,01:05:40,01:05:42,-- and you... (laughter)
TALIESIN,01:05:42,01:05:42,(explosion)
LIAM,01:05:42,01:05:44,Blue ink!
MATT,01:05:44,01:05:46,Shards of diamond glass into your eye.
SAM,01:05:46,01:05:48,(screaming)
MATT,01:05:48,01:06:05,"You look inside and there are two sets of pristine outfits, like, really nice, silk outfits, folded and placed in there. There is a mostly clean, if a little damp in the underside, child's doll."
SAM,01:06:05,01:06:06,There's nothing creepier than that!
MARISHA,01:06:06,01:06:07,Yeah!
TRAVIS,01:06:07,01:06:07,"Yes, there is."
LAURA,01:06:07,01:06:10,Are there any notes? Are there are note in the inside lid or anything?
SAM,01:06:10,01:06:12,Are these grownup attire?
MATT,01:06:12,01:06:17,"No, there are no notes. You do see, however, a silver pocket watch."
SAM,01:06:17,01:06:21,"So the pocket watch, two outfits. Like, are they ceremonial attire?"
MATT,01:06:21,01:06:25,"No, they look to be more middle to upper class-"
TRAVIS,01:06:25,01:06:27,Nightgowns?
MATT,01:06:27,01:06:27,No.
LAURA,01:06:27,01:06:29,Clothes.
MATT,01:06:29,01:06:30,Just clothes.
LAURA,01:06:30,01:06:32,Is the pocket watch engraved?
ASHLEY,01:06:32,01:06:32,Yeah.
MATT,01:06:32,01:06:36,"On the back side of it, there are initials carved into it, B.V."
SAM,01:06:36,01:06:38,B.V.?
LIAM,01:06:38,01:06:38,"Come on, B.V.Ds."
TRAVIS,01:06:38,01:06:41,Big Van!
LAURA,01:06:41,01:06:41,B.V.?
MATT,01:06:41,01:06:45,B.V.
LAURA,01:06:45,01:06:46,"B period, V period?"
MATT,01:06:46,01:06:47,Correct.
LAURA,01:06:47,01:06:49,"B period, V period."
SAM,01:06:49,01:06:52,Does it work? Can I wind it up a bit?
