speaker,start_time,end_time,text
SAM,01:03:13,01:03:15,I have 700 gold pieces' worth.
TALIESIN,01:03:15,01:03:16,(whistling)
MATT,01:03:16,01:03:19,"So that's seven casts, as long as somebody--"
SAM,01:03:19,01:03:21,It totally replaces?
MATT,01:03:21,01:03:29,"Residuum can be used to replace any sort of material component cost of equal cost, but only if they have it on their person to use it."
SAM,01:03:29,01:03:36,"Well, I will give you all the residuum, then. I'll give 400 to you, Jester, and 300 to you, Caduceus."
TALIESIN,01:03:36,01:03:36,How much?
SAM,01:03:36,01:03:38,300.
TALIESIN,01:03:38,01:03:38,"Wow, okay."
SAM,01:03:38,01:03:43,I don't need it. Just giving away all my shit.
MATT,01:03:43,01:03:47,(laughs)
MARISHA,01:03:47,01:03:51,Maybe you're not such a hoarder after all. Growth.
MATT,01:03:51,01:03:54,(laughs)
SAM,01:03:54,01:03:55,"I really want it back, though."
MARISHA,01:03:55,01:03:59,Oh. I don't think that's how it works.
TALIESIN,01:03:59,01:04:07,Just checking how much it takes to... Pop someone back to life if something bad happens.
LAURA,01:04:07,01:04:11,It's 300. It's a 300 gold diamond.
TALIESIN,01:04:11,01:04:11,I've got a 350 diamond.
LAURA,01:04:11,01:04:15,I've got a 300 diamond and a 500 gold diamond.
TALIESIN,01:04:15,01:04:23,"The 500's the Hail Mary if something goes really, really wrong. 300's a quick fix. 500's a long-term problem."
LAURA,01:04:23,01:04:38,"Well, one of them... Oh, god. So I'm going to say we used residuum for the last ones. This is so hard to do retroactive. So I've got 300 gold worth of residuum."
SAM,01:04:38,01:04:44,Do you have the plans for the American war base as well? (laughter)
TRAVIS,01:04:44,01:04:47,Coca-Cola.
LIAM,01:04:47,01:04:50,Here's what we're going to do.
LAURA,01:04:50,01:04:50,And you have--
TRAVIS,01:04:50,01:04:51,John Wayne.
LAURA,01:04:51,01:04:53,-- 200 gold worth of residuum?
TALIESIN,01:04:53,01:04:56,"I cast twice, so I would have 100."
LAURA,01:04:56,01:04:56,"Got it, okay."
MATT,01:04:56,01:04:58,"All right. Well, there you go."
TALIESIN,01:04:58,01:05:02,And 50 diamond if someone grinds them down.
SAM,01:05:02,01:05:02,50 on a gift certificate.
MATT,01:05:02,01:05:20,"So, with that said, you guys can rest for the evening early if you'd like to, and wake up early after a eight-hour rest, if that's the case, if you're looking for maximized time for Water Breathing and anything else you want to do before bed. Your call."
MARISHA,01:05:20,01:05:21,Fancy Feast.
LAURA,01:05:21,01:05:27,"Yeah. Set it up on the, uh... On the deck of this here ship?"
MATT,01:05:27,01:05:43,"All right. You guys have situated now up on top of the Eden's Horizon, after getting your materials ready for any possible encounters in the day to come. Jester, describe how you set your Heroes' Feast out."
LAURA,01:05:43,01:05:57,"Oh man, oh man! Do we have tables here on this deck, or is it just--? I'm going to make it just a really pretty setup with blankets. I'm going to use some of my blue fabric to set up picnic blankets all over the deck, you know?"
MATT,01:05:57,01:05:57,Okay.
LAURA,01:05:57,01:06:20,"And it's going to be like a feast of pancakes and... Lots of pancakes. Some candy, some scones. A little bit of, what, like, potatoes for Caduceus. Do you want some mushrooms or something?"
TALIESIN,01:06:20,01:06:20,I can eat pancakes. Pancakes are fine.
LAURA,01:06:20,01:06:24,"Great, pancakes. So more pancakes!"
MARISHA,01:06:24,01:06:26,It's a continental breakfast buffet.
LAURA,01:06:26,01:06:30,And then-- yeah. I figure some pocket bacon for Beau.
TRAVIS,01:06:30,01:06:30,All the carbs.
TALIESIN,01:06:30,01:06:32,Very carby.
LAURA,01:06:32,01:06:38,"Some weird-looking bug sort of things for Yasha, just because they're interesting-looking, but really they taste like chocolate."
ASHLEY,01:06:38,01:06:38,"Oh, yes."
LAURA,01:06:38,01:06:41,Spicy chocolate.
ASHLEY,01:06:41,01:06:41,"Oh, very good."
TALIESIN,01:06:41,01:06:43,That's fine.
ASHLEY,01:06:43,01:06:45,It has a little bit of a kick.
TALIESIN,01:06:45,01:06:45,Yeah.
LAURA,01:06:45,01:06:54,"And... It's really colorful. You know, unicorn whipped cream sort of stuff."
TALIESIN,01:06:54,01:06:56,Hook Lost Boys.
LAURA,01:06:56,01:07:00,"Yeah! Very similar to, yeah, Hook. But not quite so primary colors. They're more pastel sort of shades."
TRAVIS,01:07:00,01:07:03,"You're doing it, Peter!"
LAURA,01:07:03,01:07:08,"Cakes, cookies... Do you guys want anything more substantial, or is this good?"
SAM,01:07:08,01:07:11,"No, this is good."
LAURA,01:07:11,01:07:13,Give everyone stomach aches before we go in?
TRAVIS,01:07:13,01:07:13,Yep. Give everybody the reenies.
MATT,01:07:13,01:07:16,Yep. Possibly type 2 diabetes.
LIAM,01:07:16,01:07:21,"One bowl of greens, perhaps. Just one."
LAURA,01:07:21,01:07:22,Caleb.
SAM,01:07:22,01:07:24,"Like a cucumber salad. He likes dill, and--"
LIAM,01:07:24,01:07:25,Have to be regular.
LAURA,01:07:25,01:07:25,"God, okay, okay."
TRAVIS,01:07:25,01:07:27,Fiber.
LAURA,01:07:27,01:07:31,"There's one teeny, tiny bowl of cucumber salad."
TALIESIN,01:07:31,01:07:35,It's got Jell-O in it. That's weird. (laughter)
LAURA,01:07:35,01:07:37,It's got green sprinkles on the top for sure. (laughter)
MATT,01:07:37,01:07:39,All right.
LIAM,01:07:39,01:07:39,Just green icing.
LAURA,01:07:39,01:07:43,"Oh, and some nuts, because that's what Sprinkle likes to eat."
MATT,01:07:43,01:07:45,There you go.
LIAM,01:07:45,01:07:47,I thought Sprinkle liked to eat shit.
TRAVIS,01:07:47,01:07:47,How is Sprinkle?
LAURA,01:07:47,01:07:50,Sprinkle's doing great.
TALIESIN,01:07:50,01:07:51,Hasn't moved in three days.
MATT,01:07:51,01:08:02,"You see from underneath the shawl that Jester wears, this small, skittering weasel head slowly peers out-- (squeaks and hisses) And just withdraws back in."
LAURA,01:08:02,01:08:04,He's so good!
LIAM,01:08:04,01:08:04,Is he a revenant yet?
TRAVIS,01:08:04,01:08:07,"""I hope we lose!"""
MATT,01:08:07,01:08:07,You don't know.
MARISHA,01:08:07,01:08:08,He's got to be.
SAM,01:08:08,01:08:13,"When we were at the ruins, I think I saw Sprinkle trying to get into one of the coffins. (laughter)"
LAURA,01:08:13,01:08:16,"No, he wasn't. He was not, Veth."
TRAVIS,01:08:16,01:08:18,"""Let Vokodo come!"""
LAURA,01:08:18,01:08:20,He's so comfy! Look how comfy my cloak is. It's so comfy.
TRAVIS,01:08:20,01:08:24,"""Offer me up."" (laughter)"
MATT,01:08:24,01:08:32,"So, Jester, as you finish your invocation, you set, amongst this blue sheet that you've laid out here on the deck--"
LAURA,01:08:32,01:08:32,It's green.
MATT,01:08:32,01:09:11,"It's gr--? Oh, because it's one of the cloaks. Oh, there you go, respect. I misheard. You place this gemmed chalice onto it, and as you close your eyes, having taken everyone's orders... (laughter) You begin to place your hands down on the sides of it and lift the fingers up, and as you do, you watch the chalice seems to fill. As it fills with this reddish, orange liquid, that at first is a little worrying to all of you. As it spills over, it actually forms a red tablecloth around the sides of it, so overtaking the green you put down there."
LAURA,01:09:11,01:09:13,But I still want it to be on the ground. This is a cute picnic.
MATT,01:09:13,01:09:15,"Yes, it's on the ground. It's on the ground."
LAURA,01:09:15,01:09:19,"Very Mad Hatter. Like, everybody gets their own teacup."
MATT,01:09:19,01:09:19,Yes.
TALIESIN,01:09:19,01:09:21,I'm into it.
MATT,01:09:21,01:10:22,"As it spreads out, you watch as from within this cloth-- which almost, it looks like a velvet, but as you get close to it, it's reflecting what's above it. It's almost like a still surface of water, and suddenly the water begins to become disturbed, and you see from within shapes begin to emerge, and as they do, platters begin to arise. Poof, poof. Bowls, plates. A veritable smorgasbord of pancakes, of real cakes, of sweets, candies, a bowl of nuts, a salad... (laughter) A unique spread. And as they begin to emerge, the coloration of the red begins to shift and give way, like the color itself is what's giving life to each of these small bowls and large spreads, and as it does, it's left behind with a weird translucent green color that mingles with the sheet beneath it. It looks delicious, it smells delicious, and everything seems to have this faintly glowing hue to it that's slightly off-putting, but still, the other senses tell you this is an invitation."
SAM,01:10:22,01:10:24,Is there enough for Vilya as well?
LAURA,01:10:24,01:10:27,"Oh, yeah, everybody gets some. Sprinkle gets some. Everybody gets some."
MATT,01:10:27,01:10:32,"""I'm not going to lie, it's been a very long time since I've had a pancake. I'm very excited for this."""
TRAVIS,01:10:32,01:10:32,Pancake!
LAURA,01:10:32,01:10:33,(laughs)
MATT,01:10:33,01:10:39,"You all dig into this veritable Heroes' Feast. It is delicious, it is invigorating, and for the next 24 hours...?"
LAURA,01:10:39,01:10:41,Yes.
MATT,01:10:41,01:10:49,"You have advantage on wisdom saving throws, you are immune to poison and everyone gains-- is it 2d10 temporary hit points?"
LAURA,01:10:49,01:10:50,Yeah.
MATT,01:10:50,01:10:53,"Go ahead and roll that now, Jester, if you don't mind."
TRAVIS,01:10:53,01:10:53,2d10 temporary hit points?
MATT,01:10:53,01:10:54,Yes.
SAM,01:10:54,01:10:55,"She's rolling for us, or we roll--?"
MATT,01:10:55,01:10:58,"She rolls, and then everybody gets the same number."
LAURA,01:10:58,01:11:01,(drumming fingers) Okay.
LIAM,01:11:01,01:11:01,I might crack 80.
MARISHA,01:11:01,01:11:03,"Yeah, dude."
LAURA,01:11:03,01:11:09,"Okay, okay, okay, okay, okay! (disappointed) Oh. Nine extra points."
SAM,01:11:09,01:11:09,Okay.
TRAVIS,01:11:09,01:11:17,Thank you. That's half Caleb's HP. (laughter)
TALIESIN,01:11:17,01:11:20,Wisdom saving throws.
MATT,01:11:20,01:11:28,"With a comfortable meal in your belly and the surge of divine energy flowing through you, protecting you, you get the after-meal sleepies."
LAURA,01:11:28,01:11:30,You also can't be frightened.
MATT,01:11:30,01:11:32,"Yeah, sorry, also immune to fear. Useful."
MARISHA,01:11:32,01:11:34,"So, wait, it's immune to fear, poison..."
TRAVIS,01:11:34,01:11:34,Nine temporary hit points.
MARISHA,01:11:34,01:11:37,And advantage on...
LAURA,01:11:37,01:11:37,Wisdom saving throws.
MARISHA,01:11:37,01:11:38,Wisdom saves.
MATT,01:11:38,01:11:38,You've got it.
MARISHA,01:11:38,01:11:40,Clutch.
MATT,01:11:40,01:11:40,"Yeah, Heroes' Feast is legit."
MARISHA,01:11:40,01:11:43,While we eat... Hang on.
MATT,01:11:43,01:11:45,Mm-hmm?
MARISHA,01:11:45,01:11:52,Hang on. Advantage Wis saves. Jester?
LAURA,01:11:52,01:11:54,Hm?
MARISHA,01:11:54,01:12:06,"How are you feeling about Traveler Con? You know, if we defeat the looming volcano god that has this entire island held hostage."
LAURA,01:12:06,01:12:09,Um. (sighs)
MARISHA,01:12:09,01:12:21,"You all right? I honestly thought that that was going to be, like, something that you'd start rattling off a thousand ideas about, but you didn't say anything. So now I'm super-concerned."
LAURA,01:12:21,01:12:37,"I just don't, um... I don't... know... I don't know what to do about it."
SAM,01:12:37,01:12:46,"Like, whether or not to have it? Or what to do when you do have it?"
LAURA,01:12:46,01:14:08,"Well. Obviously, we're going to have it. But... the Traveler... He doesn't want to be a god. He doesn't... He doesn't like it. So I don't, um... I don't know... how to make everybody come here and pretend like they're going to worship him... and also make him happy and also make sure that they're not taken advantage of too much, and also free everybody here. And also, at the end of it, if he doesn't want to be a god, what does that mean for me and him? Or... I don't know. (sighs) I don't know. I was hoping maybe we will fight Vokodo and then everything will just become clear."
MARISHA,01:14:08,01:14:13,You seemed sad last night after you went off and talked to him for a bit.
LIAM,01:14:13,01:14:15,You're sad now.
LAURA,01:14:15,01:14:17,"I am not sad now. I'm just, you know."
MARISHA,01:14:17,01:14:18,Oh. Those are tears.
LAURA,01:14:18,01:14:28,"No, I'm just, like... You know, it's just-- it's stressful."
LIAM,01:14:28,01:14:33,"What if it were just you and him, like your old days?"
LAURA,01:14:33,01:15:38,"I don't think that's a bad thing. You know? He-- He was really wonderful then. He was my best friend. I know all of you are concerned that maybe he's taking advantage or he doesn't have our best interests. Which who knows, maybe he doesn't. But, he really... got me through a lot when I was younger, you know? And he was all I had, really, and... He was wonderful. He taught me so much. If it just was him being my friend again, I'd be okay with that. I just don't know what that means for everyone else, you know, all the people that are coming here."
TRAVIS,01:15:38,01:15:44,"If he said he doesn't want to be a god, did he say why he's still having everyone come here?"
MARISHA,01:15:44,01:15:48,Did he know about this place?
LAURA,01:15:48,01:16:34,"He did. That was, um... kind of sad to find out about. He-- he knew that... people lost their memory here, apparently. (sniffs) Um. I think, you know... I think he's hoping to sort of offload a lot of the people when they come. Maybe-- not necessarily leave them here, but make them think that, you know, he's not so available any more. It would be really stressful, you know, to have all these people constantly praying to you."
TRAVIS,01:16:34,01:16:38,But he sent you here.
LAURA,01:16:38,01:16:40,Yeah.
TRAVIS,01:16:40,01:16:43,What if you forgot him?
LAURA,01:16:43,01:16:56,He promised me that he would save me. And us. He said all of us. I believe him.
ASHLEY,01:16:56,01:17:20,"How do you feel about him right now, knowing this, that he... I am very not trying to overstep at all, but him knowing that he would bring people here, that it's possible that they would forget?"
LAURA,01:17:20,01:17:28,"(sighs shakily) (soft, ethereal music)"
LAURA,01:17:28,01:18:09,"He's not, like, the best guy. (laughs) You know, he's really cool. But I don't think he always, you know... Thinks about other people, about how they'll actually be affected, sometimes. And that's just, you know, just because he's, you know, super super powerful, and um... to us... and to him, we're like ants sometimes. We don't think about the fact when we squish an ant. It doesn't mean anything to us, but the ant is real sad."
TRAVIS,01:18:09,01:18:13,Or it's dead.
LAURA,01:18:13,01:18:19,Or dead.
TRAVIS,01:18:19,01:18:31,"Jester, we all want what's best for you, of course. Have you talked to him at all about going back to just the way things were when you were little, just he and you, as friends?"
LAURA,01:18:31,01:18:45,"I want to. I want to, I want to. It's just every time we talk he has to disappear so fast. Before, he used to be here all the time, you know? Ugh, it's so hard to share. (laughs)"
SAM,01:18:45,01:18:47,But you know where he'll be. He'll be at Traveler Con.
LAURA,01:18:47,01:18:50,(sniffs) I know. He is going to be here.
SAM,01:18:50,01:19:22,"And the thing that you guys have all taught me is that friends call each other on their shit, and if they're really friends, then they'll be friends afterwards. And if you know where he'll be, and you know he's not going to disappear, you should call him on his shit. Traveler Con shouldn't be about bamboozling people or you trying to put on a show. Traveler Con should be about you and the Traveler. That's how it all started."
LAURA,01:19:22,01:19:25,But all those people are already on their way here.
SAM,01:19:25,01:19:29,We'll deal with them after.
TRAVIS,01:19:29,01:19:49,"You've done so much for him, and I know he's done so much for you, but trying to make him happy in this, it puts you at risk. It has put you at risk, and us. That doesn't seem, like you said, the most considerate thing."
LIAM,01:19:49,01:19:54,"Yeah, but also, it is complicated sometimes, extracting yourself from the very things that made you who you are."
LAURA,01:19:54,01:20:01,(sniffs) So this might be difficult.
MARISHA,01:20:01,01:20:04,"We're protective of you, and defensive of you."
ASHLEY,01:20:04,01:20:07,Yeah.
MARISHA,01:20:07,01:20:41,"We're here because of Jester, not because of the Traveler Con. (soft, pensive music) Honestly... all you have to do is say the word, and we'll do whatever you want. It's always been the case. But... Also, if he hurts you, I'll kill him. You know? Like... we've killed demigods before. We're about to kill one. We could kill him, too."
LAURA,01:20:41,01:20:42,We don't-- I don't want to kill him.
MARISHA,01:20:42,01:20:51,"Yeah, but, you know, we could. And we would if you said the word."
LAURA,01:20:51,01:20:57,"Thank you, Beau. I don't want to kill him."
MARISHA,01:20:57,01:21:03,"Just don't want to see you being used, either."
LAURA,01:21:03,01:21:15,Yeah. I don't want to be used.
MARISHA,01:21:15,01:21:22,"You know, you're kind of... to echo Nott's point, you are like his peer now."
LAURA,01:21:22,01:21:28,"(laughing) No, I'm not. He can do so many things. He can bamf in and out whenever he wants to!"
SAM,01:21:28,01:21:29,So can you.
LAURA,01:21:29,01:21:32,I can't. I'm stuck here on this island.
SAM,01:21:32,01:21:40,"You can turn into things and fly, and you can... You've got a lot of powers. Look, you made us this amazing dinner out of nothing."
LAURA,01:21:40,01:21:40,This is a really good dinner.
SAM,01:21:40,01:21:42,Yeah!
TRAVIS,01:21:42,01:21:42,Quite good.
ASHLEY,01:21:42,01:21:47,"It's a very good dinner. I've never had pancakes before, and this might be my favorite thing I've ever had."
TRAVIS,01:21:47,01:21:49,You really haven't touched your bugs much.
ASHLEY,01:21:49,01:21:51,Because I'm eating all the pancakes.
TRAVIS,01:21:51,01:21:51,"They're crawling, though, away."
SAM,01:21:51,01:21:53,You could roll them up.
TALIESIN,01:21:53,01:21:55,"I was about to say, if you roll them up, and..."
ASHLEY,01:21:55,01:21:59,Best bug I've ever had. (laughter)
MARISHA,01:21:59,01:22:05,I guess we're a little bit biased because we've seen you do a lot more amazing things than we've seen the Traveler do.
ASHLEY,01:22:05,01:22:08,Yeah.
LAURA,01:22:08,01:22:15,"Everything I do, all of it, is because of him."
MARISHA,01:22:15,01:22:20,"Ah, give yourself some credit, too, though."
TRAVIS,01:22:20,01:22:39,"And you care about people you know, about people you don't know. You cause chaos, but in the end, you don't want to hurt people. You care. In many ways, you're much more than he will probably ever be."
MARISHA,01:22:39,01:22:46,"It's super natural for students to outgrow their teachers. I mean, look at me with Dairon."
TRAVIS,01:22:46,01:22:48,(stammering)
MARISHA,01:22:48,01:22:48,You know?
LAURA,01:22:48,01:22:50,Yeah.
MARISHA,01:22:50,01:22:50,Who's the teacher now?
LAURA,01:22:50,01:22:58,(laughs) Yeah. You're way cooler.
MARISHA,01:22:58,01:23:03,"I-I-I know. And you're way cooler than the Traveler, in my opinion."
SAM,01:23:03,01:23:05,"Did we leave Dairon at our house, by the way?"
TRAVIS,01:23:05,01:23:05,(laughs)
SAM,01:23:05,01:23:07,Is she there for forever? No.
MARISHA,01:23:07,01:23:08,"No, they're back in--"
SAM,01:23:08,01:23:08,"Oh, okay."
MARISHA,01:23:08,01:23:13,"-- in Zadash now, I think. Or are they still in Rexx--? I don't know."
SAM,01:23:13,01:23:16,"Cool, cool, cool."
MARISHA,01:23:16,01:23:19,She's around.
ASHLEY,01:23:19,01:23:41,"Jester, I hope you know how special you are. Just you, even without the Traveler. We all think you're pretty amazing."
LIAM,01:23:41,01:23:54,"And so does he, to a certain extent, so perhaps... a little more time with you will color his perspective instead of he coloring yours."
LAURA,01:23:54,01:23:57,"Thank you, guys."
TRAVIS,01:23:57,01:24:06,"Yeah. If you ever want it, there is life beyond the Traveler. We're here."
LAURA,01:24:06,01:24:16,"Wow. That's pretty great. Thanks! (laughs) Not going to lie, I feel pretty good right now. (laughter)"
TRAVIS,01:24:16,01:24:17,It's the pancakes.
TALIESIN,01:24:17,01:24:21,"I just want to say, you all just did so well. I'm so proud. (laughter)"
MARISHA,01:24:21,01:24:21,"Oh, thanks, yeah."
TALIESIN,01:24:21,01:24:23,Everybody was just--
SAM,01:24:23,01:24:23,We pulled a Caduceus!
MARISHA,01:24:23,01:24:24,"Yeah, we did!"
TALIESIN,01:24:24,01:24:26,You guys... I just got to sit here and nod. It was amazing.
SAM,01:24:26,01:24:28,Wow!
TALIESIN,01:24:28,01:24:37,"Wisdom, wisdom, self-realization. A little more wisdom, some more self-realization. (laughter) It was great."
MATT,01:24:37,01:24:50,"Vilya, mouth still half-full with a pancake, goes, ""I know I've only just met you, but this is a tight family. Hold onto each other. This is important."""
LIAM,01:24:50,01:24:54,I gently push my salad across towards Vilya.
MATT,01:24:54,01:25:00,"She eats more of her pancakes. (laughter) ""I've had plenty of salad in recent years."""
LAURA,01:25:00,01:25:03,"Have you ever had salad with sprinkles, though?"
MATT,01:25:03,01:25:11,"""There's sprinkles in that? That's strange. (laughter) That's unique."""
TALIESIN,01:25:11,01:25:13,Basically sugared croutons when you get down to it.
LAURA,01:25:13,01:25:13,Ugh.
MARISHA,01:25:13,01:25:17,Disneyland resort salad.
TALIESIN,01:25:17,01:25:19,(laughs)
TRAVIS,01:25:19,01:25:21,Frosted Flakes in your salad.
MARISHA,01:25:21,01:25:24,"Why are they shaped like Mickey ears, these cucumbers? (laughter)"
TRAVIS,01:25:24,01:25:26,Frosted Mini Wheats.
TALIESIN,01:25:26,01:25:28,"How do you get an avocado to do that, even."
MARISHA,01:25:28,01:25:30,(laughs)
MATT,01:25:30,01:25:39,"Well, the evening is yours to set up as you see fit, whether it be more things to get ready, more conversations to have or setting up the dome and whatever your preparation would be before a night's rest."
LIAM,01:25:39,01:25:42,"Yeah, I think I would set up the dome, not on the deck, but..."
MATT,01:25:42,01:25:45,Below deck?
LIAM,01:25:45,01:26:29,"Below deck. And I will set up, uh... I won't set up the wire. There's no point to it. But what I will do is, eventually, whether this is in sequence now or later, I'm going to take time to pull out the wand that Calianna gifted to me and set it down inside the dome and take out... I have a handful of little bits of stained glass from our battle with the Laughing Hand. I'm just going to lay the wand down on the ground and spend, I don't know, maybe 30 minutes to an hour just sort of sliding different pieces of glass around, switching them out, and just pondering a thing."
MATT,01:26:29,01:26:29,Okay.
LIAM,01:26:29,01:26:31,That's it.
MATT,01:26:31,01:26:34,Anybody else need to do anything?
LAURA,01:26:34,01:26:34,Um.
TALIESIN,01:26:34,01:26:41,I'm just going to sit. Meditate. Listen to the sound of the waterfall.
MATT,01:26:41,01:26:43,All right.
LAURA,01:26:43,01:26:45,"Yes, I am going to do something."
MATT,01:26:45,01:26:47,"What you doing, Jester?"
LAURA,01:26:47,01:26:50,I'm going to go up to the front of the cavern where the waterfall is.
MATT,01:26:50,01:26:54,Okay.
LAURA,01:26:54,01:27:03,"Is there an object like a rock or anything nearby the front of that cavern? Anything that I can... like, is there a boat that's close by?"
MATT,01:27:03,01:27:12,"There is a ship maybe about, begins at 20 or so feet from the entranceway on the left side. If you're looking for a small rock, like a handheld rock?"
LAURA,01:27:12,01:27:16,Uh-huh. That would have a place to position right near the cavern.
MATT,01:27:16,01:27:30,"Okay, okay. Make an investigation check as you're rummaging through the nearby sand and dirt that has accumulated at the corner to see if there's any loose stone or rock that you can grab."
LAURA,01:27:30,01:27:30,11.
MATT,01:27:30,01:27:49,"11? Eh, it takes you a little bit, but you manage to find a piece of flaked-off obsidian from the inside of the rock cavern, or the volcanic rock, goes into an obsidian color. But you pull it out. It's sharp on one edge, about that big, but you find one."
LAURA,01:27:49,01:27:52,Do I still have Tongues up?
MATT,01:27:52,01:27:54,"Tongues lasts an hour, I believe?"
LAURA,01:27:54,01:27:55,It was only an hour?
LIAM,01:27:55,01:28:01,"(murmuring) (tutting) That is correct, one hour."
MATT,01:28:01,01:28:01,"So, no, that would be gone."
LAURA,01:28:01,01:28:20,"Okay. Well, hopefully he'll recognize my voice. I'm going to cast, with my Rod of the Solitary Scout, the wand that I have, I'm going to cast Magic Mouth."
SAM,01:28:20,01:28:20,Ooh!
MATT,01:28:20,01:28:22,Okay.
LAURA,01:28:22,01:28:22,On the rock.
MATT,01:28:22,01:28:25,Okay.
LAURA,01:28:25,01:28:35,"And I'm going to say... Here they are, ready for the taking!"
TRAVIS,01:28:35,01:28:36,(laughs)
LAURA,01:28:36,01:28:44,"And then I put it right at the edge, so that way, if the dragon turtle comes within range, he'll hear it and be tempted to come on in."
TRAVIS,01:28:44,01:28:44,(laughs)
MATT,01:28:44,01:28:59,"Okay. All right. As you seal that vocal print into the stone, it vibrates in your hand and you place it just in the proximity of where the illusion begins and the actual opening for the cavern itself is held. You feel pretty confident that a being of that size, if it were to come through, would definitely trigger the radius for the spell."
LAURA,01:28:59,01:29:01,"Cool, cool, cool, cool."
MATT,01:29:01,01:29:04,All right? Anybody else?
LIAM,01:29:04,01:29:20,"A minor thing, I will also stay up at least an hour to use components necessary to turn Frumpkin into an octopus, and I will just frisbee him out off of the ship to patrol while we are sleeping, and to be more use, possibly, tomorrow."
MATT,01:29:20,01:29:20,You got it.
TRAVIS,01:29:20,01:29:27,"(imitating octopus) Perfect. All right. Anybody else, or are we looking to a night's rest?"
TRAVIS,01:29:27,01:29:27,"Oh my god, I think we're doing it."
SAM,01:29:27,01:29:29,Rest.
LAURA,01:29:29,01:29:29,(groaning)
