speaker,start_time,end_time,text
MATT,02:17:35,02:17:37,(loud rumbling)
MARISHA,02:17:37,02:17:47,"One of you guys that can do illusions and stuff. Should you be like, ""Oh, shit! They're destroying all the boats in Heaven's Falls, oh no!"""
MATT,02:17:47,02:17:55,"Vilya closes her eyes for a second, and as she does, you see her face like... very faint flames licking up the sides of her forearms."
SAM,02:17:55,02:17:55,Oh.
MATT,02:17:55,02:18:19,"(rumbling) She thinks. ""I have a bad feeling, hold on."" And she transforms into a regular owl. Not a large one, a regular one. Coasts past the flames of the sinking ship, the Fiona, and heads through the illusion to the side, best she can, of the waterfall, and vanishes out of sight."
MARISHA,02:18:19,02:18:20,Great. We're never going to see her again.
LIAM,02:18:20,02:18:20,She's gone to--
LAURA,02:18:20,02:18:22,Check it out.
LIAM,02:18:22,02:18:22,-- get an aerial.
TRAVIS,02:18:22,02:18:25,(imitating smoke)
LAURA,02:18:25,02:18:28,"She just said it was a really bad idea to go through that thing as a bird, and then she did it."
MARISHA,02:18:28,02:18:29,Yeah.
LAURA,02:18:29,02:18:33,So it must be pretty serious. (laughter)
MATT,02:18:33,02:18:44,"Yeah. As a large bird, yes. She comes back through from the other side a moment later and lands, retransforms. ""Well, it's erupting."" (laughter)"
MARISHA,02:18:44,02:18:46,"Hmm, hmm."
MATT,02:18:46,02:18:53,And you feel another (rumbling) Rumble. (laughter)
SAM,02:18:53,02:18:53,We suck at this game!
MATT,02:18:53,02:18:56,More stones are... (splashes)
LIAM,02:18:56,02:18:59,"I'm hoping that Caleb has had enough time, a minute, to cast Fortune's Favor."
MATT,02:18:59,02:18:59,Yes.
LIAM,02:18:59,02:19:02,I think it's time to go--
TRAVIS,02:19:02,02:19:02,In.
LIAM,02:19:02,02:19:03,Into the butthole.
TRAVIS,02:19:03,02:19:03,I agree.
LIAM,02:19:03,02:19:05,Immediately.
LAURA,02:19:05,02:19:07,We're not going to get him out of here?
TRAVIS,02:19:07,02:19:13,"One thing. If he's pissed and that's what's causing the volcano to erupt, the water will be boiling. It's going to be very hot."
MARISHA,02:19:13,02:19:15,Yeah.
SAM,02:19:15,02:19:16,"(high-pitched) So why are we going to go in, then?"
TRAVIS,02:19:16,02:19:22,I think we forgot to talk about that part. Remember he got mad and it started to get a little warm?
LAURA,02:19:22,02:19:22,"Yeah, you remember?"
MARISHA,02:19:22,02:19:23,Saving throws.
SAM,02:19:23,02:19:30,"Are we going to lie? Are we going to say, like, ""Oh, it was crazy! It was crazy! Someone's destroying your ships! We tried to stop them!"" Or..."
TRAVIS,02:19:30,02:19:31,"We're going in, and we've got five minutes--"
LAURA,02:19:31,02:19:37,"Or do we say fuck it, and we try to keep destroying the ships, and hope he'll come out?"
TRAVIS,02:19:37,02:19:37,Blow another one up.
LAURA,02:19:37,02:19:39,Do one more.
MARISHA,02:19:39,02:19:39,How many boats are burning?
ASHLEY,02:19:39,02:19:41,"Oh, man."
MARISHA,02:19:41,02:19:41,How many boats are on fire?
SAM,02:19:41,02:19:45,Just two. One?
MATT,02:19:45,02:19:47,"Just the Fiona, that's it."
MARISHA,02:19:47,02:19:50,Maybe we should blow up more boats?
ASHLEY,02:19:50,02:19:51,I feel like he'd let them all burn.
SAM,02:19:51,02:19:51,This is a terrible idea!
LAURA,02:19:51,02:19:54,You think?
TRAVIS,02:19:54,02:19:58,"I don't know. If people start smashing your shit, and you've got 20 of something and they only break one, you're like, ""Eh, not so bad."""
LAURA,02:19:58,02:20:00,"""I'm pissed."""
TRAVIS,02:20:00,02:20:04,"Halfway through there, you're like, ""Fuck it!"" Unlocking the door and coming out, right?"
SAM,02:20:04,02:20:04,That's what I would do.
ASHLEY,02:20:04,02:20:06,Try it.
MATT,02:20:06,02:20:08,It's up to you guys. What are you going to do?
MARISHA,02:20:08,02:20:15,What if he's trapped in the volcano and he can't come out no matter how hard he wants to?
TRAVIS,02:20:15,02:20:15,Wants to come out.
MARISHA,02:20:15,02:20:17,Hmm hmm.
SAM,02:20:17,02:20:21,You could be right. It could be safe for him in there or something. I don't know.
TALIESIN,02:20:21,02:20:21,I think he's stuck in there.
MATT,02:20:21,02:20:22,What are you doing?
TRAVIS,02:20:22,02:20:24,"You want to smoke another boat, or we going in?"
LIAM,02:20:24,02:20:29,Caleb's already burning the next ship. (laughter)
MATT,02:20:29,02:20:29,Which ship are you burning?
SAM,02:20:29,02:20:31,The Banshee.
LAURA,02:20:31,02:20:32,Whatever's next to the Fiona.
LIAM,02:20:32,02:20:33,Whatever's next to the Fiona.
MATT,02:20:33,02:20:33,All right.
TRAVIS,02:20:33,02:20:34,Caleb's just like (groans).
MATT,02:20:34,02:20:38,That's right. (laughs) You guys look over and just already just lobbing Fire Bolt.
TRAVIS,02:20:38,02:20:41,With straight hair sticking out. (groans)
TALIESIN,02:20:41,02:20:42,"Okay, we're doing this."
MATT,02:20:42,02:21:03,"This ship continues to burn slowly. It takes about 10 minutes or so for it to become a fair inferno. The sails begin to catch, and you watch as the Sea Banshee becomes another burning ship. It's going to take a little bit, but it is now on fire. Are you going to leave that and move to another one? What are you doing?"
LIAM,02:21:03,02:21:04,I will until someone tells me different.
LAURA,02:21:04,02:21:06,"No, no, no, no, no."
TRAVIS,02:21:06,02:21:06,Burn it. Keep going.
TALIESIN,02:21:06,02:21:08,Keeping Resistance up.
TRAVIS,02:21:08,02:21:08,We don't need these ships. He does.
MATT,02:21:08,02:21:10,Third ship or not?
LIAM,02:21:10,02:21:12,Has anything changed at all in the 10 minutes that Caleb spent?
MATT,02:21:12,02:21:28,"As it begins to burn, you hear and feel another (rumbling) another heavy reverberance, almost like an explosion from the outside, and you all can feel and hear it from the inside of this chamber."
TRAVIS,02:21:28,02:21:30,He's just like a uranium rod that's overreacting.
MARISHA,02:21:30,02:21:30,Yeah.
MATT,02:21:30,02:21:33,(roaring fire)
LAURA,02:21:33,02:21:33,"Oh, god."
TRAVIS,02:21:33,02:21:34,We got to go. We got to go in.
LAURA,02:21:34,02:21:36,We got to go in. We're going to kill everybody.
TRAVIS,02:21:36,02:21:38,We're going to kill ourselves.
LAURA,02:21:38,02:21:38,If they're not already dead.
TRAVIS,02:21:38,02:21:39,But we got to go in.
MARISHA,02:21:39,02:21:41,"Yeah, we're sitting--"
LAURA,02:21:41,02:21:42,"We're going to die, you guys. This could kill us all."
MATT,02:21:42,02:21:45,What are you doing?
TRAVIS,02:21:45,02:21:50,"You know, we don't have to go in. (laughs) We could just go outside and wait."
SAM,02:21:50,02:21:52,We could just leave everyone here to die. (laughs)
TRAVIS,02:21:52,02:21:56,"Yeah, Vilya can step through a tree, take us to another continent."
MATT,02:21:56,02:22:01,The second ship is now beginning to sink as you guys are waiting. Rumbling continuing. What are you doing?
TRAVIS,02:22:01,02:22:02,"We're going in, right?"
MARISHA,02:22:02,02:22:09,Vilya. Have you ever wanted to go to Wildemount?
LAURA,02:22:09,02:22:09,We should go in.
MATT,02:22:09,02:22:10,"""Not particularly."""
MARISHA,02:22:10,02:22:10,"(sighs) Okay, we should go in."
LAURA,02:22:10,02:22:13,We have to save everyone.
MARISHA,02:22:13,02:22:14,Okay.
TRAVIS,02:22:14,02:22:14,Everybody on a rope?
SAM,02:22:14,02:22:17,We go in?
TRAVIS,02:22:17,02:22:18,Let's jump into the water.
MATT,02:22:18,02:22:18,You guys are going in?
TRAVIS,02:22:18,02:22:20,"Yes, yes?"
ASHLEY,02:22:20,02:22:20,Yes.
TRAVIS,02:22:20,02:22:21,Yes?
MARISHA,02:22:21,02:22:21,Yeah.
TRAVIS,02:22:21,02:22:23,Thumbs up?
MARISHA,02:22:23,02:22:23,Yes!
TRAVIS,02:22:23,02:22:25,Form Voltron. Get your thumb up!
MARISHA,02:22:25,02:22:27,"No, come on, Veth!"
TRAVIS,02:22:27,02:22:27,"Get your thumb up, Veth!"
LAURA,02:22:27,02:22:30,How long did we say it took to get through the tunnels?
MARISHA,02:22:30,02:22:30,An hour.
MATT,02:22:30,02:22:32,"From the other side, it was about an hour, yeah."
LAURA,02:22:32,02:22:34,"Jesus, okay."
SAM,02:22:34,02:22:36,"From the other side. This side, we don't know how long it takes."
MATT,02:22:36,02:22:37,You don't know long it will take from this side.
SAM,02:22:37,02:22:38,It could be less.
TRAVIS,02:22:38,02:22:39,We don't even know where this goes.
LAURA,02:22:39,02:22:50,"I'm going to be behind Beau and I'm just going to be ready to, as soon as I see the opening into the cavern, hit her and cast Freedom of Movement."
MATT,02:22:50,02:22:50,You've got it.
TRAVIS,02:22:50,02:22:52,"I'm a super-fast swimmer too, like him."
SAM,02:22:52,02:22:54,Are we all tied together still?
LAURA,02:22:54,02:22:56,"We're all holding onto the rope, but it didn't matter the last time."
TALIESIN,02:22:56,02:22:59,"Actually, if you get there, you undo it, yeah."
MATT,02:22:59,02:23:01,All right. So you guys all dive into the water.
TRAVIS,02:23:01,02:23:01,Yeah.
TALIESIN,02:23:01,02:23:02,"Oh, boy."
SAM,02:23:02,02:23:02,Fuck!
LIAM,02:23:02,02:23:03,Terrible.
TRAVIS,02:23:03,02:23:03,Feels great.
MATT,02:23:03,02:23:09,(splashes) You all dive in. Vilya uncomfortably dives in with you. The water is warmer.
SAM,02:23:09,02:23:11,Sure.
MARISHA,02:23:11,02:23:11,"Oh, so it's gotten warmer."
MATT,02:23:11,02:23:13,It's gotten warmer.
MARISHA,02:23:13,02:23:13,-- since I checked.
MATT,02:23:13,02:23:26,"And as opposed to when you first touched it, the cold ocean temperature is now a lukewarm, a little above room temperature warmth. It's like a comfortable bath."
LIAM,02:23:26,02:23:28,"That's just because we nervously peed in it, though."
MATT,02:23:28,02:23:28,"Well, there's that too."
ASHLEY,02:23:28,02:23:30,Yeah.
MATT,02:23:30,02:23:33,So what is the marching order for this entering?
LAURA,02:23:33,02:23:37,We're going to burn alive the minute we get in there.
MARISHA,02:23:37,02:23:38,Fjord is going to lead us.
MATT,02:23:38,02:23:40,Fjord is leading. Who's after Fjord?
TRAVIS,02:23:40,02:23:40,Beau.
MARISHA,02:23:40,02:23:41,"I'll be after, yeah."
TRAVIS,02:23:41,02:23:41,It's Jester.
MATT,02:23:41,02:23:43,All right.
LAURA,02:23:43,02:23:43,"Can't we just, like..."
MARISHA,02:23:43,02:23:47,And then Yasha and Caduceus.
MATT,02:23:47,02:23:47,"Wait, Yasha's after there?"
MARISHA,02:23:47,02:23:49,After Beau.
MATT,02:23:49,02:23:52,"And then it's Yasha, and then Caduceus."
MARISHA,02:23:52,02:23:52,Uh-huh.
MATT,02:23:52,02:23:56,All righty. And then?
SAM,02:23:56,02:23:56,"Me, I guess. Us."
LIAM,02:23:56,02:24:01,"Sure, yeah, no. (laughter) Don't put me last. Don't put me last. I'll go behind the firbolg."
MATT,02:24:01,02:24:01,Vilya will go last.
SAM,02:24:01,02:24:04,I'll go last.
MATT,02:24:04,02:24:17,"All right. So you swim down and you can see the glowing orange entrance of the torchbloom plants that represent the beginning of this. Fjord, as you get there, I need you to go ahead and make a wisdom saving throw for me with advantage."
TRAVIS,02:24:17,02:24:28,Yeah. With advantage. 14.
MATT,02:24:28,02:24:28,14.
MARISHA,02:24:28,02:24:33,(laughs)
MATT,02:24:33,02:24:44,"As you approach, you see it, and you begin to get in front of the tunnel, and you get there and go, ""Okay. Okay, I know where it is. I know where it is. I got to get there, I got to get there."" And you take off."
LAURA,02:24:44,02:24:46,"So, he's holding the rope, so all of us just start--"
MATT,02:24:46,02:24:54,"All of you guys... Well, no, you're already swimming fast, but you now swim with purpose, and something is guiding you the right path now."
TRAVIS,02:24:54,02:24:54,I know where to go.
MATT,02:24:54,02:24:57,One after the next.
MARISHA,02:24:57,02:24:58,He's got the bug.
MATT,02:24:58,02:25:07,"Could everybody roll a wisdom saving throw for me with advantage, please?"
MATT,02:25:07,02:25:08,Jester.
LAURA,02:25:08,02:25:08,24.
MATT,02:25:08,02:25:10,24.
LIAM,02:25:10,02:25:10,22.
SAM,02:25:10,02:25:12,19.
ASHLEY,02:25:12,02:25:12,18.
TALIESIN,02:25:12,02:25:13,24.
MARISHA,02:25:13,02:25:13,16.
MATT,02:25:13,02:25:27,"16. Everyone but Beauregard is able to hold onto their mental state, but Beauregard, you also find yourself pushed forward. Now, you're all single file, so--"
MARISHA,02:25:27,02:25:27,"Yeah, captain! Let's go!"
TRAVIS,02:25:27,02:25:30,Yeah!
MATT,02:25:30,02:25:48,"So, the two of you are just rushing through the tunnels, so you can see where it branches off. Initially, one splinter and then three, and then it just becomes like numerous tunnels that splinter off, these lava tubes that are within the water. But the two people that are leading it seem to know where they're going."
LAURA,02:25:48,02:25:48,Great.
MATT,02:25:48,02:26:30,"And following their lead, you rush through for five, 10, 15, 20 minutes. The water getting slightly warmer as you progress. Not uncomfortable, but warmer. You're now getting to that, like... Almost to a hot shower-type temperature, where it's prickly, but it's tolerable. Roughly 35 minutes of rapid swimming, which the rest of you are starting feeling really nervous. The only light that's present here, because they have night vision, you can't see down here, Caleb, so you're going to have to keep some lights up with you if you want to be able to follow."
LIAM,02:26:30,02:26:32,"But at the moment I'm roped, right?"
MATT,02:26:32,02:26:35,Yeah. So are you just letting the rope take you?
LIAM,02:26:35,02:26:35,"For now, yeah."
MATT,02:26:35,02:26:42,"Okay. I need you, Caleb, to go ahead and make a dexterity saving throw for me."
LIAM,02:26:42,02:26:43,Okay.
LAURA,02:26:43,02:26:46,Would the fire flowers give off any kind of glow?
MATT,02:26:46,02:26:51,"Actually, no. The torchbloom does give off a little bit of light."
LIAM,02:26:51,02:26:51,I thought.
MATT,02:26:51,02:26:54,So yes. You are totally right. So what'd you roll?
LIAM,02:26:54,02:26:55,I got a 20!
MATT,02:26:55,02:27:46,"A 20. All right. So, even letting the rope take you, you push away at times to keep yourself from colliding with the sides of the tunnel, the orange... It feels like an odd similarity to... My brain keeps going to the other side in Poltergeist, how you're just this continuous tunnels that just continue to shift and change, and they move with the water, as the torchbloom shifts with the swimming and the separation of the liquid you guys are swimming through. Eventually, you see it begins to widen, as both Fjord and Beauregard make your way towards what looks to be a familiar but different opening into a chamber."
LAURA,02:27:46,02:27:50,"Oh, as soon as I see the opening-- (splutters) I cast Freedom of Movement on Beau."
MATT,02:27:50,02:27:52,"Okay, Beauregard, you have Freedom of Movement."
MARISHA,02:27:52,02:27:53,Dope.
MATT,02:27:53,02:27:54,Anybody else do anything before you get to him?
LIAM,02:27:54,02:27:54,Mirror Image.
LAURA,02:27:54,02:27:56,Freedom of Movement on Yasha.
TALIESIN,02:27:56,02:27:57,"Oh, yeah, yeah, yeah."
MATT,02:27:57,02:27:57,Okay.
SAM,02:27:57,02:27:59,I'll throw up Mage Hand.
MATT,02:27:59,02:27:59,Sure.
LIAM,02:27:59,02:28:01,I'm casting Mirror Image.
MATT,02:28:01,02:28:05,"Mirror Image on yourself, all right. Anything else? Okay."
LAURA,02:28:05,02:28:10,"Can I do something else? Or since I cast Freedom of Movement, is that my only thing I can do?"
MATT,02:28:10,02:28:20,As you're approaching... They begin to slow down as they get to the edge point. You can do it if you want to keep it subtle.
LAURA,02:28:20,02:28:24,"Right before we go through, I wanted to Invoke Duplicity."
MATT,02:28:24,02:28:26,"Okay, yeah, that's easy enough."
LAURA,02:28:26,02:28:26,Okay.
MATT,02:28:26,02:28:32,You can do it. Okay. So Duplicity has been Invoked.
SAM,02:28:32,02:28:32,This plan cannot fail.
MARISHA,02:28:32,02:28:35,Oh my god.
SAM,02:28:35,02:28:36,We have the element of surprise...
LAURA,02:28:36,02:28:36,We got to go fast.
SAM,02:28:36,02:28:39,What are we doing?
LAURA,02:28:39,02:28:39,Just go in and attack.
SAM,02:28:39,02:28:41,We're just (exclaiming)?
MARISHA,02:28:41,02:28:47,This feels like the most we've planned and the least we've planned all at the same time.
LAURA,02:28:47,02:28:53,"Literally, I think we go in immediately and attack, the minute we go through the door."
MATT,02:28:53,02:28:54,As you guys enter the chamber--
SAM,02:28:54,02:28:55,What could go wrong?
MATT,02:28:55,02:29:30,"-- there are still those pockets of torchbloom that give off a little bit of light throughout the chamber, but it's still a heavily shaded space. You see the familiar stalactites that curl down from the ceiling. This, you're pretty sure, is the exact chamber where you first encountered Vokodo, just from a different perspective. You found an entrance from another side. The temperature in here is quite hot. The water itself, it's beginning to numb the skin a little bit in places with the volume of heat that's within."
MARISHA,02:29:30,02:29:32,Any sign of Vokodo?
MATT,02:29:32,02:29:34,Make a perception check.
TALIESIN,02:29:34,02:29:34,I'll join in that.
MARISHA,02:29:34,02:29:36,"Maybe he's busy, operating the volcano."
SAM,02:29:36,02:29:39,"Yeah, the levers and stuff."
MARISHA,02:29:39,02:29:39,"Yeah, exactly."
TRAVIS,02:29:39,02:29:41,He's the wizard.
MARISHA,02:29:41,02:29:43,"Yeah! Okay, 18?"
TALIESIN,02:29:43,02:29:46,17. Hmm.
MATT,02:29:46,02:30:08,"Okay. You glance up and catch the first sight as in the ceiling portion where he was first spotted when you came through, you see these burning red orbs, these angry eyes, four of them, looking back in your direction, as tendrils (whooshing, crunching) and it pulls its way down like some sort of massive coal-colored cephalopod."
TRAVIS,02:30:08,02:30:11,"Cool, cool."
MATT,02:30:11,02:30:23,"(as Vokodo) ""What have you done?"" And as he yells, the whole chamber-- (rumbling) quakes angrily."
LAURA,02:30:23,02:30:23,Guiding Bolt.
MARISHA,02:30:23,02:30:25,Yeah!
MATT,02:30:25,02:30:36,"Well, we're going to go ahead and take a break. (laughter) And jump back into this beforehand, but as part of that, let me go ahead and set the battle map. (clamoring)"
ASHLEY,02:30:36,02:30:37,"Oh, boy."
SAM,02:30:37,02:30:57,"This impending TPK is brought to you by Dwarven Forge. The journey out into the Wildlands, Dwarven Forge's eighth terrain Kickstarter, launches this weekend. Check it out at DwarvenForge.com/Wildlands. (clamoring)"
MARISHA,02:30:57,02:31:02,"Sometimes I see him buying pretty things, and then I learn later that they're to destroy us."
MATT,02:31:02,02:31:02,(laughs)
ASHLEY,02:31:02,02:31:04,That is beautiful!
TRAVIS,02:31:04,02:31:05,"Oh, it's for all the fish you don't have."
MARISHA,02:31:05,02:31:08,(laughs) Yeah!
SAM,02:31:08,02:31:16,"Any time you see an aquarium receipt on your credit card bill, please text us. (laughter)"
TRAVIS,02:31:16,02:31:18,We've got a early warning system!
MARISHA,02:31:18,02:31:18,I will!
LAURA,02:31:18,02:31:20,There we go.
SAM,02:31:20,02:31:23,"Pet store? No, no, something's wrong!"
ASHLEY,02:31:23,02:31:23,Look at this!
TRAVIS,02:31:23,02:31:24,"Oh, shit."
LAURA,02:31:24,02:31:24,Wow!
ASHLEY,02:31:24,02:31:27,That is so cool!
SAM,02:31:27,02:31:28,Whoa.
MATT,02:31:28,02:31:31,Have essentially entered from this side.
SAM,02:31:31,02:31:31,The element of surprise.
MATT,02:31:31,02:31:33,Exactly.
LIAM,02:31:33,02:31:35,"I mean, we've been doing Guiding Bolt up the butt since campaign one, so--"
MARISHA,02:31:35,02:31:37,It's appropriate.
LAURA,02:31:37,02:31:39,Right?
MATT,02:31:39,02:31:43,So you guys can tell me where you would like to be distributed at this point as you enter the chamber.
LIAM,02:31:43,02:31:47,Outside the volcano on Vo.
TALIESIN,02:31:47,02:31:47,Rumblecusp.
MATT,02:31:47,02:31:51,"Loosely in this space, because that's as far as you've gotten there."
LAURA,02:31:51,02:31:57,"Fjord and Beau are the first ones out, so you guys could get the farthest, or wherever you'd want to be, and he is, what, directly above us?"
MARISHA,02:31:57,02:31:57,"Yeah, where is he?"
MATT,02:31:57,02:32:04,"He is up here. Like, just emerging from the upper portions of the chamber and swimming--"
MARISHA,02:32:04,02:32:07,How far can we get?
MATT,02:32:07,02:32:13,"Right now, to where we start, is about this inch of space here. Just tell me where in that space you want to be."
MARISHA,02:32:13,02:32:21,"I'll try and, uh... Gosh. Can I even try and get up here, or?"
TALIESIN,02:32:21,02:32:22,You have Freedom of Movement from her.
LAURA,02:32:22,02:32:23,Yeah.
MATT,02:32:23,02:32:29,"You do, but for the purposes of this, this is just arriving, and this is happening here, so..."
SAM,02:32:29,02:32:32,"I'll hook right with Caleb, if you're up for it."
LIAM,02:32:32,02:32:34,"Yeah, yeah. To get behind that column, yeah."
SAM,02:32:34,02:32:35,That thing.
MATT,02:32:35,02:32:38,"Okay, that's as far as you guys can get from stepping into the chamber."
MARISHA,02:32:38,02:32:44,"Oh, you guys are behind? Okay, then actually, put me opposite. Put me on this wall over here, Matt, yeah."
MATT,02:32:44,02:32:45,That's about as far as you can get from the entrance there.
MARISHA,02:32:45,02:32:46,That's great.
MATT,02:32:46,02:32:48,Best to scatter. Caduceus?
TALIESIN,02:32:48,02:32:53,"I guess I'm just-- Yeah, or right to the left so I have a partial cover from the column."
MATT,02:32:53,02:32:53,Over here?
TALIESIN,02:32:53,02:32:55,Yeah.
MATT,02:32:55,02:32:55,Okay.
TALIESIN,02:32:55,02:32:57,"Yeah, I got a plan."
MATT,02:32:57,02:33:02,Vilya's going to come right here. Yasha?
TRAVIS,02:33:02,02:33:02,"Where is Vokodo, ish?"
LAURA,02:33:02,02:33:04,Above us.
MATT,02:33:04,02:33:04,Up here.
TRAVIS,02:33:04,02:33:06,"Oh, cool, yeah."
ASHLEY,02:33:06,02:33:12,"Yeah, let me go to the other side of Jester."
SAM,02:33:12,02:33:14,How could we have fucked this up this badly?
LIAM,02:33:14,02:33:14,So much planning--
MATT,02:33:14,02:33:15,Over here?
ASHLEY,02:33:15,02:33:15,"Yeah. Yeah, yeah."
LIAM,02:33:15,02:33:17,-- and debating and discussion.
LAURA,02:33:17,02:33:18,And then we just ran in.
LIAM,02:33:18,02:33:20,We just walked in and done the same thing.
MARISHA,02:33:20,02:33:20,Well...
MATT,02:33:20,02:33:22,"Now, remember."
MARISHA,02:33:22,02:33:22,It was a good plan.
MATT,02:33:22,02:33:24,"You are swimming, so you can go--"
LAURA,02:33:24,02:33:25,Up and down.
MATT,02:33:25,02:33:28,"Up and down. There's upward, vertical travel in this."
TRAVIS,02:33:28,02:33:28,How tall is the cavern?
MATT,02:33:28,02:33:30,The cavern up here is roughly 80 feet.
TRAVIS,02:33:30,02:33:33,80 feet.
SAM,02:33:33,02:33:35,"And is it all water to the top, no?"
MATT,02:33:35,02:33:38,"You haven't swam all the way up there, but from what you can currently see it seems like it might be."
SAM,02:33:38,02:33:40,Oh shit.
ASHLEY,02:33:40,02:33:40,My god.
TRAVIS,02:33:40,02:33:46,You just peek your head out and it's just magma. (burning and screaming) (laughter)
LIAM,02:33:46,02:33:48,There's this much oxygen.
TALIESIN,02:33:48,02:33:48,We can swim in here?
MATT,02:33:48,02:33:50,"Yes, you can."
TALIESIN,02:33:50,02:33:50,We can go up?
MATT,02:33:50,02:34:02,"Yep. But those of you that do not have Freedom of Movement, or have a swim enchantment, like you do, it's half movement and all attack rolls made with weapons are at disadvantage."
SAM,02:34:02,02:34:02,Oof.
MATT,02:34:02,02:34:05,So just be aware.
LAURA,02:34:05,02:34:07,"But Freedom of Movement, that is not the case?"
MATT,02:34:07,02:34:15,Correct. So you guys don't have to worry about that. Spells don't have to worry about it. Ranged weapons have their own unique little weird thing.
SAM,02:34:15,02:34:24,"Sure. Like, if I fire from cover, which would normally be advantage, this would be at disadvantage, so it would just be a straight roll?"
MATT,02:34:24,02:34:34,"Specifically on this, let me get the rules, because this will definitely impact how you deal with this particular battle. (pages flipping)"
MARISHA,02:34:34,02:34:36,The D-Turt idea was very great.
MATT,02:34:36,02:34:39,"It was really great. I really wanted it to work out, I'm so sorry."
TRAVIS,02:34:39,02:34:39,"20 DC, huh?"
MATT,02:34:39,02:34:41,"20 DC, yeah."
LIAM,02:34:41,02:34:41,Kaiju fight?
MARISHA,02:34:41,02:34:43,It would've been great.
MATT,02:34:43,02:34:49,"Here we go. ""Ranged weapon automatically misses if it's beyond the weapon's normal range."""
SAM,02:34:49,02:34:50,I have good range.
MATT,02:34:50,02:34:52,So what's your first range increment?
SAM,02:34:52,02:34:52,Uh...
MARISHA,02:34:52,02:34:54,Don't you have Sharpshooter?
SAM,02:34:54,02:35:04,"I just got a feat, or whatever, so... Well, it hasn't updated, but I think it's 120 feet."
MATT,02:35:04,02:35:04,For your hand crossbow?
LIAM,02:35:04,02:35:07,Because of Sharpshooter.
LAURA,02:35:07,02:35:07,"Oh, yeah, Sharpshooter."
SAM,02:35:07,02:35:10,Sharpshooter.
LAURA,02:35:10,02:35:10,Which gives you 120 feet.
MATT,02:35:10,02:35:14,Let me double-check.
SAM,02:35:14,02:35:18,"""Attacking at long range doesn't impose disadvantage on your ranged weapon attack."""
MATT,02:35:18,02:35:20,"Right, it's still long range, though. It's still the standard range."
SAM,02:35:20,02:35:23,Got it. So 30 feet is my limit.
MATT,02:35:23,02:35:26,"Correct. If you fire further than 30 feet from it, it's going to automatically miss."
SAM,02:35:26,02:35:28,Got it.
MATT,02:35:28,02:35:33,"So keep that in mind, and..."
TRAVIS,02:35:33,02:35:36,"Oh, oh, oh. That's significant."
MATT,02:35:36,02:35:42,"""Any attack has disadvantage unless the weapon is a crossbow."" So it does not have disadvantage, but the bolt only goes as far as 30 feet before it floats."
SAM,02:35:42,02:35:43,Okay.
LIAM,02:35:43,02:35:44,"Let's go, brawlers."
MATT,02:35:44,02:35:44,All right.
LAURA,02:35:44,02:35:51,Great. But bonus on Freedom of Movement is you can't be... Let me--
MARISHA,02:35:51,02:35:53,Can't be grappled.
LAURA,02:35:53,02:35:53,"You can't be grappled, yeah."
MATT,02:35:53,02:35:56,Correct.
LAURA,02:35:56,02:36:03,And you can automatically escape from any non-magical restraints with just using five feet of movement.
